"Perceptually augmented simulator design through decomposition","T. Edmunds; D. K. Pai","Rutgers University, USA; University of British Columbia, USA","World Haptics 2009 - Third Joint EuroHaptics conference and Symposium on Haptic Interfaces for Virtual Environment and Teleoperator Systems","3 Apr 2009","2009","","","505","510","We approach the problem of determining a general method for augmenting haptic simulators to amplify the perceptually salient aspects of the interaction that induce effective skill transfer. Using such a method, we seek to simplify the design of haptic simulators that can improve training effectiveness without requiring expensive improvements in the capability of the rendering hardware. We present a decomposition approach to the automated design of perceptually augmented simulations, and we describe a user-study of the training effectiveness of a search-task simulator designed using our approach vs. an un-augmented simulator. The results indicate that our decomposition approach allows existing psychophysical findings to be leveraged in the design of haptic simulators that effectively impart skill by targeting perceptually significant aspects of the interaction.","","978-1-4244-3858-7","10.1109/WHC.2009.4810890","","https://ieeexplore.ieee.org/stamp/stamp.jsp?arnumber=4810890","","Haptic interfaces;Engines;Shape;Analytical models;Surface texture;Hardware;Surgery;Jamming;Virtual environment;Teleoperators","augmented reality;haptic interfaces;rendering (computer graphics)","perceptually augmented simulator design;haptic simulators augmentation;rendering hardware;search-task simulator","","1","","14","","3 Apr 2009","","","IEEE","IEEE Conferences"
"Measurement system of α β surface radioactive contamination based on Virtual Training","Hui Weihua; Huang Changqiang; Ding Dali","The Engineering Institute, Air Force Engineering University, Xi'an 710038, China; The Engineering Institute, Air Force Engineering University, Xi'an 710038, China; The Engineering Institute, Air Force Engineering University, Xi'an 710038, China","IEEE 2011 10th International Conference on Electronic Measurement & Instruments","10 Oct 2011","2011","2","","90","93","A Virtual Training System of α β surface radioactive contamination measurement is constructed based on Virtual Reality. Firstly, 3-d geometric models about radioactive environment, radioactive environment of surface device, α β detector, surface contamination instrument are constructed, the general radioactive law based on face radioactive source is presented. These models are driving in general program platform using human-computer interaction technology. Furthermore, there are several functions about database sharing, fault diagnosis, examining evaluation and on-time help which realize the whole system virtual training. Program show this training system avoid “nuclear fear” psychology and improve staff's training effect.","","978-1-4244-8161-3","10.1109/ICEMI.2011.6037772","","https://ieeexplore.ieee.org/stamp/stamp.jsp?arnumber=6037772","virtual training;radioactivity;α ray;β ray;radiation field","Pollution measurement;Training;Surface contamination;Solid modeling;Instruments;Software","nuclear power stations;radioactivity measurement;surface contamination;virtual reality","measurement system;surface radioactive contamination;virtual training;virtual reality;3D geometric models;radioactive environment;surface contamination instrument;human-computer interaction technology;database sharing;fault diagnosis","","","","4","","10 Oct 2011","","","IEEE","IEEE Conferences"
"A Ubiquitous Context-Aware Environment for Surgical Training","P. Ordonez; P. Kodeswaran; V. Korolev; W. Li; O. Walavalkar; B. Elgamil; A. Joshi; T. Finin; Y. Yesha; I. George","Department of Computer Science and Electrical Engineering, University of Maryland, Baltimore County, Baltimore, MD USA. ordopa1@cs.umbc.edu; Department of Computer Science and Electrical Engineering, University of Maryland, Baltimore County, Baltimore, MD USA. palanik1@cs.umbc.edu; Department of Computer Science and Electrical Engineering, University of Maryland, Baltimore County, Baltimore, MD USA. vkorol1@cs.umbc.edu; Department of Computer Science and Electrical Engineering, University of Maryland, Baltimore County, Baltimore, MD USA. wenjia1@cs.umbc.edu; Department of Computer Science and Electrical Engineering, University of Maryland, Baltimore County, Baltimore, MD USA. onkar1@cs.umbc.edu; Department of Computer Science and Electrical Engineering, University of Maryland, Baltimore County, Baltimore, MD USA. ben8@cs.umbc.edu; Department of Computer Science and Electrical Engineering, University of Maryland, Baltimore County, Baltimore, MD USA. joshi@cs.umbc.edu; Department of Computer Science and Electrical Engineering, University of Maryland, Baltimore County, Baltimore, MD USA. finin@cs.umbc.edu; Department of Computer Science and Electrical Engineering, University of Maryland, Baltimore County, Baltimore, MD USA. yeyesha@cs.umbc.edu; Department of General Surgery, University of Maryland Medical Center, Baltimore, MD USA. igeorge@smail.umaryland.edu","2007 Fourth Annual International Conference on Mobile and Ubiquitous Systems: Networking & Services (MobiQuitous)","12 Feb 2008","2007","","","1","6","The age of technology has changed the way that surgeons are being trained. Traditional methodologies for training can include lecturing, shadowing, apprenticing, and developing skills within live clinical situations. Computerized tools which simulate surgical procedures and/or experiences can allow for ""virtual"" experiences to enhance the traditional training procedures that can dramatically improve upon the older methods. However, such systems do not to adapt to the training context. We describe a ubiquitous computing system that tracks low-level events in the surgical training room (e.g. student locations, lessons completed, learning tasks assigned, and performance metrics) and from these derive the training context. This can be used to create an adaptive training system.","","978-1-4244-1024-8","10.1109/MOBIQ.2007.4451029","","https://ieeexplore.ieee.org/stamp/stamp.jsp?arnumber=4451029","context awareness;ubiquitous computing;surgical training","Surgery;Ubiquitous computing;Pervasive computing;Computational modeling;Shadow mapping;Computer simulation;Context awareness;Medical diagnostic imaging;Intelligent sensors;Context modeling","biomedical education;computer based training;medical computing;ubiquitous computing;virtual reality","ubiquitous context-aware environment;surgical training;surgeons;lecturing;shadowing;apprenticing;skills development;computerized tools;surgical procedure simulation;virtual experiences;student locations;learning tasks;performance metrics;adaptive training system","","2","","25","","12 Feb 2008","","","IEEE","IEEE Conferences"
"Pilot's control actions during maneuvering support system software and its implementation in flight simulator for pilot's tactical skills training","O. A. Yakimenko","Air Force Eng. Acad., Moscow, Russia","Proceedings of the IEEE 1998 National Aerospace and Electronics Conference. NAECON 1998. Celebrating 50 Years (Cat. No.98CH36185)","6 Aug 2002","1998","","","367","374","There are considered in present paper the general aspects of mathematical foundation of onboard pilot's control actions during maneuvering support system (PCASS) software and its implementation in tactical flight simulator for pilot's control actions during maneuvering skills training via shortcut-time spatial trajectories optimization and their visualization in the view of ""road-in-the-sky"" image for further tracking in direct with foresee regime or (semi) automatic mode. There are disclosed two specially designed for this purpose ""fast"" modifications of direct method of variational tasks solution-the first (for short-term trajectories with strong constrains on control functions) based on 5/sup th/-7/sup th/ power polynomials optimal trajectory approximation, the second (for long-term flight on a route trajectories) based on spline approximation. For long-distance guidance on the moveable object it's utilized several-steps approach based on mentioned 5/sup th/-7/sup th/ power polynomials optimization. Paper is attended with examples of designed software operation on seminatural advanced simulator of high maneuverable airplane with investigation prototype of PCASS.","0547-3578","0-7803-4449-9","10.1109/NAECON.1998.710138","","https://ieeexplore.ieee.org/stamp/stamp.jsp?arnumber=710138","","Control systems;System software;Automatic control;Polynomials;Software systems;Aerospace simulation;Trajectory;Visualization;Optimal control;Spline","aircraft computers;aircraft control;aerospace simulation;computer based training;digital simulation;optimisation","maneuvering support system software;flight simulator;tactical skills training;onboard pilot's control actions;tactical flight simulator;maneuvering skills training;spatial trajectories optimization;visualization;polynomials;optimal trajectory approximation;spline approximation;long-distance guidance;seminatural advanced simulator;maneuverable airplane;pilot","","1","","8","","6 Aug 2002","","","IEEE","IEEE Conferences"
"Smart-grid based substation testing simulator design for the South Korean power distribution system","S. Lee; Min-Uk Yang; Kern-Joong Kim; Y. T. Yoon; S. Moon; J. Park","Power System Research Div., (PSRD), KESRI, Bldg. 130, Seoul National Univ., Korea; Dept. of Electrical Eng., Chungnam National Univ., Daejeon, Korea; Dept. of Electrical Eng., Chungnam National Univ., Daejeon, Korea; Dept. of Electrical and Computer Eng., Bldg. 301, Seoul National Univ., Korea; Dept. of Electrical and Computer Eng., Bldg. 301, Seoul National Univ., Korea; Dept. of Electrical and Computer Eng., Bldg. 301, Seoul National Univ., Korea","2013 IEEE Power & Energy Society General Meeting","25 Nov 2013","2013","","","1","5","In this paper, we present a smart grid (SG)-based substation testing simulator (STS) design for the South Korean power distribution system. The presented STS can serve as both a test bed for new devices and as a training facility for education. It features closed-loop testing, and reflects both control/protection functions within the substation and interaction with the Web or a telecontrol system (IEC61850, DNP, IEC60870-5, Modbus, etc). This STS can save certification time for the domestic/international standard fitness required for developed devices before a field test. The constituted algorithms have substation topology processing, relay action sequence, and state estimation. The substation data can be stored in a database management system (DBMS) after the effective analysis for the results of the SG-based STS. For the development of a new system and an educational environment, the concept of open systems is applied to a substation testing system. The proposed STS will be designed on a substation structure in the Korea Electric Power Corporation (KEPCO).","1932-5517","978-1-4799-1303-9","10.1109/PESMG.2013.6672239","","https://ieeexplore.ieee.org/stamp/stamp.jsp?arnumber=6672239","Substation Testing Simulator (STS);IEC 61850;SG;DBMS;DERs;Korea Electric Power Corporation (KEPCO)","Substations;Algorithm design and analysis;Power distribution;Testing;Relays;Educational institutions","computer based training;database management systems;power distribution protection;power engineering computing;power engineering education;power system control;simulation;smart power grids;substations;telecontrol;testing","smart grid based substation testing simulator design;power distribution system;training facility;closed loop testing;control function;protection function;telecontrol system;certification time;standard fitness;field test;substation topology processing;relay action sequence;state estimation;database management system;DBMS","","1","","15","","25 Nov 2013","","","IEEE","IEEE Conferences"
"Haptic devices synchronization into a software simulator","G. Ion-Eugen; R. Ionut-Cristian; B. N. George","Department of Computers and Information Technology, University of Craiova, Romania; Department Mechatronics and Robotics, University of Craiova, Romania; Department Mechatronics and Robotics, University of Craiova, Romania","2017 18th International Carpathian Control Conference (ICCC)","7 Jul 2017","2017","","","440","445","In this paper is presented the design and developing process of a software simulator that allows both a pre-surgical planning and training future physician about anatomy and liver damage. For this it was made a design three-dimensional (3D) liver and was added properties of soft tissues in order to have a simulator surgery as realistic as to provide a complete answer and complex palpation by devices Geomagic Touch X and Phantom Omni. It highlighted the acute need for such simulator in medicine in general and surgery in particular, and its advantages over traditional methods of learning. Emphasis was placed on the use of virtual reality and haptic feedback to improve the realism of the simulator. The final goal was the synchronization between two or more haptic device using events to acquire more feedback information in the real time. Experiments conducted using different obj flies representing normal liver, hepatic liver, cirrhosis liver and cystic liver demonstrated the reliability and the robustness of the proposed method. The next step will involve the usage of Augmented Reality and Virtual Reality to provide training to physicians and healthcare staff.","","978-1-5090-4862-5","10.1109/CarpathianCC.2017.7970440","","https://ieeexplore.ieee.org/stamp/stamp.jsp?arnumber=7970440","haptic device;software simulator;force feedback;behavior model;algorithms;haptic rendering;collision detection","","augmented reality;biomedical education;computer based training;digital simulation;force feedback;haptic interfaces;health care;liver;medicine;personnel;realistic images;surgery;synchronisation","haptic device synchronization;software simulator;pre-surgical planning;physician training;anatomy;liver damage;three-dimensional liver design;3D liver design;soft tissues;realistic surgery simulator;complex palpation;Geomagic Touch X;Phantom Omni;medicine;virtual reality;haptic feedback;feedback information;hepatic liver;cirrhosis liver;cystic liver;reliability;augmented reality;healthcare staff","","","","10","","7 Jul 2017","","","IEEE","IEEE Conferences"
"Intelligent wheelchair simulator for users' training: Cerebral palsy children's case study","B. M. Faria; L. P. Reis; S. C. Teixeira; J. Faias; N. Lau","ESTSP/IPP - Esc. Sup. de Tecnologia da Saúde do Porto / Instituto Politécnico do Porto, Porto e Aveiro, Portugal; EEUM/DSI - Escola de Engenharia da Universidade do Minho, Computadores da Universidade do Porto, Guimarães e Porto, Portugal; ESTSP/IPP - Esc. Sup. de Tecnologia da Saúde do Porto / Instituto Politécnico do Porto, Porto, Portugal; ESTSP/IPP - Esc. Sup. de Tecnologia da Saúde do Porto / Instituto Politécnico do Porto, Porto, Portugal; DETI/UA - Departamento de Eletrónica, Telecomunicações e Informática / Universidade de Aveiro, Aveiro, Portugal","2013 8th Iberian Conference on Information Systems and Technologies (CISTI)","17 Oct 2013","2013","","","1","6","The use of real context simulation programs for training driving skills to control an intelligent wheelchair is an emergent area. The aim of this study is to verify if the exigency of use of the simulator of the IntellWheels project is adequate to the skills of children with cerebral palsy. A group study case was performed using children with cerebral palsy classified in the levels IV and V of the Gross Motor Function Classification System, aged between 6 and 12 years old. The user's performance in a wheelchair driving game using the Joystick and the Wiimote (for head movements' recognition) and the users' opinions about the system were studied. Results suggest that the system matches the children skills and it was verified that it was easier to drive the wheelchair with the joystick for most of the participants. Generally, the participants presented positive reactions, showing themselves satisfied with the experiment and convicted about the wheelchair future usability.","2166-0727","978-989-98434-0-0","","","https://ieeexplore.ieee.org/stamp/stamp.jsp?arnumber=6615736","Intelligent Wheelchair;Simulator;Multimodal Interface;Cerebral Palsy","Wheelchairs;Instruments;Training;Usability;XML;Medical treatment;Context","computer games;handicapped aids;interactive devices;simulation;wheelchairs","wheelchair future usability;children skills;Wiimote;joystick;wheelchair driving game;user performance;gross motor function classification system;IntellWheels project;driving skills training;simulation programs;cerebral palsy;users training;intelligent wheelchair simulator","","","","45","","17 Oct 2013","","","IEEE","IEEE Conferences"
"Generative Games for Ground and Simulator Training of Flight Crew","A. V. Zakharov; V. P. Tretyakov","Leading Instructor “Rossiya Airlines”, Moscow, Russia; Saint Petersburg State University, St. Petersburg, Russia","2018 Third International Conference on Human Factors in Complex Technical Systems and Environments (ERGO)s and Environments (ERGO)","23 Aug 2018","2018","","","155","159","The generative games in aviation are used to increase readiness for actions in an extreme situation due to accelerated building and further maintenance of the IMAGE of a PROFESSIONAL, including the image of professional flight activity, which leads to increase in reliability of the activity. An important element of the generative scenario in a crew / group is to add experience and put it into practice, i.e. to strengthen it. At the same time, different crews / groups creating the participants' experience resort to different scenarios, which can finally lead to absolutely unlike results including those that concern flight safety. In the course of a game situation, pilots can see the interaction process, on the one hand, and they are engaged into it, on the other hand. Everyone resorts to their own scenario and can see what their actions lead to in the end of the game. During the game, one could study how leadership skills are demonstrated and how situational understanding of any following action is formed by the group when a passenger in a game situation spontaneously assumes responsibility and says: “Landed ...”, i.e. the game generates a chain of the situations that requests decision-making. In general, one could speak of development of skills recommended by the International community in course of games. The basis is made by of participants' interaction in a game situation together with resorting to one's own scenario.","","978-1-5386-5612-9","10.1109/ERGO.2018.8443864","","https://ieeexplore.ieee.org/stamp/stamp.jsp?arnumber=8443864","professional pilot training;generative games;competencies;international standards;ground & simulator training;human factors /CRM training;safety","Games;Training;Aircraft;Safety;Decision making;Human factors;Personnel","aerospace safety;aerospace simulation;avionics;computer based training;computer games;decision making;game theory","generative games;simulator training;flight crew;professional flight activity;game situation;situational understanding;flight safety;aviation","","","","16","","23 Aug 2018","","","IEEE","IEEE Conferences"
"A case study of virtual circuit laboratory for undergraduate student courses","Gu Rong; Zhu Miaoliang; Dong Yabo; Shi Dandan; Wang Yonggu","Coll. of Comput. Sci. & Technol., Zhejiang Univ., Hangzhou, China; Coll. of Comput. Sci. & Technol., Zhejiang Univ., Hangzhou, China; Coll. of Comput. Sci. & Technol., Zhejiang Univ., Hangzhou, China; NA; NA","2005 6th International Conference on Information Technology Based Higher Education and Training","19 Dec 2005","2005","","","T2B/21","T2B/24","The purpose of this study is to design and develop a Web based circuit virtual laboratory for undergraduate student courses, which can be treated as an accessorial tool for enhancing instruction. The study firstly reviews the general concept of virtual laboratory and some related works. Secondly, the design and development of the system framework of this circuit virtual laboratory is discussed. Finally, the paper introduces the evaluation from the tutors and students using the virtual laboratory. One of the major objectives of this project is the client adopted rich Internet applications (RIAs) to enhance the students' learning experience and provides significant impact on users' learning motivation. With the support of this system, the students' uninfluenced learning and experiment process can be carried out at any place of the world where Web access is available.","","0-7803-9141-1","10.1109/ITHET.2005.1560231","","https://ieeexplore.ieee.org/stamp/stamp.jsp?arnumber=1560231","Case Study;Circuit Simulation;Virtual Laboratory;Undergraduate Courses","Computer aided software engineering;Circuits;Laboratories;Educational technology;Instruments;Internet;Educational institutions;Computer science;Communication system control;Virtual reality","computer aided instruction;electronic engineering education;laboratories;Internet;virtual reality","Web virtual circuit laboratory;undergraduate student course;Internet;student learning experience;user learning motivation;uninfluenced learning;Web access;circuit simulation","","3","","18","","19 Dec 2005","","","IEEE","IEEE Conferences"
"Grasp Recognition with Uncalibrated Data Gloves - A Comparison of Classification Methods","G. Heumer; H. B. Amor; M. Weber; B. Jung","VR and Multimedia Group, Institute of Informatics, TU Bergakademie Freiberg, Germany. e-mail: guido.heumer@informatik.tu-freiberg.de; VR and Multimedia Group, Institute of Informatics, TU Bergakademie Freiberg, Germany. e-mail: amor@informatik.tu-freiberg.de; VR and Multimedia Group, Institute of Informatics, TU Bergakademie Freiberg, Germany. e-mail: matthias.weber@informatik.tu-freiberg.de; VR and Multimedia Group, Institute of Informatics, TU Bergakademie Freiberg, Germany. e-mail: jung@informatik.tu-freiberg.de","2007 IEEE Virtual Reality Conference","23 Apr 2007","2007","","","19","26","This paper presents a comparison of various classification methods for the problem of recognizing grasp types involved in object manipulations performed with a data glove. Conventional wisdom holds that data gloves need calibration in order to obtain accurate results. However, calibration is a time-consuming process, inherently user-specific, and its results are often not perfect. In contrast, the present study aims at evaluating recognition methods that do not require prior calibration of the data glove, by using raw sensor readings as input features and mapping them directly to different categories of hand shapes. An experiment was carried out, where test persons wearing a data glove had to grasp physical objects of different shapes corresponding to the various grasp types of the Schlesinger taxonomy. The collected data was analyzed with 28 classifiers including different types of neural networks, decision trees, Bayes nets, and lazy learners. Each classifier was analyzed in six different settings, representing various application scenarios with differing generalization demands. The results of this work are twofold: (1) We show that a reasonably well to highly reliable recognition of grasp types can be achieved - depending on whether or not the glove user is among those training the classifier - even with uncalibrated data gloves. (2) We identify the best performing classification methods for recognition of various grasp types. To conclude, cumbersome calibration processes before productive usage of data gloves can be spared in many situations.","2375-5334","1-4244-0905-5","10.1109/VR.2007.352459","","https://ieeexplore.ieee.org/stamp/stamp.jsp?arnumber=4161001","Data Glove;Calibration;Grasp Recognition;Classification Methods;I.3.6 [Computer Graphics]: Methodology and Techniques¿Interaction techniques;I.3.7 [Computer Graphics]: Three-Dimensional Graphics and Realism¿[Virtual Reality]","Data gloves;Calibration;Shape;Sensor phenomena and characterization;Testing;Taxonomy;Data analysis;Classification tree analysis;Neural networks;Decision trees","calibration;data gloves;pattern classification;virtual prototyping;virtual reality","grasp recognition;uncalibrated data gloves;classification methods;object manipulation;Schlesinger taxonomy;cumbersome calibration","","31","","24","","23 Apr 2007","","","IEEE","IEEE Conferences"
