"Gamifying Autonomous CPR Training","I. Santos Sousa; C. Sa-Couto; P. Vieira-Marques","Fac. de Med., Univ. do Porto, Porto, Portugal; Faculty of Medicine of University of Porto, Center for Health Technology and Services Research (CINTESIS), Biomedical Simulation Center, Porto, Portugal; Faculty of Medicine of University of Porto, Center for Health Technology and Services Research (CINTESIS), Porto, Portugal","2019 14th Iberian Conference on Information Systems and Technologies (CISTI)","15 Jul 2019","2019","","","1","3","In sudden cardiac arrest, early cardiopulmonary resuscitation, with emphasis on chest compressions, is a fundamental step in the Chain of Survival. It is of most importance to have good technique to increase the success rate. CPR is less effective, according to some studies, due to the lack of regular training. In this context a system with quantitative feedback for autonomous training was developed. Gamification has become a widely used method for promoting learning in general, it has also been applied successfully in health care professional's training. In this work, it was followed and widely adopted a gamification framework with the propose to include several game related functionalities in an existing CPR autonomous training system. It is expected that this approach will increase training frequency and knowledge acquisition.","2166-0727","978-9-8998-4349-3","10.23919/CISTI.2019.8760731","","https://ieeexplore.ieee.org/stamp/stamp.jsp?arnumber=8760731","CPR;gamification;game elements","Games;Training;Medical services;Visualization;Information systems;Europe;Conferences","cardiology;computer based training;computer games;health care;medical computing;patient treatment","autonomous CPR training;sudden cardiac arrest;chest compressions;quantitative feedback;health care professional;gamification framework;knowledge acquisition;cardiopulmonary resuscitation","","","","17","","15 Jul 2019","","","IEEE","IEEE Conferences"
"ParSimTech Research and Training Center","O. Miroshkin; S. Kovalov; O. Dmitrieva; O. Shcherbakov; S. Tsololo; Y. Dikova; S. Gogolenko; V. Kushnarenko; V. Svyatnyy","Ulm University,Communication and Information Centre,Ulm,Germany; Donetsk National Technical University,Computer Engineering Department,Pokrovsk,Ukraine; Donetsk National Technical University,Department of Applied Mathematics and Informatics,Pokrovsk,Ukraine; HLRS High-Performance Computing Center Stuttgart,Stuttgart,Germany; Donetsk National Technical University,Computer Engineering Department,Pokrovsk,Ukraine; Donetsk National Technical University,Computer Engineering Department,Pokrovsk,Ukraine; HLRS High-Performance Computing Center Stuttgart,Stuttgart,Germany; HLRS High-Performance Computing Center Stuttgart,Stuttgart,Germany; Donetsk National Technical University,Computer Engineering Department,Pokrovsk,Ukraine","2020 IEEE European Technology and Engineering Management Summit (E-TEMS)","9 Jun 2020","2020","","","1","4","A citizen's quality of life is always tightly related to the improvement of general technological progress in many subject areas - from mechanical and electrical engineering, information technology, mining and technological fields of industry up to biotechnological processes of cellular and molecular dynamics, medicine, and biomechanics of living organisms. It also depends on an achieved level in theory and mathematical description of the internal dynamic processes of different physical nature, simulation of these processes and further practical implementation of the theory into the real technical objects. An important role here plays computing resources which allow to minimize computational time and to increase the complexity of the simulation models. Parallel computing systems open for scientists a new level of simulation, but they also set high requirements on specific knowledge and experience of the users. As a result, granting access to computing resources is not sufficient, specialised training of the personnel is also needed. The same problem appears during the integration of a computing centre into the university educational program - new courses, workshops and learning materials are required. In this paper, we share our experience and a vision, how modern computing resources could be integrated into university life, what challenges and issues can be expected here. Also, we present a new scientific project between Ukrainian and German academia partners which has a goal to enhance accessibility, usability and improve the system organization of parallel computing resources. The project represents a multidisciplinary research area of Parallel Simulation Technology (ParSimTech) and focuses on the creation of the Ukrainian research and training ParSimTech centre.","","978-1-7281-0903-9","10.1109/E-TEMS46250.2020.9111834","","https://ieeexplore.ieee.org/stamp/stamp.jsp?arnumber=9111834","high-performance computing;research and training centre;parallel simulation technology;distributed parallel simulation environment","","biotechnology;computer based training;educational courses;educational institutions;information technology","system organization;multidisciplinary research area;parallel simulation technology;citizen;general technological progress;subject areas;mechanical engineering;electrical engineering;information technology;mining;biotechnological processes;cellular dynamics;molecular dynamics;living organisms;achieved level;mathematical description;internal dynamic processes;computational time;simulation models;parallel computing systems;computing centre;modern computing resources;university life;personnel specialised training","","","","18","","9 Jun 2020","","","IEEE","IEEE Conferences"
"Stereo Generation from a Single Image Using Deep Residual Network","J. Huang; T. Bi; Y. Liu; Y. Wang","Beijing Engineering Research Center of Mixed Reality and Advanced Display, School of Optics and Photonics, Beijing Institute of Technology, Beijing, 100081, China; Beijing Engineering Research Center of Mixed Reality and Advanced Display, School of Optics and Photonics, Beijing Institute of Technology, Beijing, 100081, China; Beijing Engineering Research Center of Mixed Reality and Advanced Display, School of Optics and Photonics, Beijing Institute of Technology, Beijing, 100081, China; Beijing Engineering Research Center of Mixed Reality and Advanced Display, School of Optics and Photonics, Beijing Institute of Technology, Beijing, 100081, China","2018 25th IEEE International Conference on Image Processing (ICIP)","6 Sep 2018","2018","","","3653","3657","In this paper, we propose a framework to generate stereoscopic content from a single image using the relative depth label predicted from deep residual network. Specifically, our framework first obtains a coarse relative depth label from the network and refines it to painting depth by sampling and interpolation, then an unsupervised clustering algorithm is employed to separate pixels of different depths into different layers to generate stereoscopic images. Experimental results with good visual effects demonstrate that the proposed method can be generally applied in both outdoor and indoor scenes. Meanwhile the quantitative results on relative depth estimation from a single image are comparable to state-of-the-art. Further experiments show the application possibility of our method in VR and panorama.","2381-8549","978-1-4799-7061-2","10.1109/ICIP.2018.8451311","","https://ieeexplore.ieee.org/stamp/stamp.jsp?arnumber=8451311","Stereo generation;relative depth;residual networks;layered images","Painting;Three-dimensional displays;Training;Interpolation;Measurement;Stereo image processing;Image edge detection","interpolation;painting;pattern clustering;stereo image processing;virtual reality","unsupervised clustering algorithm;relative depth estimation;stereo generation;deep residual network;coarse relative depth label;painting depth;stereoscopic content generation;interpolation;stereoscopic image generation;panorama;virtual reality","","","","24","","6 Sep 2018","","","IEEE","IEEE Conferences"
"Reducing latency when using Virtual Reality for teaching in sport","Y. H. P. Iskandar; L. Gilbert; G. B. Wills","Learning Technologies Research Group, Electronics & Computer Science, University of Southampton, SO17 IBJ, United Kingdom; Learning Technologies Research Group, Electronics & Computer Science, University of Southampton, SO17 IBJ, United Kingdom; Learning Technologies Research Group, Electronics & Computer Science, University of Southampton, SO17 IBJ, United Kingdom","2008 International Symposium on Information Technology","26 Sep 2008","2008","3","","1","5","Latency is a frequently cited shortcoming of virtual reality (VR) applications. To compensate for excessive latency, prediction mechanisms may use sophisticated mathematical algorithms, which may not be appropriate for complex virtual teaching applications. This paper suggests that heuristic prediction algorithms could be used to develop more effective and general systems for VR educational applications. A fast synchronization squash simulation illustrates where heuristic prediction can be used to deal with latency problems.","2155-899X","978-1-4244-2327-9","10.1109/ITSIM.2008.4632076","","https://ieeexplore.ieee.org/stamp/stamp.jsp?arnumber=4632076","","Prediction algorithms;Heuristic algorithms;Humans;Training;Education;Algorithm design and analysis;Virtual environment","computer aided instruction;digital simulation;optimisation;sport;teaching;virtual reality","latency reduction;virtual reality;sport teaching;mathematical algorithms;complex virtual teaching applications;heuristic prediction algorithms;synchronization squash simulation","","","","26","","26 Sep 2008","","","IEEE","IEEE Conferences"
"The wobbly table: Increased social presence via subtle incidental movement of a real-virtual table","M. Lee; K. Kim; S. Daher; A. Raij; R. Schubert; J. Bailenson; G. Welch",University of Central Florida; University of Central Florida; University of Central Florida; University of Central Florida; University of Central Florida and UNC-Chapel Hill; Stanford University; University of Central Florida,"2016 IEEE Virtual Reality (VR)","7 Jul 2016","2016","","","11","17","While performing everyday interactions, we often incidentally touch and move objects in subtle ways. These objects are not necessarily directly related to the task at hand, and the movement of an object might even be entirely unintentional. If another person is touching the object at the same time, the movement can transfer through the object and be experienced - however subtly - by the other person. For example, when one person hands a drink to another, at some point both individuals will be touching the glass, and consequently exerting small (often unnoticed) forces on the other person. Despite the frequency of such subtle incidental movements of shared objects in everyday interactions, few have examined how these movements affect human-virtual human (VH) interaction. We ran an experiment to assess how presence and social presence are affected when a person experiences subtle, incidental movement through a shared real-virtual object. We constructed a real-virtual room with a table that spanned the boundary between the real and virtual environments. The participant was seated on the real side of the table, which visually extended into the virtual world via a projection screen, and the VH was seated on the virtual side of the table. The two interacted by playing a game of “Twenty Questions,” where one player asked the other a series of 20 yes/no questions to deduce what object the other player was thinking about. During the game, the “wobbly” group of subjects experienced subtle incidental movements of the real-virtual table: the entire real-virtual table tilted slightly away/toward the subject when the virtual/real human leaned on it. The control group also played the same game, except the table did not wobble. Results indicate that the wobbly group had higher presence and social presence with the virtual human in general, with statistically significant increases in presence, co-presence, and attentional allocation. We present the experiment and results, and discuss some potential implications for virtual human systems and some potential future studies.","2375-5334","978-1-5090-0836-0","10.1109/VR.2016.7504683","","https://ieeexplore.ieee.org/stamp/stamp.jsp?arnumber=7504683","H.5.1 [Information Interfaces and Presentation]: Multimedia Information Systems — Artificial, Augmented and Virtual Realities;J.4 [Computer Applications]: Social and Behavioral Sciences — Psychology","Electronic mail;Measurement by laser beam;Virtual environments;Games;Training;Haptic interfaces;Force","human computer interaction;virtual reality","wobbly table;social presence;real-virtual table;subtle incidental movement;object movement;human-virtual human interaction;human-VH interaction;shared real-virtual object;real-virtual room;projection screen;virtual world;Twenty Questions game","","17","","42","","7 Jul 2016","","","IEEE","IEEE Conferences"
"Definition of Test Criteria Based on the Scene Graph for VR Applications","A. Bezerra; M. E. Delamaro; F. L. S. Nunes","Inst. de Cienc. Matemdticas e de Comput. (ICMC), Univ. de Sao Paulo (USP), Sao Carlos, Brazil; Inst. de Cienc. Matemdticas e de Comput. (ICMC), Univ. de Sao Paulo (USP), Sao Carlos, Brazil; Inst. de Cienc. Matemdticas e de Comput. (ICMC), Univ. de Sao Paulo (USP), Sao Carlos, Brazil","2011 XIII Symposium on Virtual Reality","14 Jul 2011","2011","","","56","65","Virtual Reality applications are becoming more popular. In general, the development of these applications does not include a testing phase, or, at best, the evaluation is conducted only with the users. The activity of software testing has received considerable attention from researchers and software engineers who recognize its usefulness in creating quality products. However, the tests are expensive and prone to errors, which imposes the need to systematize and hence the definition of techniques to increase quality and productivity in their driving. Several testing techniques have been developed and have been used, each with its own characteristics in terms of effectiveness, cost, implementation stages, etc. Moreover, these techniques can also be adapted. In this paper, testing criteria based on scene graph are studied in order to ensure the quality of the Virtual Reality applications implementation. In addition, a proof of concept is presented, by using the defined criteria applied to a VR framework built to generate applications in the medical training area.","","978-0-7695-4445-8","10.1109/SVR.2011.34","","https://ieeexplore.ieee.org/stamp/stamp.jsp?arnumber=5951835","Virtual reality;software testing;test criteria;test;scene graph","Software;Visualization;Instruments;Computational modeling;Java;Testing;Virtual reality","program testing;software quality;virtual reality","scene graph;VR applications;virtual reality applications;software testing;quality products;medical training area","","1","","32","","14 Jul 2011","","","IEEE","IEEE Conferences"
"Teaming Up with Virtual Humans: How Other People Change Our Perceptions of and Behavior with Virtual Teammates","A. Robb; A. Cordar; S. Lampotang; C. White; A. Wendling; B. Lok","Department of Computer Science, Engineering at the University of Florida; Department of Computer Science, Engineering at the University of Florida; Department of AnesthesiologyUF College of Medicine; School of Medicine; Department of AnesthesiologyUF College of Medicine; Department of Computer Science, Engineering at the University of Florida","IEEE Transactions on Visualization and Computer Graphics","20 Mar 2015","2015","21","4","511","519","In this paper we present a study exploring whether the physical presence of another human changes how people perceive and behave with virtual teammates. We conducted a study (n = 69) in which nurses worked with a simulated health care team to prepare a patient for surgery. The agency of participants' teammates was varied between conditions; participants either worked with a virtual surgeon and a virtual anesthesiologist, a human confederate playing a surgeon and a virtual anesthesiologist, or a virtual surgeon and a human confederate playing an anesthesiologist. While participants perceived the human confederates to have more social presence (p <; 0.01), participants did not preferentially agree with their human team members. We also observed an interaction effect between agency and behavioral realism. Participants experienced less social presence from the virtual anesthesiologist, whose behavior was less in line with participants' expectations, when a human surgeon was present.","1941-0506","","10.1109/TVCG.2015.2391855","NSF; ","https://ieeexplore.ieee.org/stamp/stamp.jsp?arnumber=7014272","Virtual/digital characters;mixed reality;training;user studies;Virtual/digital characters;mixed reality;training;user studies","Surgery;Training;Avatars;Virtual environments;Virtual groups;Mathematical model;Speech","behavioural sciences computing;health care;human computer interaction;medical computing;surgery;telemedicine;virtual reality","virtual human;virtual teammates;health care;surgery;virtual surgeon;virtual anesthesiologist;interaction effect;social presence","Adult;Aged;Anesthesiology;Computer Graphics;Female;General Surgery;Humans;Male;Middle Aged;Patient Care Team;Social Perception;User-Computer Interface","7","","30","","19 Jan 2015","","","IEEE","IEEE Journals"
"A Controlled Experiment on Spatial Orientation in VR-Based Software Cities","M. Rüdel; J. Ganser; R. Koschke","Univ. of Bremen, Bremen, Germany; Univ. of Bremen, Bremen, Germany; Univ. of Bremen, Bremen, Germany","2018 IEEE Working Conference on Software Visualization (VISSOFT)","11 Nov 2018","2018","","","21","31","Multiple authors have proposed a city metaphor for visualizing software. While early approaches have used three-dimensional rendering on standard two-dimensional displays, recently researchers have started to use head-mounted displays to visualize software cities in immersive virtual reality systems (IVRS). For IVRS of a higher order it is claimed that they offer a higher degree of engagement and immersion as well as more intuitive interaction. On the other hand, spatial orientation may be a challenge in IVRS as already reported by studies on the use of IVRS in domains outside of software engineering such as gaming, education, training, and mechanical engineering or maintenance tasks. This might be even more true for the city metaphor for visualizing software. Software is immaterial and, hence, has no natural appearance. Only a limited number of abstract aspects of software are mapped onto visual representations so that software cities generally lack the details of the real world, such as the rich variety of objects or fine textures, which are often used as clues for orientation in the real world. In this paper, we report on an experiment in which we compare navigation in a particular kind of software city (EvoStreets) in two variants of IVRS. One with head-mounted display and hand controllers versus a 3D desktop visualization on a standard display with keyboard and mouse interaction involving 20 participants.","","978-1-5386-8292-0","10.1109/VISSOFT.2018.00011","","https://ieeexplore.ieee.org/stamp/stamp.jsp?arnumber=8530128","Visualization;Software City;Orientation;Experiment;Software Engineering;Virtual Reality","Software;Visualization;Urban areas;Navigation;Measurement;Task analysis;Three-dimensional displays","helmet mounted displays;program visualisation;virtual reality","software city;IVRS;head-mounted display;3D desktop visualization;standard display;spatial orientation;VR-based software cities;city metaphor;two-dimensional displays;immersive virtual reality systems;software engineering;mechanical engineering;visual representations;software visualization;EvoStreets;hand controllers","","3","","45","","11 Nov 2018","","","IEEE","IEEE Conferences"
"Withindows: A Framework for Transitional Desktop and Immersive User Interfaces","A. Hill; A. Johnson","University of Illinois at Chicago, e-mail: ahill@evl.uic.edu; University of Illinois at Chicago, e-mail: ajohnson@uic.edu","2008 IEEE Symposium on 3D User Interfaces","31 Mar 2008","2008","","","3","10","The uniqueness of 3D interaction is often used to justify levels of user fatigue that are significantly higher than those of desktop systems. Object manipulation and symbolic manipulation techniques based strictly on first person perspective are also generally less efficient than their desktop counterparts. Instead of considering the two environments as distinct, we have focused on the idea that desktop applications will likely need to transition smoothly into full immersion through intermediate states. The Withindows framework uses image-plane selection and through- the-lens techniques in an attempt to smooth the movement of both traditional and immersive applications across transitional states such as desktop stereo and multi-display setups. We propose using a virtual cursor in the dominant eye and a reinforcing cursor in the non-dominant eye to avoid ambiguity problems that have discouraged the use of image-plane selection in stereo. We show how image-plane selection resolves non-linear control-display relationships inherent in some approaches to desktop stereo. When combined with through-the-lens techniques, image-plane selection allows immersive viewpoint management and 2&‌#xBD;D object manipulation techniques analogous to those on the desktop. This approach resolves global search and scaling problems inherent in prior through-the-lens implementations. We describe extensions for 6 DOF input devices that do not supersede the default interaction method. We developed a single-authored virtual world builder as a proof of concept application of our framework. Our evaluations found alternate perspectives useful but our implementation of viewing windows proved fatiguing to some users.","","978-1-4244-2047-6","10.1109/3DUI.2008.4476584","","https://ieeexplore.ieee.org/stamp/stamp.jsp?arnumber=4476584","Through the Lens;Image Plane;Virtual Reality;Augmented Reality;H.5.1 [Information Interfaces and Presentation]: Multimedia Information Systems - Artificial, augmented, and virtual realities;I.3.6 [Computer Graphics]: Methodology and Techniques - Interaction Techniques","User interfaces;Fatigue;Virtual reality;Augmented reality;Aerospace simulation;Industrial training;Space technology;Displays;Image resolution;Application software","user interfaces;virtual reality","immersive user interface;desktop user interface;symbolic manipulation;object manipulation;stereo image plane selection;virtual cursor;Withindows framework;virtual reality","","1","2","32","","31 Mar 2008","","","IEEE","IEEE Conferences"
"A 3D serious game for medical students training in clinical cases","R. M. de Lima; A. de Medeiros Santos; F. M. Mendes Neto; A. França de Sousa Neto; F. C. P. Leão; F. T. de Macedo; A. M. de Paula Canuto","Department of Exact and Natural Sciences, Rural Federal University of the Semiarid, Mossoró - RN, Brazil; Department of Exact and Natural Sciences, Rural Federal University of the Semiarid, Mossoró - RN, Brazil; Department of Exact and Natural Sciences, Rural Federal University of the Semiarid, Mossoró - RN, Brazil; Department of Exact and Natural Sciences, Rural Federal University of the Semiarid, Mossoró - RN, Brazil; Department of Exact and Natural Sciences, Rural Federal University of the Semiarid, Mossoró - RN, Brazil; Department of Exact and Natural Sciences, Rural Federal University of the Semiarid, Mossoró - RN, Brazil; Department of Informatics and Applied Mathematics, Federal University of Rio Grande do Norte, Natal - Brazil","2016 IEEE International Conference on Serious Games and Applications for Health (SeGAH)","10 Oct 2016","2016","","","1","9","This paper describes an auxiliary environment in the process of teaching and learning for students and professors of medicine. The environment has a serious game available in various computing devices to simulate clinical cases in order to assess students' knowledge. Diagnostics are simulated using 3D environment, mobile application using voice synthesizer and immersion through virtual reality goggles. The environment has gamification features as a motivational mechanism for users. Within the 3D environment, medical subjects are offered by the NPCs (Non Playable Characters), in order to provide auxiliary knowledge to facilitate the identification of diseases in patients or medical issues in general. Professors can check the score of their students and take extra steps in class to clarify doubts. The system has a multi-agent system and machine learning for disease classification offered by virtual patients.","","978-1-5090-2210-6","10.1109/SeGAH.2016.7586255","","https://ieeexplore.ieee.org/stamp/stamp.jsp?arnumber=7586255","voice synthesizer;virtual glasses;simulators for clinical case;virtual environment;multi-agent system;machine learning;gamification","Games;Medical diagnostic imaging;Three-dimensional displays;Training;Computers;Virtual reality","computer aided instruction;learning (artificial intelligence);medical diagnostic computing;multi-agent systems;serious games (computing);virtual reality","3D serious game;medical students training;clinical cases;teaching;learning;computing devices;3D environment;mobile application;voice synthesizer;virtual reality goggles;motivational mechanism;NPC;nonplayable characters;multi-agent system;machine learning;disease classification;virtual patients","","3","","36","","10 Oct 2016","","","IEEE","IEEE Conferences"
