"EMG Feature Extractions for Upper-Limb Functional Movement During Rehabilitation","M. S. Hazam Majid; W. Khairunizam; A. B. Shahriman; I. Zunaidi; B. N. Sahyudi; M. R. Zuradzman","AiCOS Research Lab, School of Mechatronic, Universiti Malaysia Perlis, Perlis, Malaysia; AiCOS Research Lab, School of Mechatronic, Universiti Malaysia Perlis, Perlis, Malaysia; AiCOS Research Lab, School of Mechatronic, Universiti Malaysia Perlis, Perlis, Malaysia; Technopreneur at UniMAP Sdn. Bhd., Perlis, 01000, Malaysia; AiCOS Research Lab, School of Mechatronic, Universiti Malaysia Perlis, Perlis, Malaysia; AiCOS Research Lab, School of Mechatronic, Universiti Malaysia Perlis, Perlis, Malaysia","2018 International Conference on Intelligent Informatics and Biomedical Sciences (ICIIBMS)","29 Nov 2018","2018","3","","314","320","Rehabilitation is important treatment for post stroke patient to regain their muscle strength and motor coordination as well as to retrain their nervous system. Electromyography (EMG) has been used by researcher to enhance conventional rehabilitation method as a tool to monitor muscle electrical activity however EMG signal is very stochastic in nature and contains some noise. Special technique is yet to be researched in processing EMG signal to make it useful and effective both to researcher and to patient in general. Feature extraction is among the signal processing technique involved and the best method for specific EMG study needs to be applied. In this works, nine feature extractions techniques are applied to EMG signals recorder from subjects performing upper limb rehabilitation activity based on suggested movement sequence pattern. Three healthy subjects perform the experiment with three trials each and EMG data were recorded from their bicep and deltoid muscle. The applied features for every trials of each subject were analyzed statistically using student T-Test their significant of p-value. The results were then totaled up and compared between the nine features applied and Auto Regressive coefficient (AR) present the best result and consistent with each subjects' data. This feature will be used later in our future research work of Upper-limb Virtual Reality Rehabilitation.","2189-8723","978-1-5386-7516-8","10.1109/ICIIBMS.2018.8549932","","https://ieeexplore.ieee.org/stamp/stamp.jsp?arnumber=8549932","Electromyography;Arm Rehabilitation;Feature extraction","Electromyography;Muscles;Feature extraction;Task analysis;Training;Electrodes","biomechanics;electromyography;feature extraction;medical computing;medical robotics;medical signal processing;neurophysiology;patient rehabilitation;virtual reality","EMG feature extractions;important treatment;post stroke patient;muscle strength;motor coordination;nervous system;conventional rehabilitation method;muscle electrical activity;special technique;processing EMG signal;feature extraction;signal processing technique;specific EMG study;feature extractions techniques;EMG signals recorder;upper limb rehabilitation activity;suggested movement sequence pattern;healthy subjects;EMG data;bicep;deltoid muscle;future research work;upper-limb virtual reality rehabilitation;upper-limb functional movement","","1","","22","","29 Nov 2018","","","IEEE","IEEE Conferences"
"Residual MLP Network for Mental Fatigue Classification in Mining Workers from Brain Data","A. C. Q. Siravenha; M. N. F. Reis; I. Cordeiro; R. A. Tourinho; B. D. Gomes; S. R. Carvalho",Vale Institute of Technology; Federal University of Para; Vale Institute of Technology; Vale S/A; Federal University of Para; Vale Institute of Technology,"2019 8th Brazilian Conference on Intelligent Systems (BRACIS)","5 Dec 2019","2019","","","407","412","At the mining industry, human safety and productivity are both desirable in the logistics pipeline. Since the operation of heavy machines requires continued vigilance and mental activity, fatigue caused by long hours of work and constant effort generally occurs in this environment. In general, mental fatigue is related to a loss of efficiency, leading to a decrease in productivity and inducing critical errors, which can provoke equipment breakups or accidents with human victims. At this high cognitive workload environment, there is a need for the development of robust monitoring techniques aiming to predict mental fatigue before workers' movement responses become slower, more variable, and more error-prone. In this work, we introduce a residual multilayer perceptron (MLP) network (ResMLPNet) and assess its performance in the challenging problem of mental fatigue classification from cognitive electrophysiology data, acquired during Virtual Reality (VR) training sessions mimicking a real operation faced by excavator workers at the mining industry. In a three-step training strategy, the ResMLPNet achieved slightly better classification accuracies compared to its plain MLP architecture.","2643-6264","978-1-7281-4253-1","10.1109/BRACIS.2019.00078","","https://ieeexplore.ieee.org/stamp/stamp.jsp?arnumber=8923986","Residual multilayer perceptron network;Classification;mental fatigue;EEG time series","Fatigue;Electroencephalography;Electrodes;Training;Task analysis;Databases;Benchmark testing","brain;cognition;electroencephalography;ergonomics;fatigue;medical signal processing;mining industry;multilayer perceptrons;neurophysiology;occupational stress;pattern classification;virtual reality","mining workers;brain data;mining industry;human safety;logistics pipeline;mental activity;human victims;residual multilayer perceptron network;mental fatigue classification;cognitive electrophysiology data;residual MLP network","","","","15","","5 Dec 2019","","","IEEE","IEEE Conferences"
"Realtime Coarse Pose Recognition Using a Multi-scaled Local Integral Histograms","D. Jang; Y. Chai; X. Jin; T. Kim","Chung-Ang Univ., Seoul; Chung-Ang Univ., Seoul; Chung-Ang Univ., Seoul; Chung-Ang Univ., Seoul","2007 International Conference on Convergence Information Technology (ICCIT 2007)","7 Jan 2008","2007","","","1982","1987","We present a fast and robust algorithm for segmenting foreground object from background image by comparing local histograms. Background subtraction is a important preprocessing step for extracting the features that can be used for object tracking in surveillance system or HCI system in virtual environment. In this paper, the local histograms of the same area are used to compute a foreground probability. The histogram-based method is partially robust against illumination change and small moving objects in background. However without data quantization to reduce bin size, histograms are generally not suitable for realtime applications. Moreover quantization errors are a major drawback of using histograms. We propose a new method to keep the advantages of histograms without suffering computational load and quantization error using local kernel histogram with the multi-scaled integral histograms. We implement the video game interface with a trained neural network to prove the proposed method is highly applicable to coarse pose recognition.","","0-7695-3038-9","10.1109/ICCIT.2007.273","","https://ieeexplore.ieee.org/stamp/stamp.jsp?arnumber=4420542","","Histograms;Quantization;Robustness;Image segmentation;Feature extraction;Surveillance;Human computer interaction;Virtual environment;Lighting;Kernel","computer games;feature extraction;human computer interaction;image motion analysis;image segmentation;learning (artificial intelligence);object detection;pose estimation;tracking;video surveillance","realtime coarse pose recognition;multiscaled local integral histograms;foreground object segmentation;background subtraction;features extraction;object tracking;surveillance system;HCI system;foreground probability;local kernel histogram;video game interface;trained neural network","","","","16","","7 Jan 2008","","","IEEE","IEEE Conferences"
"Enter the Serious E-scape Room: A Cost-Effective Serious Game Model for Deep and Meaningful E-learning","S. Mystakidis; E. Cachafeiro; I. Hatzilygeroudis","University of Jyväskylä & Patras,Faculty of Information Technology,Jyväskylä,Finland & Patras,Greece; OESO Duke Health,Durham,USA; University of Patras,Department of Computer Engineering & Informatics,Patras,Greece","2019 10th International Conference on Information, Intelligence, Systems and Applications (IISA)","14 Nov 2019","2019","","","1","6","Escape rooms are a phenomenon that has taken the world by storm in the last decade. Simultaneously Virtual Reality is a promising technology for innovation in education, training and e-learning. Combining these two concepts, this paper outlines a new model for designing serious games in virtual reality environments for high quality, deep and meaningful learning, the Serious E-scape Room. It describes the theoretical grounding, general guidelines and principles of the model. It also presents the case study “Room of Keys”, a serious virtual escape room for biology concepts. To test the assumptions of the model, researchers conducted a mixed research study with 148 students in a US high school. Pre-post test results recorded a 13.8% performance increase and high overall satisfaction. The game has been received enthusiastically by students, it increased their motivation and helped them build a deeper understanding of the learned concepts.","","978-1-7281-4959-2","10.1109/IISA.2019.8900673","","https://ieeexplore.ieee.org/stamp/stamp.jsp?arnumber=8900673","escape room;virtual reality;serious games;deep and meaningful learning;biology","","computer aided instruction;educational institutions;serious games (computing);virtual reality","serious e-scape room;serious virtual escape room;serious game model;e-learning;virtual reality environments;US high school","","4","","32","","14 Nov 2019","","","IEEE","IEEE Conferences"
"ObjectStab-an educational tool for power system stability studies","M. Larsson","Lund Univ., Sweden","IEEE Transactions on Power Systems","19 Feb 2004","2004","19","1","56","63","Traditionally, the simulation of transient and voltage stability in power systems has been constrained to domain-specific tools such as Simpow, PSS/E, ETMSP, and EuroStag. While being efficient and thereby able to simulate large systems, their component models are often encapsulated and difficult or impossible to examine and modify. Also, these simulators often require substantial training and are therefore not ideal for normal classroom use. For academic and educational use, it is more important that the component modeling be transparent and flexible, and that students quickly get started with their simulations. This paper describes a freely available power system library called ObjectStab intended for power system stability simulations written in Modelica, a general-purpose object-oriented modeling language. All component models are transparent and can easily be modified or extended. Power system topology and parameter data are entered in one-line diagram form using a graphical editor. The component library has been validated using comparative simulations with EuroStag.","1558-0679","","10.1109/TPWRS.2003.821001","","https://ieeexplore.ieee.org/stamp/stamp.jsp?arnumber=1266551","","Power system stability;Power system modeling;Object oriented modeling;Power system simulation;Mathematical model;Power system dynamics;Power system transients;Power system analysis computing;Libraries;Topology","power system stability;educational aids;power system simulation;computer aided instruction;object-oriented methods;educational courses","ObjectStab;educational tool;power system stability;power system library;Modelica;object-oriented modeling language;power system topology;graphical editor;EuroStag;power system simulation","","42","","14","","19 Feb 2004","","","IEEE","IEEE Journals"
"Immersive integration for virtual and human-centered environments","H. Fuchs","North Carolina Univ., Chapel Hill, NC, USA","2005 IEEE Symposium on Visual Languages and Human-Centric Computing (VL/HCC'05)","17 Oct 2005","2005","","","13","","Summary form only given. We envision future work and play environments that are more effectively human-centered with the user's computing interface being more closely integrated with the physical surroundings than today's conventional computer display screens and keyboards. We are working toward realizable versions of such environments, in which multiple video projectors and digital cameras enable every visible surface to be both measured in 3D and used for display. If the 3D surface positions are transmitted to a distant location, they may also enable distant collaborations to become more like working in adjacent offices connected by large windows. In one prototype, depth maps are calculated from streams of video images and the resulting 3D surface points are displayed to the user in head-tracked stereo. Another prototype allows direct ""painting"" onto movable objects - a dollhouse, for example. One long-term goal is advanced training for trauma surgeons by immersive replay of recorded procedures. More generally, we hope to demonstrate that the principal interface of a future computing environment need not be limited to a screen the size of one or two sheets of paper. Just as a useful physical environment is all around us, so too can the increasingly ubiquitous computing environment be all around us - becoming more effectively human-centered and integrated into our physical surroundings.","1943-6106","0-7695-2443-5","10.1109/VLHCC.2005.46","","https://ieeexplore.ieee.org/stamp/stamp.jsp?arnumber=1509481","","Computer displays;Computer interfaces;Prototypes;Physics computing;Keyboards;Digital cameras;Three dimensional displays;Large screen displays;Collaborative work;Streaming media","visual programming;solid modelling;virtual reality;human computer interaction;user centred design;user interfaces","immersive integration;virtual environments;human-centered environments;user interface;multiple video projectors;digital cameras;3D surface position;windows;video images;3D surface points;movable objects;ubiquitous computing","","","","","","17 Oct 2005","","","IEEE","IEEE Conferences"
"Game Prototype for Understanding Safety Issues of Life Boat Launching Process","M. Jiang; J. Chang; M. Dodwell; J. Jekins; H. J. Yang; J. J. Zhang","Nat. Centre for Comput. Animation, Bournemouth Univ., Bournemouth, UK; Nat. Centre for Comput. Animation, Bournemouth Univ., Bournemouth, UK; Nat. Centre for Comput. Animation, Bournemouth Univ., Bournemouth, UK; R. Nat. Lifeboat Instn., Poole, UK; Northwest A&F Univ., Xianyang, China; Nat. Centre for Comput. Animation, Bournemouth Univ., Bournemouth, UK","2016 8th International Conference on Games and Virtual Worlds for Serious Applications (VS-GAMES)","18 Oct 2016","2016","","","1","8","Novel advanced game techniques provide us with new possibilities to mimic a complicated training process, with the benefit of safety enhancement. In this paper, we design and implement a 3D game which imitates the lifeboat launching process. Lifeboat launching is such a complex but vital process which can on one side saving people's life on sea and on the other side associating many potential hazards. It involves both the tractor manoeuvres and boat operations. The primary objective of the game is to allow novices to better understand the sequence of the operations in launching process and manager the potential hazards happening during the launching. There is also great educational significance with the promotion of the game to the general public for enhanced awareness of safety issues. The key modules of the game are designed based on physical simulation which gives the players enhanced plausible cognition and enjoyable interaction.","","978-1-5090-2722-4","10.1109/VS-GAMES.2016.7590351","","https://ieeexplore.ieee.org/stamp/stamp.jsp?arnumber=7590351","","Games;Training;Agricultural machinery;Hazards;Boats;Solid modeling","boats;computer based training;computer games;digital simulation;hazards;marine safety","complicated training process;enhanced plausible cognition;physical simulation;boat operations;tractor manoeuvres;lifeboat launching hazards;3D game;life boat launching process safety issues","","","","29","","18 Oct 2016","","","IEEE","IEEE Conferences"
"A New Hands-On Course in Characterization of Wide-Bandgap Devices","Z. Zhang; L. M. Tolbert; D. Costinett; F. Wang; B. J. Blalock","Global Research, General Electric, Niskayuna, NY, USA; Department of Electrical Engineering and Computer Science, The University of Tennessee, Knoxville, TN, USA; Department of Electrical Engineering and Computer Science, The University of Tennessee, Knoxville, TN, USA; Department of Electrical Engineering and Computer Science, The University of Tennessee, Knoxville, TN, USA; Department of Electrical Engineering and Computer Science, The University of Tennessee, Knoxville, TN, USA","IEEE Transactions on Power Electronics","1 Jul 2019","2019","34","10","9392","9403","As wide-bandgap (WBG) devices and applications move from niche to mainstream, a new generation of engineers trained in this area is critical to continue the development of the field. This paper introduces a new hands-on course in characterization of WBG devices, which is an emerging and fundamental topic in WBG-based techniques. First, the lecture-simulation-experiment format based course structure and design considerations, such as safety, are presented. Then, the necessary facilities to support this hands-on course are summarized, including classroom preparation, software tools, and laboratory equipment. Afterward, the detailed course implementation flow is presented to illustrate the approach of close interaction among lecture, simulation, and experiment to maximize students' learning outcomes. Finally, grading for students and course evaluation by students are discussed, highlighting the findings and potential improvements. Detailed course materials are provided via potenntial.eecs.utk.edu/WBGLab for educational use.","1941-0107","","10.1109/TPEL.2018.2890615","U.S. Department of Energy's Wide Bandgap Traineeship Program; Engineering Research Center Program of the National Science Foundation and DOE; CURENT Industry Partnership Program via Engineering Research Center Shared Facilities; ","https://ieeexplore.ieee.org/stamp/stamp.jsp?arnumber=8598833","Electrical engineering education;hands-on training;power electronics;wide-bandgap (WBG) devices","Silicon;Gallium nitride;Silicon carbide;Power electronics;Switches;Photonic band gap;HEMTs","computer simulation;courseware;educational courses;electronic engineering computing;electronic engineering education;power semiconductor devices;wide band gap semiconductors","wide-bandgap devices;WBG devices;WBG-based techniques;design considerations;course evaluation;hands-on course;course materials;lecture-simulation-experiment format based course structure;classroom preparation;software tools;laboratory equipment;course implementation flow;students learning outcomes","","4","","31","","1 Jan 2019","","","IEEE","IEEE Journals"
"Wii-based compared to standard of care balance and mobility rehabilitation for two individuals post-stroke","J. E. Deutsch; D. Robbins; J. Morrison; P. Guarrera Bowlby","Dept. of Rehab and Movt. Sciences - UMDNJ-SHRP, Newark NJ, USA; Dept. of Rehab and Movt. Sciences - UMDNJ-SHRP, Newark NJ, USA; Dept. of Rehab and Movt. Sciences - UMDNJ-SHRP, Newark NJ, USA; Dept. of Rehab and Movt. Sciences - UMDNJ-SHRP, Newark NJ, USA","2009 Virtual Rehabilitation International Conference","24 Jul 2009","2009","","","117","120","Great interest and some hype have accompanied the introduction of Nintendo Wii-based rehabilitation. The purpose of these cases is to describe a Wii-based balance and mobility program and compare it to a standard of care balance and mobility program for two individuals in the chronic phase post-stroke. Both individuals with left cerebrovascular accidents received four weeks (12 one hour sessions) of either a Nintendo Wii and Wii Fit program or standard of care balance and mobility program. Gait speed, walking endurance (six minute walk test), balance (Dynamic Gait Index) balance confidence (Activity Balance Confidence Questionnaire) and dual tasks mobility tests (Timed-Up and Go) were measured prior to training, upon training completion and at three months post-training. Both individuals demonstrated improvements in most outcomes measured. The percent increases were generally greater for the person in the Wii-based program. Retention of improvements, however, was greater for the individual who received the standard of care. Enthusiasm for new therapies needs to be tempered with evidence of efficacy with particular attention to retention of gains.","2331-9569","978-1-4244-4188-4","10.1109/ICVR.2009.5174216","","https://ieeexplore.ieee.org/stamp/stamp.jsp?arnumber=5174216","Interactive Computer Gaming;Nintendo Wii;Wii-Sports;Wii-fit;balance;gait;gaming;virtual reality;stroke;Interactive computer gaming","Accidents;Testing;Medical treatment;Virtual reality;Birth disorders;Extremities;Legged locomotion;Velocity measurement;Home computing;Application software","computer games;medical computing;patient rehabilitation","Wii-based rehabilitation;mobility rehabilitation;balance rehabilitation;post- stroke patients;interactive computer gaming;virtual reality;left cerebrovascular accidents;Wii Fit program;walking endurance","","40","","14","","24 Jul 2009","","","IEEE","IEEE Conferences"
"Medical interview training using depressed patient robot in psychiatric education","T. Hashimoto; H. Nakane; R. Kurimoto; H. Kobayashi","Dept. of Mechanical Engineering and Intelligent Systems The University of Electro-Communications Tokyo, Japan; Dept. of Neuropsychiatry Nagasaki University Nagasaki, Japan; Dept. of Mechanical Engineering Tokyo University of Science Tokyo, Japan; Dept. of Mechanical Engineering Tokyo University of Science Tokyo, Japan","2014 IEEE Symposium on Robotic Intelligence in Informationally Structured Space (RiiSS)","15 Jan 2015","2014","","","1","6","This paper introduces a psychiatric patient robot that can be used for medical interview training in psychiatric education. The patient robot is developed based on an android robot technology. Medical interview training in psychiatric field is generally conducted by employing human simulated or standardized patient (SP) who is trained to reproduce a set of symptoms of intended mental disorder by veteran psychiatrists. But in the use of a healthy person as a SP there are some problems such as mental burden, time-consuming, the lack of human resources, and so forth. In contrast, the merit of the use of a patient robot is to offer standardized and reproducible interview training to psychiatric trainees. Furthermore, it is expected that psychiatric trainees are able to experience realistic medical interview as if they face to a real human SP by taking advantage of characteristics of android robots. As the first step, the patient robot was particularly designed to simulate a set of symptoms of unipolar depression, because it is a common mental disorder worldwide. The interview scenario, that is question and answer process between an interviewer and the patient robot, was prepared based on the “Structured Interview Guide for the Hamilton Depression Rating Scale (SIGH-D)” which is widely used for interview training and clinical studies. The medical interview training with patient robot was introduced in actual psychiatric education, and eight students participated and evaluated its educational effect.","","978-1-4799-4464-4","10.1109/RIISS.2014.7009172","","https://ieeexplore.ieee.org/stamp/stamp.jsp?arnumber=7009172","patient patient robot;android robot;psychiatric education;unipolar depression","Interviews;Training;Medical diagnostic imaging;Androids;Humanoid robots","biomedical education;computer aided instruction;medical disorders;medical robotics;patient care;psychology","medical interview training;depressed patient robot;psychiatric education;Android robot technology;mental disorder;unipolar depression;structured interview guide for the Hamilton depression rating scale;SIGH-D","","","","11","","15 Jan 2015","","","IEEE","IEEE Conferences"
