"Object-oriented modeling of patients in a medical federation","M. D. Proctor; G. S. Creech","Dept. of Ind. Eng. & Manage. Syst., Central Florida Univ., Orlando, FL, USA; NA","IEEE Transactions on Information Technology in Biomedicine","7 Aug 2002","2001","5","3","244","247","Explores the development of an object-oriented model to support the inter-operation of simulations within a federation for the purpose of conducting medical analysis and training over a distributed infrastructure. The medical federation is referred to as the Combat Trauma Patient Simulation System and is composed using a high-level architecture. The infrastructure contains components that were separately developed and are heterogeneous in nature. This includes a general anatomical database that is capable of analyzing human injuries, referred to as operational requirements-based casualty assessment, an animated mannequin called the Human Patient Simulator, and other components. The research develops an object model that enables bodily injury data to be shared across the simulation, conducts analysis on that data and considers possible applications of the technique in expanded medical infrastructures.","1558-0032","","10.1109/4233.945295","","https://ieeexplore.ieee.org/stamp/stamp.jsp?arnumber=945295","","Object oriented modeling;Medical simulation;Computational modeling;Humans;Injuries;Analytical models;Databases;Data analysis;Medical treatment;Computer architecture","biomedical education;object-oriented methods;open systems;digital simulation;medical computing;computer based training;medical information systems;distributed databases;distributed object management;subroutines;computer animation","object-oriented model;patient modeling;medical federation;simulation interoperation;medical analysis;medical training;distributed infrastructure;Combat Trauma Patient Simulation System;high-level architecture;heterogeneous components;anatomical database;human injuries;operational requirements-based casualty assessment;animated mannequin;Human Patient Simulator;bodily injury data;data sharing;data analysis;expanded medical infrastructures;biomedical education","Computer Communication Networks;Computer Simulation;Computer-Assisted Instruction;Databases, Factual;Humans;Telemedicine;Wounds and Injuries","2","1","12","","7 Aug 2002","","","IEEE","IEEE Journals"
"Perceptually Augmented Simulator Design","T. Edmunds; D. K. Pai","University of British Columbia, Vancouver; University of British Columbia, Vancouver","IEEE Transactions on Haptics","9 Mar 2012","2012","5","1","66","76","Training simulators have proven their worth in a variety of fields, from piloting to air-traffic control to nuclear power station monitoring. Designing surgical simulators, however, poses the challenge of creating trainers that effectively instill not only high-level understanding of the steps to be taken in a given situation, but also the low-level “muscle-memory” needed to perform delicate surgical procedures. It is often impossible to build an ideal simulator that perfectly mimics the haptic experience of a surgical procedure, but by focussing on the aspects of the experience that are perceptually salient we can build simulators that effectively instill learning. We propose a general method for the design of surgical simulators that augment the perceptually salient aspects of an interaction. Using this method, we can increase skill-transfer rates without requiring expensive improvements in the capability of the rendering hardware or the computational complexity of the simulation. In this paper, we present our decomposition-based method for surgical simulator design, and describe a user-study comparing the training effectiveness of a haptic-search-task simulator designed using our method versus an unaugmented simulator. The results show that perception-based task decomposition can be used to improve the design of surgical simulators that effectively impart skill by targeting perceptually significant aspects of the interaction.","2329-4051","","10.1109/TOH.2011.42","","https://ieeexplore.ieee.org/stamp/stamp.jsp?arnumber=5975145","Haptic I/O;artificial;augmented;and virtual realities;life and medical sciences;surgical simulation.","Haptic interfaces;Surgery;Training;Needles;Rendering (computer graphics);Surface roughness;Rough surfaces","augmented reality;computer based training;haptic interfaces;medical computing;surgery","perceptually augmented simulator design;training simulator;air-traffic control;piloting;nuclear power station monitoring;surgical simulator;low-level muscle-memory;surgical procedure;haptic experience;salient interaction aspect;skill-transfer rate;rendering hardware;computational complexity;decomposition-based method;user study;haptic-search-task simulator;unaugmented simulator;perception-based task decomposition","","2","","21","","4 Aug 2011","","","IEEE","IEEE Journals"
"A Generic Model Framework for MOUT Simulations","S. Zhou; S. Ting","Nanyang Technological University, Singapore; Defence Science & Technology Agency, Singapore","2006 International Conference on Cyberworlds","19 Dec 2006","2006","","","89","92","Considerable efforts are needed to construct a virtual environment for military operations on urbanized terrain (MOUT). The models of various objects used in one application are often specifically designed for that application, thus are not generally suitable for other applications. We often have to rebuild many object models for a new simulation setup, which is very tedious and time consuming. To reduce the cost and time in building up different simulation environments, it is therefore highly desirable to have a repository of object models that are interoperable and extensible thus can be reused in different applications. To this end, we propose a generic model framework which supports model interoperability and reusability for MOUT simulations. Our experiences with Twilight City, a virtual training environment for MOUT, show that the proposed framework is successful in creating a repository of models for various simulation setups","","0-7695-2671-3","10.1109/CW.2006.7","","https://ieeexplore.ieee.org/stamp/stamp.jsp?arnumber=4030831","","Cities and towns;Engines;Costs;Urban areas;Buildings;Terrorism;Artificial intelligence;Virtual environment;Collaboration;Standards organizations","digital simulation;military computing;open systems;software reusability;virtual reality","generic model framework;virtual environment;military operation;urbanized terrain;simulation setup;interoperable object model repository;model interoperability;model reusability;virtual training environment","","","","6","","19 Dec 2006","","","IEEE","IEEE Conferences"
"State-of-the-art simulation systems for information security education, training and awareness","V. Pastor; G. Díaz; M. Castro","Electrical and Computer Department, UNED - Spanish University for Distance Education, Madrid, Spain; Electrical and Computer Department, UNED - Spanish University for Distance Education, Madrid, Spain; Electrical and Computer Department, UNED - Spanish University for Distance Education, Madrid, Spain","IEEE EDUCON 2010 Conference","24 Jun 2010","2010","","","1907","1916","This paper describes state-of-the-art simulation systems designed for information security and information assurance education, training and awareness. Being people the weakest link in the implementation of any security policy, it is of paramount importance to strengthen that link before it gets broken. The best way of improving the reactions of any person when security is attempted to be compromised is by providing him/her with better education, attractive practical training and raising the general awareness on information assurance.","2165-9567","978-1-4244-6571-2","10.1109/EDUCON.2010.5492435","","https://ieeexplore.ieee.org/stamp/stamp.jsp?arnumber=5492435","information security;information assurance;network simulation;education;training;awareness","Information security;Computational modeling;Computer science education;Computer simulation;Distance learning;Taxonomy;Management training;Software libraries;Computer security;Computer networks","computer science education;security of data;simulation","state-of-the-art simulation systems;information security education;information assurance education","","18","","38","","24 Jun 2010","","","IEEE","IEEE Conferences"
"Endoscopie neurosurgery simulation: Implementation on the evolution engine","S. Carnegie; J. MacKenzie; S. de Ribaupierre; R. Eagleson; A. Togeskov; M. Schmalz","UWO Electrical and Computer Engineering London, Ontario, Canada; UWO Electrical and Computer Engineering London, Ontario, Canada; UWO Electrical and Computer Engineering London, Ontario, Canada; UWO Electrical and Computer Engineering London, Ontario, Canada; Digital Extremes, Inc., London, Ontario, Canada; Digital Extremes, Inc., London, Ontario, Canada","2014 IEEE Games Media Entertainment","26 Feb 2015","2014","","","1","2","The design and evaluation of Neurosurgical simulators has heretofore emphasized the training of `surgical technical skills'. Such commercial platforms generally exercise tool use and other low level sensori-motor tasks such as targeting and navigation for training surgical residents. We report on the development of a set of modules implemented within Digital Extreme's Evolution Engine, making use of game assets that are derived from pre-operative clinical scans. The simulator exercises trainees spatial reasoning skills in targeting based on ortho-planar and endoscopie views. The technical exposition presented here covers the extension of the game engine to support in-scene endoscopie cameras, and in-scene display monitors that are situated in view of the avatar, and by extension, visible to the surgical trainee while engaged in the surgical scenario.","","978-1-4799-7546-4","10.1109/GEM.2014.7048119","","https://ieeexplore.ieee.org/stamp/stamp.jsp?arnumber=7048119","Game Engine;in-scene camera;in-scene display;GPU fragment memory","Cameras;Engines;Surgery;Three-dimensional displays;Games;Monitoring;Mirrors","avatars;cameras;computer based training;computer games;digital simulation;medical image processing;neurophysiology;spatial reasoning","endoscopic neurosurgery simulation;evolution engine;surgical technical skill training;sensori-motor tasks;digital extreme evolution;game assets;preoperative clinical scans;spatial reasoning skills;ortho-planar view;endoscopic view;game engine;in-scene endoscopic cameras;in-scene display monitors;avatar;surgical trainee","","","","5","","26 Feb 2015","","","IEEE","IEEE Conferences"
"Development and Validation of a Virtual Reality Tutor to Teach Clinically Oriented Surgical Anatomy of the Ear","S. Wijewickrema; B. Copson; X. Ma; R. Briggs; J. Bailey; G. Kennedy; S. O’Leary","Univ. of Melbourne, Melbourne, VIC, Australia; Univ. of Melbourne, Melbourne, VIC, Australia; Univ. of Melbourne, Melbourne, VIC, Australia; Univ. of Melbourne, Melbourne, VIC, Australia; Univ. of Melbourne, Melbourne, VIC, Australia; Univ. of Melbourne, Melbourne, VIC, Australia; Univ. of Melbourne, Melbourne, VIC, Australia","2018 IEEE 31st International Symposium on Computer-Based Medical Systems (CBMS)","23 Jul 2018","2018","","","12","17","Virtual reality (VR) is being increasingly used in medical education. However, investigations into its effectiveness in this field have yielded mixed results, indicating that no general conclusions can be drawn in this regard. Therefore, the suitability of a system to teach a given task has to be investigated on a case-by-case basis. In this paper, we focus on teaching clinically oriented surgical ear anatomy, as it is important to provide a well-rounded view of ear anatomy as a foundation for understanding clinical surgery. Although there are some VR systems that teach basic ear anatomy, for example, identification of structures and spatial relationships, to our knowledge, those that deliver a complete clinical understanding of ear anatomy do not yet exist. As such, we discuss the design and development of a 3D interactive VR tutor with integrated haptic capability to teach clinically oriented surgical anatomy of the ear and establish its effectiveness through a user study.","2372-9198","978-1-5386-6060-7","10.1109/CBMS.2018.00010","","https://ieeexplore.ieee.org/stamp/stamp.jsp?arnumber=8417205","Anatomy Education, Virtual Reality, Simulation Based Training","Ear;Bones;Surgery;Anatomical structure;Three-dimensional displays;Training","biomedical education;computer aided instruction;ear;haptic interfaces;medical computing;surgery;teaching;virtual reality","teaching;haptic capability;3D interactive VR tutor;complete clinical understanding;VR systems;clinically oriented surgical ear anatomy;case-by-case basis;medical education;virtual reality tutor","","","","18","","23 Jul 2018","","","IEEE","IEEE Conferences"
"Ginput: a tool for fast hi-fi prototyping of gestural interactions in virtual reality","J. R. Fonseca; J. Abreu; L. Figueredo; J. G. Neto; V. Teichrieb; J. P. Quintino; F. Q. B. da Silva; A. L. M. Santos; H. Pinho","Universidade Federal de,Voxar Labs / CIn,Pernambuco; Universidade Federal de,Voxar Labs / CIn,Pernambuco; Universidade Federal de,Voxar Labs / CIn,Pernambuco; Universidade Federal de,Voxar Labs / CIn,Pernambuco; Universidade Federal de,Voxar Labs / CIn,Pernambuco; Universide Federal de,Projeto CIn-Samsung,Pernambuco; CIn / Universidade Federal de,Pernambuco; CIn / Universidade Federal de,Pernambuco; Desenvolvimento para a Informática,Samsung Instituto de","2020 IEEE International Symposium on Mixed and Augmented Reality Adjunct (ISMAR-Adjunct)","16 Dec 2020","2020","","","63","64","Gestural interfaces in virtual reality (VR) expand the design space for user interaction, allowing spatial metaphors with the environment and more natural and immersive experiences. Typically, machine learning approaches recognize gestures with models that rely on a large number of samples for the training phase, which is an obstacle for rapidly prototyping gestural interactions. In this paper, we propose a solution designed for hi-fi prototyping of gestures within a virtual reality environment through a high-level Domain-Specific Language (DSL), as a subset of the natural language. The proposed DSL allows non-programmer users to intuitively describe a broad domain of poses and connect them for compound gestures. Our DSL was designed to be general enough for multiple input classes, such as body tracking, hand tracking, head movement, motion controllers, and buttons. We tested our solution for wands with VR designers and developers. Results showed that the tool gives non-programmers the ability to prototype gestures with ease and refine its recognition within a few minutes.","","978-1-7281-7675-8","10.1109/ISMAR-Adjunct51615.2020.00030","","https://ieeexplore.ieee.org/stamp/stamp.jsp?arnumber=9288432","Human-centered computing;Visualization;Visualization techniques;Treemaps; Human-centered computing;Visualization;Visualization design and evaluation methods","Training;Solid modeling;Tracking;Natural languages;Tools;DSL;Task analysis","gesture recognition;high level languages;human computer interaction;learning (artificial intelligence);motion control;object tracking;software prototyping;virtual reality","gestural interfaces;design space;user interaction;spatial metaphors;immersive experiences;machine learning;virtual reality environment;high-level domain-specific language;DSL;natural language;nonprogrammer users;compound gestures;prototype gestures;fast hi-fi prototyping;natural experience;gesture recognition;gestural interaction rapid prototyping;body tracking;hand tracking;head movement;motion controllers;buttons;Ginput","","","","7","","16 Dec 2020","","","IEEE","IEEE Conferences"
"Improved Ada Boost Classifier for Sports Scene Detection in Videos: from Data Extraction to Image Understanding","Y. Yue; Y. Yang","Shaoyang University,Shaoyang,China,422000; Shaoyang University,Shaoyang,China,422000","2020 International Conference on Inventive Computation Technologies (ICICT)","9 Jun 2020","2020","","","1","4","Improved Ada Boost classifier for the sports scene detection in videos: from data extraction to image understanding is proposed in this paper. Virtual reality technology is the basic condition for the development of VR sports simulation system, and the accurate simulation of all kinds of competitive sports is completed on this basis. This technique can provide technical reference for coaches and athletes, on the basis of which the training means are deepened continuously, while improving the training effect, ensuring that the athletes do not suffer physical injury in the training. Traditional scene recognition methods generally use the low-level features or high-level features. The advantages of these methods are simple and easy to implement, however, this paper uses the Ada Boost model for the efficient analysis. The simulation results have proven the performance.","","978-1-7281-4685-0","10.1109/ICICT48043.2020.9112444","","https://ieeexplore.ieee.org/stamp/stamp.jsp?arnumber=9112444","Ada Boost;data extraction;image understanding;scene detection;video processing","","computer based training;feature extraction;image classification;image recognition;sport;virtual reality","Ada Boost classifier;sports scene detection;data extraction;image understanding;virtual reality technology;VR sports simulation system;competitive sports;athletes;scene recognition methods;Ada Boost model","","","","22","","9 Jun 2020","","","IEEE","IEEE Conferences"
"The design and implementation of virtual system for the robot-assisted setting-bone surgery","M. Wang; L. Sun; Z. Du; Z. Jia",Harbin Inst. of Technol.; Harbin Inst. of Technol.; Harbin Inst. of Technol.; Harbin Inst. of Technol.,"2006 Bio Micro and Nanosystems Conference","26 Mar 2007","2006","","","53","57","Current training methods for interns and residents in teaching hospitals do not adequately raise spatial perception about geometry and topology changes of skeletal morphology. Two reasons for the inability are trainees can only observe an operation before he participates in a surgery and preoperative rehearsal usually involves 2D (two dimensional) paper surgical simulations based on X-ray images. Moreover, surgery visiting doctors may also fail in real operations even after evaluating topology and geometry changes on rigid bones, prostheses and bone grafts of all procedures by 2D paper simulations. The failure rates were reported as 10-20% for setting-bone surgery. Computer-based surgery simulation represents a rapidly emerging and increasingly important area of research that combines a number of disciplines for the common purpose of improving health care. Generally, the goal of computer-based surgery simulation is to enable a surgeon to experiment with different surgical procedures in an artificial environment. We are developing a virtual surgical simulator specifically for HIT-RAOS, the robot-assisted setting-bone surgery system, which involves both various robots modeling and patients modeling. To satisfy requires on surgery programming and surgery rehearse based on special patient, a novel method of biological tissue model and simulation based special CT images includes 10 series is proposed in this article. Biological tissue geometry model, physical model and mechanical equilibrium equation based on strain energy function are built. Biomechanical equations are solved by finite element method. To make sure the simulator can be available in diverse operation systems, Java3D and VRML are chosen as the main developing tools. Based all the works above, As application examples, femur models and simulation are given and a cutting skin experiment was conducted, the results are contented. This validity of method and mathematics model is tested to compare simulation outcome with biomechanical experimentation","","1-4244-0056-2","10.1109/BMN.2006.330928","","https://ieeexplore.ieee.org/stamp/stamp.jsp?arnumber=4129414","","Robots;Surgery;Biological system modeling;Computational modeling;Solid modeling;Computational geometry;Topology;Bones;Computer simulation;Biological tissues","biological tissues;biomechanics;biomedical education;bone;computer based training;computerised tomography;digital simulation;finite element analysis;health care;medical computing;medical robotics;orthopaedics;physiological models;surgery;virtual reality languages","virtual surgical simulator;robot-assisted setting-bone surgery;computer-based surgery simulation;health care;robots modeling;patients modeling;surgery programming;biological tissue geometry model;CT images;biological tissue physical model;mechanical equilibrium equation;strain energy function;biomechanical equations;finite element method;Java3D;VRML;femur models","","2","","11","","26 Mar 2007","","","IEEE","IEEE Conferences"
"A Kinect-Based System for Stroke Rehabilitation","S. Yeh; S. Lee; R. Chan; S. Chen","Computer Science and Information Engineering National Central University Taipei, Taiwan; Taipei Veterans General Hospital Taipei, Taiwan; Taipei Veterans General Hospital Taipei, Taiwan; Physical Therapy China Medical University, Taiwan Taipei, Taiwan","2019 Twelfth International Conference on Ubi-Media Computing (Ubi-Media)","30 Mar 2020","2019","","","192","198","Virtual reality (VR)-based stroke rehabilitation has been shown to be effective in increasing motivation and functional performance in stroke patients. The new motion-sensing technology, Kinect, is cost effective and does not require the patient to wear sensors on the body, which increases freedom of movement. The objective of this study was to use Kinect technology to develop a VR stroke rehabilitation system with unilateral and bilateral tasks for recovering the function of the upper extremity. This study tested the feasibility, therapeutic effectiveness, and user acceptance of this technology. Two participants with various levels of motor severity received 30-minute stroke rehabilitation 3 times per week over 8 weeks (a total 24 training sessions). The Wolf Motor Function Test (WMFT), Test Évaluant la performance des Membres supérieurs des Personnes Âgées (TEMPA), and Fugl-Meyer Assessment of Physical Performance (FMA) were used to collect data before and after rehabilitation, and during a follow-up to detect the changes of functional performance. Questionnaires of user acceptance of the technology were administered. On completion of the rehabilitation program, using the proposed Kinect-based VR training system, WMFT, TEMPA, and FMA results increased for both participants. The technology acceptance questionnaires indicated that participants had strong intentions to continue using the proposed system for rehabilitation. We developed the first Kinect-based stroke rehabilitation for the upper extremity, and demonstrated its feasibility and effectiveness in improving upper extremity function after a stroke. A large-scale study should be conducted to test the effectiveness of the proposed system for stroke rehabilitation.","","978-1-7281-2820-7","10.1109/Ubi-Media.2019.00045","","https://ieeexplore.ieee.org/stamp/stamp.jsp?arnumber=9049601","Stroke, upper extremity, effectiveness, virtual-reality therapy","Task analysis;Stroke (medical condition);Extremities;Three-dimensional displays;Training;Medical treatment;Atmospheric measurements","image motion analysis;medical disorders;medical image processing;patient rehabilitation;virtual reality","physical performance;rehabilitation program;Kinect-based VR training system;Kinect-based stroke rehabilitation;upper extremity function;Kinect-based system;virtual reality-based stroke rehabilitation;stroke patients;motion-sensing technology;Kinect technology;VR stroke rehabilitation system;bilateral tasks;motor severity;stroke rehabilitation;Wolf Motor Function Test;Test Evaluant la performance des Membres superieurs des Personnes Agees;time 8.0 week","","","","16","","30 Mar 2020","","","IEEE","IEEE Conferences"
