"MPEG Media Transport (MMT) for 3D Tele-Immersion Systems","K. Venkatraman; S. Vellingiri; B. Prabhakaran; N. Nguyen","Univ. of Texas at Dallas, Richardson, TX, USA; Univ. of Texas at Dallas, Richardson, TX, USA; Univ. of Texas at Dallas, Richardson, TX, USA; TIN Consulting, Richardson, TX, USA","2014 IEEE International Symposium on Multimedia","9 Feb 2015","2014","","","279","282","3D Tele-Immersion (3DTI) environments are a new medium for highly interactive and immersive means of collaborations through a shared virtual 3D environment. They have many applications in the areas of education, entertainment, sports training, tele-medicine etc. The data in these systems are multi-modal, some high volume, some high frequency and all highly correlated. We identify three major challenges in a general 3DTI system, session management, synchronization and data format conversion. We discuss the shortcomings of some of the existing protocols/solutions to them. We describe some features relevant to 3DTI of the MPEG Media Transport (MMT) standard. In this paper we evaluate the use of MMT in a 3DTI application. We provide a feature comparison with the most popular protocols currently being used in such applications, RTP, RTSP, TCP and UDP etc. MPEG DASH was another protocol that was being considered, but that also fails to fully address some of the challenges that 3DTI applications face. Through this comparison study we advocate the use of MMT in 3DTI applications.","","978-1-4799-4311-1","10.1109/ISM.2014.65","","https://ieeexplore.ieee.org/stamp/stamp.jsp?arnumber=7033039","Tele-Immersion;MPEG Media Transport;Haptic;Body Sensor Networks","Media;Synchronization;Transform coding;Encapsulation;Three-dimensional displays;Transport protocols","multimedia computing;synchronisation;virtual reality","MPEG media transport;MMT;3D tele-immersion systems;3DTI;shared virtual 3D environment;session management;data format conversion;synchronization;feature comparison;RTP;RTSP;TCP;UDP;MPEG DASH","","3","","9","","9 Feb 2015","","","IEEE","IEEE Conferences"
"From Video Game to Real Robot: The Transfer Between Action Spaces","J. Karttunen; A. Kanervisto; V. Kyrki; V. Hautamäki","Karelics Oy,Joensuu,Finland; University of Eastern Finland,School of Computing,Joensuu,Finland; Aalto University,School of Electrical Engineering,Espoo,Finland; University of Eastern Finland,School of Computing,Joensuu,Finland","ICASSP 2020 - 2020 IEEE International Conference on Acoustics, Speech and Signal Processing (ICASSP)","9 Apr 2020","2020","","","3567","3571","Deep reinforcement learning has proven to be successful for learning tasks in simulated environments, but applying same techniques for robots in real-world domain is more challenging, as they require hours of training. To address this, transfer learning can be used to train the policy first in a simulated environment and then transfer it to physical agent. As the simulation never matches reality perfectly, the physics, visuals and action spaces by necessity differ between these environments to some degree. In this work, we study how general video games can be directly used instead of fine-tuned simulations for the sim-to-real transfer. Especially, we study how the agent can learn the new action space autonomously, when the game actions do not match the robot actions. Our results show that the different action space can be learned by re-training only part of neural network and we obtain above 90% mean success rate in simulation and robot experiments.","2379-190X","978-1-5090-6631-5","10.1109/ICASSP40776.2020.9053221","","https://ieeexplore.ieee.org/stamp/stamp.jsp?arnumber=9053221","deep reinforcement learning;transfer learning;sim-to-real;reality gap;action space transfer","Training;Visualization;Neural networks;Transfer learning;Games;Task analysis;Robots","computer games;learning (artificial intelligence);neural nets;robots","video game;deep reinforcement learning;simulated environment;real-world domain;transfer learning;physical agent;general video games;fine-tuned simulations;game actions;robot actions;action space;mean success rate;robot experiments;learning tasks;visuals spaces;physics spaces;neural network","","","","19","","9 Apr 2020","","","IEEE","IEEE Conferences"
"Volumetric Capture of Humans With a Single RGBD Camera via Semi-Parametric Learning","R. Pandey; A. Tkach; S. Yang; P. Pidlypenskyi; J. Taylor; R. Martin-Brualla; A. Tagliasacchi; G. Papandreou; P. Davidson; C. Keskin; S. Izadi; S. Fanello",Google; Google; Google; Google; Google Inc.; Google; Google Inc.; Ariel AI; Google Inc.; Google; Google; Google,"2019 IEEE/CVF Conference on Computer Vision and Pattern Recognition (CVPR)","9 Jan 2020","2019","","","9701","9710","Volumetric (4D) performance capture is fundamental for AR/VR content generation. Whereas previous work in 4D performance capture has shown impressive results in studio settings, the technology is still far from being accessible to a typical consumer who, at best, might own a single RGBD sensor. Thus, in this work, we propose a method to synthesize free viewpoint renderings using a single RGBD camera. The key insight is to leverage previously seen “calibration” images of a given user to extrapolate what should be rendered in a novel viewpoint from the data available in the sensor. Given these past observations from multiple viewpoints, and the current RGBD image from a fixed view, we propose an end-to-end framework that fuses both these data sources to generate novel renderings of the performer. We demonstrate that the method can produce high fidelity images, and handle extreme changes in subject pose and camera viewpoints. We also show that the system generalizes to performers not seen in the training data. We run exhaustive experiments demonstrating the effectiveness of the proposed semi-parametric model (i.e. calibration images available to the neural network) compared to other state of the art machine learned solutions. Further, we compare the method with more traditional pipelines that employ multi-view capture. We show that our framework is able to achieve compelling results, with substantially less infrastructure than previously required.","2575-7075","978-1-7281-3293-8","10.1109/CVPR.2019.00994","","https://ieeexplore.ieee.org/stamp/stamp.jsp?arnumber=8954320","3D from Single Image;Deep Learning ; Image and Video Synthesis","","calibration;cameras;image colour analysis;image sensors;image texture;interactive systems;learning (artificial intelligence);rendering (computer graphics);virtual reality","single RGBD camera;semiparametric learning;volumetric performance capture;4D performance capture;studio settings;typical consumer;single RGBD sensor;free viewpoint renderings;calibration images;multiple viewpoints;current RGBD image;end-to-end framework;data sources;novel renderings;high fidelity images;camera viewpoints;training data;semiparametric model;employ multiview capture;machine learned solutions","","","","51","","9 Jan 2020","","","IEEE","IEEE Conferences"
"Study of classification model for college students' M-learning strategies based on PCA-LVQ neural network","S. Hu; Y. Gu; H. Jiang","Teaching and Research Institute of Foreign Languages, Bohai University, Jinzhou, Liaoning, China; Teaching and Research Institute of Foreign Languages, Bohai University, Jinzhou, Liaoning, China; Teaching and Research Institute of Foreign Languages, Bohai University, Jinzhou, Liaoning, China","2015 8th International Conference on Biomedical Engineering and Informatics (BMEI)","11 Feb 2016","2015","","","742","746","Study of learner-oriented mobile learning (m-learning) instructions based on classification of student m-learning strategies has aroused much attention over the last decade. Due to the multivariate nature of students' learning strategies, traditional classification methods often fail to produce reliable classification results. In this paper, a new classification method based on Principal Component Analysis (PCA) and Learning Vector Quantization (LVQ) neural network is proposed. PCA was first used to reduce the dimensionality of original data about students' learning strategies. 5 principal components were extracted to create a PCA-LVQ classification model. The classification result of the proposed model was compared with those produced by a simple LVQ network model and a standard BP network model. The simulation results show that compared with the other two networks, the PCA-LVQ model has a better performance in training speed, classification accuracy and generalization ability.","","978-1-5090-0022-7","10.1109/BMEI.2015.7401601","","https://ieeexplore.ieee.org/stamp/stamp.jsp?arnumber=7401601","LVQ neural network;PCA;classification;m-learning strategy","Neurons;Principal component analysis;Training;Correlation;Indexes;Neural networks;Data mining","data reduction;further education;mobile learning;neural nets;pattern classification;principal component analysis;vector quantisation","generalization ability;training speed;dimensionality reduction;learner-oriented mobile learning instructions;learning vector quantization neural network;principal component analysis;PCA-LVQ neural network;college students m-learning strategies;classification model","","","","10","","11 Feb 2016","","","IEEE","IEEE Conferences"
"Identifying and ranking factors in evaluating the Web 2.0-based educational simulation games","K. M. Davood; S. Afsaneh","Department of IT Management, Central Office, Payame Noor University, Tehran, Iran; Department of IT Management, Payame Noor University, Tehran, Iran","4th International Conference on e-Learning and e-Teaching (ICELET 2013)","12 Dec 2013","2013","","","14","19","Today, modern methods of training are developed with the aid of information technology to help learners better understand the circumstances of real organizations and increase the power of relating between classroom theoretical concepts and practical concepts in the real world. Training by simulation games is one of the training tools that due to the rapid development of network technology is significantly developed and if used correctly highly influences teaching and learning. The general aim of this research is to identify and rank the evaluation factors of training simulation games for optimum designing or selecting the best simulation game in training. For this purpose after reviewing the literature and studying the models and frameworks presented about the development and design of serious and simulation games, their main elements and components were identified. Then by using The Delphi method and opinions of 15 Training and simulation games experts, Factors that had the greatest deal of emphasis were presented in the form of 3 Psychological, Educational, and Technical dimensions and 30 evaluation factors and after comparing and rating the factors by the experts the answers were analyzed and ranked. Ranking the evaluation factors in this research shows that technical and educational factors had higher importance in the experts' view than the psychological factors. Also the high rank of web2.0 factors among the technical factors shows the high importance of educational simulation games in web context 2.0 in experts' view.","2163-6982","978-1-4673-5268-0","10.1109/ICELET.2013.6681638","","https://ieeexplore.ieee.org/stamp/stamp.jsp?arnumber=6681638","Simulation Game;Serious Game;Web 2.0;e-Learning","Psychology;Computational modeling;Visualization;Reliability;Safety;Games","computer aided instruction;computer games;forecasting theory;Internet","Web 2.0-based educational simulation games;information technology;real organizations;training tools;Delphi method;psychological factors;educational factors;technical factors","","","","30","","12 Dec 2013","","","IEEE","IEEE Conferences"
"Invigorating of the Quality Engineering and Management education by virtual educational laboratories","K. Zgodavova; P. Palfy; L. Lengyel","Technical University of Kosice / Faculty of Metallurgy/Department of Integrated Management Systems, Slovakia; Technical University of Kosice / Faculty of Metallurgy/Department of Integrated Management Systems, Slovakia; Faurecia Slovakia, s.r.o., Bratislava, Slovakia","2016 International Conference on Emerging eLearning Technologies and Applications (ICETA)","2 Jan 2017","2016","","","381","386","The purpose of the paper is to provide generalized knowledge about the education and training within the Quality Engineering and Management study programs with the application of information and communication technologies (ICT) in the environment of CRELABTE virtual laboratories, which enable simulation of specific situations from industrial practice. The infrastructure of CRELABTE consists of hardware (remote server) and software supporting laboratory tasks in the subjects of related study programs. The paper also describes a new floor shop manual data entry system KONIS® for the invigoration of the laboratory education. KONIS® software supports training in decision making regarding product quality through remote access to the information.","","978-1-5090-4701-7","10.1109/ICETA.2016.7802078","","https://ieeexplore.ieee.org/stamp/stamp.jsp?arnumber=7802078","","Laboratories;Training;Servers;Companies;Information and communication technology","computer based training;engineering education;management education;product quality;quality management;virtual instrumentation","training;quality engineering and management education;quality engineering and management study programs;information and communication technologies;CRELABTE virtual laboratories;remote server;floor shop manual data entry system;KONIS software;decision making;product quality;remote information access","","1","","17","","2 Jan 2017","","","IEEE","IEEE Conferences"
"Safety Model Scenarios in the Synthetic Air Traffic Management Environment on Bases of LETVIS Real Information System","M. Žentek; P. Bučka","Armed Forces Academy of general M. R., Štefánik in Liptovský Mikuláš, Liptovský Mikuláš, Slovakia; Armed Forces Academy of general M. R., Štefánik in Liptovský Mikuláš, Liptovský Mikuláš, Slovakia","2019 New Trends in Aviation Development (NTAD)","21 Oct 2019","2019","","","218","222","The implementation of the deployment of new information and communication technologies as well as the possibility of their safe use are an important part for the functionality of the system to achieve the required level of safety of air traffic control services in the Slovak airspace. The condition to use the “LETVIS” flight information system in the Slovak Republic's Armed Forces for air traffic services is currently a potential option for the occurrence of undesirable security incidents in such an environment, and this could result in a human factor failure while the commands in the airspace are being issued or executed. Appropriate application of scientific research in a synthetic environment makes it possible to optimize and verify the correctness of training principles by the form of modular exercises which are aimed for solving the crisis situations. This would make the air traffic controllers prepared for a safety incident in practice and they could eliminate some fatal consequences. Some of the possible scenarios of occurrence and safety incidents on the radar screen output of this information system are analyzed in this paper.","","978-1-7281-4079-7","10.1109/NTAD.2019.8875569","","https://ieeexplore.ieee.org/stamp/stamp.jsp?arnumber=8875569","","Security;Aircraft;Radar;Air traffic control;Safety;Military aircraft;Information and communication technology","air traffic;air traffic control;human factors;military computing;safety;security","safety model scenarios;synthetic air traffic management environment;information and communication technologies;air traffic control services;Slovak airspace;LETVIS flight information system;air traffic services;human factor failure;air traffic controllers;safety incident;LETVIS real information system;Slovak Republic armed forces;security incidents","","","","15","","21 Oct 2019","","","IEEE","IEEE Conferences"
"Learning an Action-Conditional Model for Haptic Texture Generation","N. Heravi; W. Yuan; A. M. Okamura; J. Bohg","Stanford University,Department of Mechanical Engineering; Carnegie Mellon University,Robotics Institute; Stanford University,Department of Mechanical Engineering; Stanford University,Department of Computer Science","2020 IEEE International Conference on Robotics and Automation (ICRA)","15 Sep 2020","2020","","","11088","11095","Rich haptic sensory feedback in response to user interactions is desirable for an effective, immersive virtual reality or teleoperation system. However, this feedback depends on material properties and user interactions in a complex, non-linear manner. Therefore, it is challenging to model the mapping from material and user interactions to haptic feedback in a way that generalizes over many variations of the user's input. Current methodologies are typically conditioned on user interactions, but require a separate model for each material. In this paper, we present a learned action-conditional model that uses data from a vision-based tactile sensor (GelSight) and user's action as input. This model predicts an induced acceleration that could be used to provide haptic vibration feedback to a user. We trained our proposed model on a publicly available dataset (Penn Haptic Texture Toolkit) that we augmented with GelSight measurements of the different materials. We show that a unified model over all materials outperforms previous methods and generalizes to new actions and new instances of the material categories in the dataset.","2577-087X","978-1-7281-7395-5","10.1109/ICRA40945.2020.9197447","","https://ieeexplore.ieee.org/stamp/stamp.jsp?arnumber=9197447","","Haptic interfaces;Autoregressive processes;Force;Acceleration;Predictive models;Solid modeling;Discrete Fourier transforms","feedback;haptic interfaces;human-robot interaction;image texture;learning (artificial intelligence);mobile robots;robot vision;tactile sensors;telerobotics;virtual reality","Haptic Texture generation;haptic sensory feedback;user interactions;immersive virtual reality;material properties;haptic vibration feedback;Penn Haptic Texture Toolkit;action-conditional model learning;GelSight measurements;teleoperation system;autonomous robot;GelSight image texture","","","","33","","15 Sep 2020","","","IEEE","IEEE Conferences"
"OxyBlood","A. F. S. Barbosa; F. G. M. Silva","Instituto de Telecomunicações, Dep. Informática, Universidade da Beira Interior, 6201-001 Covilhã, Portugal; Instituto de Telecomunicações, Dep. Informática, Universidade da Beira Interior, 6201-001 Covilhã, Portugal","6th Iberian Conference on Information Systems and Technologies (CISTI 2011)","4 Aug 2011","2011","","","1","4","With the growth of the video game industry, interest in video game research has increased, leading to the study of Serious Games. Serious Games are generally perceived as games with purposes other than mere entertainment. These purposes range from education to training, marketing to design, among others. By exploiting the potential of these virtual worlds, we can provide the possibility to experience situations that would otherwise be impossible to experience in the real world, mainly due to reasons of cost, safety and time. Web browsers can now provide easy access to realistic virtual worlds with WebGL, which grants video game developers the tools to create compelling and rich environments that can be used in the future by virtually anyone. This paper presents a prototype of a Serious Game developed with WebGL.","2166-0735","978-989-96247-5-7","","","https://ieeexplore.ieee.org/stamp/stamp.jsp?arnumber=5974333","Serious Games;3D Games;WebGL;Browser","Lead;Games","computer games;online front-ends;virtual reality","OxyBlood;WebGL;video game industry;video game research;serious games;entertainment;virtual worlds;Web browsers","","","","26","","4 Aug 2011","","","IEEE","IEEE Conferences"
"Network-Assisted Neural Adaptive Naked-Eye 3D Video Streaming Over Wireless Networks","Y. Liu; W. He; Y. Wang; H. Yang","School of Information and Communication Engineering, Beijing University of Posts and Telecommunications, Beijing, China; School of Information and Communication Engineering, Beijing University of Posts and Telecommunications, Beijing, China; School of Information and Communication Engineering, Beijing University of Posts and Telecommunications, Beijing, China; School of Information and Communication Engineering, Beijing University of Posts and Telecommunications, Beijing, China","IEEE Access","7 Oct 2019","2019","7","","141363","141373","High quality transmission of Virtual Reality (VR) video depends strictly on bandwidth and delay requirements. It becomes possible with the maturity and commercialization of 5G technology. However, to transmit VR video streaming over wireless communication system, we must cope with the challenge that fluctuation exists in the wireless channel conditions. For example, available channel bandwidth, packet loss rate, and interference level may vary with time due to channel fading and user's mobility. The problem is more prominent when transmitting naked-eye 3D video which generally consists of multiple viewpoints with different resolutions. In order to optimize the quality of experience (QoE) of watching naked-eye VR video over wireless networks, this paper proposes a network-assisted neural adaptive video streaming algorithm (NAVSA). Specifically, we present a modified QoE function to describe the quality of naked-eye 3D streaming quantitatively, which not only considers the quality of naked-eye 3D video itself, but also considers the phenomenon of rebuffering and video fluctuation that occurs during video transmission. Next, with the network-assisted feedback, the physical layer information, the buffer occupancy of the video client, and the size of the next video chunk are collected to train a reinforcement learning model. Based on dynamic adaptive streaming over HTTP (DASH), the model can automatically choose appropriate viewpoints and resolutions corresponding to the current condition of the wireless networks such that the network capacity can be fully explored. To verify the performance of our proposed NAVSA, we simulate 3 naked-eye 3D video application scenarios on the NS3 platform. The results show that the performance of NAVSA is about 5~8% better than some state-of-the-art algorithms in wireless networks.","2169-3536","","10.1109/ACCESS.2019.2944437","","https://ieeexplore.ieee.org/stamp/stamp.jsp?arnumber=8852692","Reinforcement learning;adaptive transmission;naked-eye 3D;network assistance;wireless networks","Streaming media;Three-dimensional displays;Quality of experience;Wireless networks;Bandwidth;Adaptive systems;Reinforcement learning","5G mobile communication;bandwidth allocation;channel allocation;fading channels;learning (artificial intelligence);mobility management (mobile radio);neural nets;quality of experience;radiofrequency interference;transport protocols;video streaming;virtual reality","naked-eye 3D video;naked-eye 3D video application;5G technology;quality of experience;NAVSA;reinforcement learning model;dynamic adaptive streaming over HTTP;DASH;network-assisted neural adaptive video streaming algorithm;naked-eye VR video;channel bandwidth;wireless channel conditions;wireless communication system;Virtual Reality video;network-assisted neural adaptive naked-eye 3D video streaming;NS3 platform;wireless networks;network-assisted feedback;video transmission","","","","45","CCBY","30 Sep 2019","","","IEEE","IEEE Journals"
