"Supplemental Cultivation Plan of Innovation Quality for the Undergraduates of Building Environment and Energy Engineering in the Applied Technology Universities","Q. Qiu; Y. Hu; J. Liu; Q. Liu; Z. Dong","Wuhan Business University,School of Mechanical and Electrical Engineering,Dept. of Building Environment and Energy Engineering,Wuhan,China; Wuhan Business University,School of Mechanical and Electrical Engineering,Dept. of Building Environment and Energy Engineering,Wuhan,China; Wuhan Business University,School of Mechanical and Electrical Engineering,Dept. of Building Environment and Energy Engineering,Wuhan,China; Wuhan Business University,School of Mechanical and Electrical Engineering,Dept. of Building Environment and Energy Engineering,Wuhan,China; Wuhan Business University,School of Mechanical and Electrical Engineering,Dept. of Building Environment and Energy Engineering,Wuhan,China","2020 International Conference on Artificial Intelligence and Education (ICAIE)","23 Nov 2020","2020","","","459","462","One of the most fundamental qualities for science research and technology development is the innovation quality, which covers many aspects such as consciousness, method and spirit. The innovation quality developed in the undergraduate period would be the most basic foundation in their over forty-years working life. A supplemental cultivation plan with a routine consisting of hardware, programming, simulation and optimization was presented in this paper for the undergraduates of Building Environment and Energy Engineering (BEEE). The hardware manufacture of digital devices was trained to promote the freshmen manipulative capability, while software programming with general-purpose languages was introduced to enhance the comprehension of data analysis in the 2nd academic year. During the period when some professional courses were taught, the building simulation modular could be introduced to enhance the understanding for the building thermal process and its corresponding Heating, Ventilating, Air-conditioning and Refrigeration (HVAC & R) system. A building management system (BMS) would be developed step by step and interactive with virtual building platform. That BMS and its virtual cases could be employed as the testbed for optimization of HVAC & R system, such as energy consumption prediction, fault detection and diagnosis. Python and EnergyPlus were used in the custom training program oriented to the employment direction for the system operation and maintenance. Group achievements and individual cases show that the presented supplemental cultivation plan played a very important role in the cultivation of BEEE graduates' innovative quality. The effect for the graduated students need pay more attention to investigate the long-term effects, and more volunteers will participate in this plan to find out their better future.","","978-1-7281-6659-9","10.1109/ICAIE50891.2020.00111","","https://ieeexplore.ieee.org/stamp/stamp.jsp?arnumber=9262525","cultivation plan;innovation quality;applied technology university;building environment and energy engineering;operation and maintenance","Buildings;Training;Technological innovation;Software;Python;Programming;Maintenance engineering","building management systems;computer aided instruction;data analysis;educational courses;educational institutions;electrical engineering education;energy consumption;further education;HVAC;virtual reality","building simulation modular;building thermal process;building management system;virtual building platform;HVAC & R system;custom training program;supplemental cultivation plan;air conditioning and refrigeration system;building environment and energy engineering;BEEE undergraduates;professional courses;Python;EnergyPlus;system operation;system maintenance;software programming;hardware manufacture;applied technology universities;innovation quality","","","","6","","23 Nov 2020","","","IEEE","IEEE Conferences"
"Resting state functional connectivity and task-related effective connectivity changes after upper extremity rehabilitation: a pilot study","S. Saleh; S. V. Adamovich; E. Tunik","New Jersey Institute of Technology, Newark, 07102 USA; New Jersey Institute of Technology, Newark, 07102 USA; School of Health Related Professions and the school of Biomedical Sciences at the University of Medicine and Dentistry, Newark, 07107, USA","2012 Annual International Conference of the IEEE Engineering in Medicine and Biology Society","10 Nov 2012","2012","","","4559","4562","In this study we investigated the effect of 2 weeks of robot-aided virtual reality therapy for the paretic upper limb in stroke patients on changes in brain activation. Brain activation was acquired during the resting state and during visually-guided hand movement. fMRI analysis focused on characterizing functional connectivity with ipsilesional primary motor cortex (iM1) at rest and during execution of paretic hand movement. Two subjects who sustained a stroke more than 6 months ago participated. Before and after the training period, motor function was evaluated (Wolf Motor Function Test [WMFT], Jebsen Test of Hand Function [JTHF]). After the training period, clinical outcomes (WMFT and JTHF) improved in both subjects. The resting state functional connectivity (rsFC) maps and task-related functional connectivity with iM1 showed different magnitudes of activation, however, the general directionality of the pattern (increases versus decreases) was similar. Specifically, both the rsFC and the task-related functional connectivity between iM1 and contralesional primary motor cortex (cM1) decreased after the therapy for the first subject and increased for the second subject. Our preliminary data suggest that resting state functional connectivity may be a useful measure of brain reorganization, particularly for subjects with limited volitional control of the paretic limb.","1558-4615","978-1-4577-1787-1","10.1109/EMBC.2012.6346981","","https://ieeexplore.ieee.org/stamp/stamp.jsp?arnumber=6346981","stroke;fMRI connectivity;brain reorganization;hand rehabilitation","Training;Kinematics;Medical treatment;Lesions;Robots;Magnetic resonance imaging;Correlation","biomedical MRI;medical disorders;medical robotics;neurophysiology;patient rehabilitation;virtual reality","resting state functional connectivity;task related effective connectivity change;upper extremity rehabilitation;robot aided virtual reality therapy;paretic upper limb;stroke patients;brain activation;visually guided hand movement;fMRI analysis;ipsilesional primary motor cortex;paretic hand movement;Wolf Motor Function Test;Jebsen Test of Hand Function;task related functional connectivity","Aged;Brain Mapping;Connectome;Humans;Magnetic Resonance Imaging;Male;Middle Aged;Motor Cortex;Movement;Neuronal Plasticity;Paresis;Paresis;Paresis;Pilot Projects;Psychomotor Performance;Recovery of Function;Rest;Treatment Outcome;Upper Extremity","3","","20","","10 Nov 2012","","","IEEE","IEEE Conferences"
"Classification of college students' mobile learning strategies based on principal component analysis and probabilistic neural network","Shuai Hu; Yingxin Cheng","Teaching and Research Institute of Foreign Languages, Bohai University, Jinzhou, China; Teaching and Research Institute of Foreign Languages, Bohai University, Jinzhou, China","2015 4th International Conference on Computer Science and Network Technology (ICCSNT)","16 Jun 2016","2015","01","","58","61","To increase classification accuracy of college students' mobile learning (m-learning) strategies in foreign language learning, a classification model based on principal component analysis (PCA) and probabilistic neural network (PNN) is proposed. First, an index system of college student m-learning strategy evaluation was established. Second, PCA was employed to reduce the dimensions of the original data of students' m-learning strategies obtained through questionnaire. Five principal components were extracted to be the input variables of PNN to create a PCA-PNN classification model. Third, a simulation experiment was done to compare the classification effectiveness of the established PCA-PNN model with a PNN model and a BPNN model. The experiment result shows that the PCA-PNN model has simpler network architecture, faster convergence speed, higher accuracy and better generalization ability, which proves the effectiveness of the proposed model.","","978-1-4673-8173-4","10.1109/ICCSNT.2015.7490708","","https://ieeexplore.ieee.org/stamp/stamp.jsp?arnumber=7490708","principal component analysis;probabilistic neural network;classification;mobile learning strategy","Principal component analysis;Neurons;Training;Neural networks;Mobile computing;Mobile communication;Probabilistic logic","convergence;further education;generalisation (artificial intelligence);mobile learning;neural nets;pattern classification;principal component analysis","college student mobile learning strategy classification;principal component analysis;probabilistic neural network;m-learning;foreign language learning;principal component extraction;PCA-PNN classification model;convergence speed;generalization ability","","","","9","","16 Jun 2016","","","IEEE","IEEE Conferences"
"Exploiting Transfer Learning for Emotion Recognition Under Cloud-Edge-Client Collaborations","D. Wu; X. Han; Z. Yang; R. Wang","Chongqing Key Laboratory of Optical Communication and Networks, Chongqing Key Laboratory of Ubiquitous Sensing and Networking, School of Communication and Information Engineering, Chongqing University of Posts and Telecommunications, Chongqing, China; Chongqing Key Laboratory of Optical Communication and Networks, Chongqing Key Laboratory of Ubiquitous Sensing and Networking, School of Communication and Information Engineering, Chongqing University of Posts and Telecommunications, Chongqing, China; School of Communication and Information Engineering, Chongqing University of Posts and Telecommunications, Chongqing, China; Chongqing Key Laboratory of Optical Communication and Networks, Chongqing Key Laboratory of Ubiquitous Sensing and Networking, School of Communication and Information Engineering, Chongqing University of Posts and Telecommunications, Chongqing, China","IEEE Journal on Selected Areas in Communications","14 Jan 2021","2021","39","2","479","490","Emerging virtual reality/augmented reality games and self-driving cars necessitate accurate/responsive/private emotion recognition. Usually, traditional emotion recognition models are deployed at central servers, which results in the lack of abilities in generalization and covering the individual variation of clients. This paper proposes a responsive, localized, and private transfer learning based emotion recognition framework under the cloud-edge-client collaborations. Additionally, a 3-dimensional channel mapping method is designed to aggregate features extracted from electroencephalogram (EEG) signals for the generic emotion recognition model, which is further localized and personalized using transfer learning. Simulation results validate the performance of the proposed TLER framework in reducing model training time and improving emotion recognition accuracy.","1558-0008","","10.1109/JSAC.2020.3020677","National Natural Science Foundation of China; Science and Technology Research Program of Chongqing Municipal Education Commission; Natural Science Foundation of Chongqing of China; Science and Technology Research Program of Chongqing Municipal Education Commission; ","https://ieeexplore.ieee.org/stamp/stamp.jsp?arnumber=9187207","Electroencephalogram;emotion recognition;transfer learning;cloud-edge-client collaboration","Brain modeling;Emotion recognition;Electroencephalography;Feature extraction;Machine learning;Collaboration;Scalp","augmented reality;cloud computing;computer games;electroencephalography;emotion recognition;feature extraction;learning (artificial intelligence);medical signal processing","cloud-edge-client collaborations;self-driving cars;3-dimensional channel mapping;responsive transfer learning based emotion recognition;localized transfer learning based emotion recognition;private transfer learning based emotion recognition;electroencephalogram signals;feature extraction;TLER framework;virtual reality-augmented reality games","","1","","43","IEEE","7 Sep 2020","","","IEEE","IEEE Journals"
"Providing a Baseline in Software Process Improvement Education with Lego Scrum Simulations","J. Steghöfer","Dept. of Comput. Sci. & Eng., Chalmers | Univ. of Gothenburg, Gothenburg, Sweden","2018 IEEE/ACM 40th International Conference on Software Engineering: Software Engineering Education and Training (ICSE-SEET)","26 Aug 2018","2018","","","126","135","A critical aspect of software process education in general and software process improvement (SPI) education in particular is to give students the chance to experience processes and issues associated with process at first hand. This is, however, often difficult in an educational setting since providing a meaningful project in which to apply a process can take away time and focus from the intended learning objectives. Instead, miniatures and simulations can be used to create an environment in which students can interact with processes directly without taking up large parts of the curriculum. In this paper, we report on our experience of using Lego Scrum simulations in an SPI course at the Bachelor level. The simulations are used both to introduce a baseline for the students to let them experience process issues directly, create an improvement plan that addresses observed issues, and to apply and evaluate the plan in a second simulation. This allows students to engage with SPI methods practically, instead of purely theoretically, and allows the teacher to refer to the shared experience throughout the course. The collected data shows that the approach is suitable, but that students struggle with the demand of putting an improvement plan into practice. We show which issues commonly occur in the simulations and thus allow teachers who adopt the practice to scaffold it and react accordingly, in particular to empower the students to take on responsibility for the improvement of the process.","","978-1-4503-5660-2","","","https://ieeexplore.ieee.org/stamp/stamp.jsp?arnumber=8445190","Software Process Improvement;SPI;Software Engineering Education;Scrum","Education;Software;Software engineering;Scrum (Software development);Interviews;Industries;Reflection","computer science education;educational courses;software process improvement;software prototyping","software process improvement education;Lego Scrum simulations;educational setting;SPI course;improvement plan;SPI methods;shared experience;learning objectives;baseline provision","","","","30","","26 Aug 2018","","","IEEE","IEEE Conferences"
"An Ontology based approach to teach Computational Thinking","C. Araújo; L. V. O. Lima; P. R. Henriques","Universidade do Minho,Centro Algoritmi / Dep. de Informática,Braga,Portugal; Universidade do Minho,Centro Algoritmi / Dep. de Informática,Braga,Portugal; Universidade do Minho,Centro Algoritmi / Dep. de Informática,Braga,Portugal","2019 International Symposium on Computers in Education (SIIE)","28 Jan 2020","2019","","","1","6","This paper is focused on the teaching/learning process of Computational Thinking at primary and secondary schools. It is generally accepted that Programming is a complex task that requires a long learning process. Theoretical knowledge about fundamentals on algorithms and data structures, as well as, on programming languages are required but are not enough; practicing a lot is also necessary. However, teaching Computer Programming is a hard job, most of the times unsuccessful. To overcome all the difficulties, felt by teachers and students, an increasingly bigger community of researchers in Computer Science is defending the importance of teaching Computational Thinking to young students to train them, since very earlier, in logic and abstract reasoning for problem solving. Our starting point to approach this topic relies on the use of an Ontology (OntoCnE) that describes in detail the concepts “Computational Thinking” and “Programming”, and maps those concepts to different education levels, starting with the first year. We believe that a person just acquires a new way of thinking, or a new way of behaving, if he is trained with the appropriate learning resources. So a main investment to educate people in Computational Thinking is on the choice/creation of those convenient resources. In particular we intended to investigate the impact of Augmented Reality in the usefulness of the referred resources. In that direction we will also discuss the development of a Web Platform to help on collecting and classifying (according to the referred ontology) learning resources to be used by teachers in computing classes. On the other hand, the platform will help on the retrieval, from that repository, of the most adequate resources to teach a specific subject to a specific level.","","978-1-7281-3182-5","10.1109/SIIE48397.2019.8970131","","https://ieeexplore.ieee.org/stamp/stamp.jsp?arnumber=8970131","computational thinking;programming;learning resource;teacher support tools;ontology","","augmented reality;computer aided instruction;educational courses;educational institutions;ontologies (artificial intelligence);teaching","ontology based approach;computational thinking;long learning process;programming languages;computer programming;computer science;computing classes;learning resources","","1","","15","","28 Jan 2020","","","IEEE","IEEE Conferences"
"Markov Model Assessment of Subjects' Clinical Skill Using the E-Pelvis Physical Simulator","T. R. Mackel; J. Rosen; C. M. Pugh","Rockwell Collins Inc., Cedar Rapids; NA; NA","IEEE Transactions on Biomedical Engineering","19 Nov 2007","2007","54","12","2133","2141","Inherent difficulties evaluating clinical competence of physicians has led to the widespread use of subjective skill assessment techniques. Inspired by an analogy between spoken language and surgical procedure, a generalized methodology using Markov models (MMs), independent of the modality under study, was developed. The methodology applied to an endoscopic experiment in ""Generalized approach for modeling minimally invasive surgery as a stochastic process using a discrete Markov model"" by J. Rosen et al. (IEEE Trans. Biomed. Eng., Vol. 53, No. 3, pp. 399-413, Mar. 2006) is modified and applied to data collected with the E-Pelvis physical simulator. The simulator incorporates five contact pressure sensors located in key anatomical landmarks. Two 32-state fully connected MMs are used, one for each skill level. Each state corresponds to a unique five-dimensional signature of contact pressures. Statistical distances measured between models representing subjects with different skill levels are sensitive enough to provide an objective measure of medical skill level. The method was tested with 41 expert subjects and 41 novice subjects in addition to the 30 subjects used for training the MM. Of the 82 subjects, 76 (92%) were classified correctly. Unique state transitions as well as pressure magnitudes for corresponding states were found to be skill dependent. The ""white box"" nature of the model provides insight into the examination process performed.","1558-2531","","10.1109/TBME.2007.908338","","https://ieeexplore.ieee.org/stamp/stamp.jsp?arnumber=4376256","Classification;E-Pelvis;Markov model (MM);pressure sensing;skill assessment","Hidden Markov models;Medical simulation;Natural languages;Minimally invasive surgery;Biomedical measurements;Medical treatment;Medical robotics;Automatic speech recognition;Jacobian matrices;Stochastic processes","biomedical education;Markov processes;training","white box model;medical skill level;contact pressure sensors;endoscopic experiment;subjective skill assessment techniques;physician clinical competence;E-pelvis physical simulator;clinical skill assessment;Markov model","Computer-Assisted Instruction;Expert Systems;Female;Gynecology;Gynecology;Humans;Markov Chains;Obstetrics;Obstetrics;Palpation;Palpation;Pelvis;Physical Examination;Physical Examination;Professional Competence;Students, Medical;Task Performance and Analysis;United States;User-Computer Interface","4","","25","","19 Nov 2007","","","IEEE","IEEE Journals"
"Power-optimized stiffness and nonlinear position control of an actuator with Variable Torsion Stiffness","P. Beckerle; J. Wojtusch; J. Schuy; B. Strah; S. Rinderknecht; O. v. Stryk","Institute for Mechatronic Systems, Department of Mechanical Engineering, Technische Universität Darmstadt, Germany; Simulation, Systems Optimization, and Robotics Group, Department of Computer Science, Technische Universität Darmstadt, Germany; Institute for Mechatronic Systems, Department of Mechanical Engineering, Technische Universität Darmstadt, Germany; Institute for Mechatronic Systems, Department of Mechanical Engineering, Technische Universität Darmstadt, Germany; Institute for Mechatronic Systems, Department of Mechanical Engineering, Technische Universität Darmstadt, Germany; Simulation, Systems Optimization, and Robotics Group, Department of Computer Science, Technische Universität Darmstadt, Germany","2013 IEEE/ASME International Conference on Advanced Intelligent Mechatronics","22 Aug 2013","2013","","","387","392","Introducing compliant actuation to robotic joints is an approach to ensure safety in closer human-machine interaction. Further, the possibility to adjust stiffness can be beneficial considering energy storage and the power consumption required to track certain trajectories. The subject of this paper is the stiffness and position control of the Variable Torsion Stiffness (VTS) actuator for application in compliant robotic joints. For the realization of a variable rotational stiffness, the active length of a torsional elastic element in serial configuration between drive and link is adjusted in VTS. After the deduction of an extended drive train model, this paper gives an advanced power analysis clarifying power-optimal settings from previous basic models and identifying additional settings that allow for a more versatile operation. Based on these results that can be generalized to other variable elastic actuator concepts, an optimized strategy for setting stiffness is determined considering the whole system dynamics including natural frequencies as well as antiresonance effects. For position control of VTS in a prototypical implementation, a nonlinear position controller is designed by means of feedback linearization. Although the system is modified significantly by changing drive train stiffness, the stiffness adaptation of the controller ensures the required tracking performance.","2159-6255","978-1-4673-5320-5","10.1109/AIM.2013.6584122","","https://ieeexplore.ieee.org/stamp/stamp.jsp?arnumber=6584122","","Robots","actuators;compliant mechanisms;control system synthesis;couplings;drives;elasticity;energy storage;feedback;human-robot interaction;linearisation techniques;nonlinear control systems;position control;power consumption;torsion;trajectory control","power-optimized stiffness;nonlinear position control;variable torsion stiffness actuator;compliant actuation;robotic joints;human-machine interaction;energy storage;power consumption;trajectory tracking;stiffness control;VTS actuator;compliant robotic joints;variable rotational stiffness;torsional elastic element;serial configuration;extended drive train model;advanced power analysis;power-optimal settings;natural frequencies;antiresonance effects;VTS position control;nonlinear position controller;feedback linearization;stiffness adaptation","","14","","16","","22 Aug 2013","","","IEEE","IEEE Conferences"
