"IDS: The intent driven selection method for natural user interfaces","F. Periverzov; H. Ilieş","Department of Mechanical Engineering, University of Connecticut, USA; Department of Mechanical Engineering, University of Connecticut, USA","2015 IEEE Symposium on 3D User Interfaces (3DUI)","25 Jun 2015","2015","","","121","128","We present a new selection technique that facilitates the use of natural hand gestures for virtual object manipulation in 3D. Our method supports the use of 3D imaging techniques for tracking the user's body and therefore it does not require the use of any hand held devices that would restrict the manipulative capabilities of the user's hands. The key contribution of our work is the novel use of characteristic behavioral cues, which are representative for general goal directed movement, to infer the object targeted by the user during selection. The resulting technique enables us to select objects whose largest dimension is smaller than the sensing resolution of our system in spite of body tracking uncertainties and hand placement faults. Furthermore, by means of intention inference, our method automatically adapts to the user's subjective need for variable levels of tolerance to hand placement faults, jitter, or tracking noise.","","978-1-4673-6886-5","10.1109/3DUI.2015.7131736","","https://ieeexplore.ieee.org/stamp/stamp.jsp?arnumber=7131736","","Three-dimensional displays;Tracking;Virtual environments;Fault tolerance;Fault tolerant systems;Imaging;Sensors","gesture recognition;inference mechanisms;user interfaces;virtual reality","intent driven selection method;natural user interfaces;natural hand gestures;virtual object manipulation;3D imaging techniques;users body tracking;characteristic behavioral cues;goal directed movement;intention inference;IDS","","2","","28","","25 Jun 2015","","","IEEE","IEEE Conferences"
"Improving Introductory Calculus Education with 3-D Visualizationand Virtual Touch (Haptics)","J. Boggess; C. Harding","Iowa State Univ., Ames; Iowa State Univ., Ames","Second International Multi-Symposiums on Computer and Computational Sciences (IMSCCS 2007)","4 Dec 2007","2007","","","312","317","Despite advances in 3-D computer graphics, students in introductory calculus classes still learn mainly by working with equations and the occasional 2-D diagram. When moving to more complex levels of calculations, we observed a need for aiding the students' understanding via 3-D visualization, but without the use of powerful, yet complicated, professional math software. In this paper, we will discuss some of the issues that early college students have visualizing 3-D mathematical shapes and graphs in their minds and what the use of 3-D computer graphics and the simulation of touch (computer haptics) can do to help. We are working on a simple and intuitive application that enables a student to enter a mathematical equation and to see and touch its shape in 3-D. This combined view/touch approach may lead students in introductory calculus classes to a better understanding of complex mathematical equations; a study testing this hypothesis is planned for the fall. Further applications using this technology could be adapted to teach visually impaired students about calculus and about 3-D shapes in general.","","978-0-7695-3039-0","10.1109/IMSCCS.2007.64","","https://ieeexplore.ieee.org/stamp/stamp.jsp?arnumber=4392619","","Calculus;Visualization;Haptic interfaces;Equations;Shape;Computer graphics;Computer science education;Educational institutions;Computational modeling;Computer simulation","courseware;data visualisation;haptic interfaces;mathematics computing","introductory calculus education;3D visualization;virtual touch;3D computer graphics;introductory calculus class;math software;3D mathematical shape;computer haptics;mathematical equation","","1","","17","","4 Dec 2007","","","IEEE","IEEE Conferences"
"A Longitudinal Comparison of Leader-Follower Relationships between High and Low Performing Self-Managed Work Teams in Virtual Settings","J. Y. Lim; L. Chidambaram","Div. of Manage. Inf. Syst., Univ. of Oklahoma, Oklahoma City, OK, USA; Div. of Manage. Inf. Syst., Univ. of Oklahoma, Oklahoma City, OK, USA","2011 44th Hawaii International Conference on System Sciences","22 Feb 2011","2011","","","1","10","We conducted a semester-long study that examined the influence of emergent leaders' behaviors on followers' behaviors in high- and low-performing teams over time. Our results indicated that in high-performing teams, followers engaged in greater adaptive, goal and stability behaviors solely as a function of time. Neither the virtualness nor the behaviors of leaders influenced the behaviors of followers in high performing teams. In contrast, in low-performing teams, leaders played an important role in facilitating followers to engage in more leadership behaviors. Generally, over time, in response to the increasing virtualness and behaviors of the leaders, followers responded by engaging in similar behaviors. Following the leader's behavior, however, was dysfunctional for team performance. Our findings suggest that mimicking the task behaviors of emergent leaders who are virtual is not necessarily a formula for successful team performance, especially in self-managed work teams Instead, as shown by the high-performing teams, behaviors that are self-initiated and autonomous-regardless of the leaders' behaviors or virtualness-are what lead to success.","1530-1605","978-1-4244-9618-1","10.1109/HICSS.2011.15","","https://ieeexplore.ieee.org/stamp/stamp.jsp?arnumber=5718457","","Lead;Context;Media;Humans;Organizations;Virtual groups","behavioural sciences computing;groupware;team working;virtual reality","leader-follower relationship;virtual setting;leader behavior;follower behavior;stability behavior;team performance;task behavior;selfmanaged work team","","1","","56","","22 Feb 2011","","","IEEE","IEEE Conferences"
"Develop a reading tracking function on e-book reading system by using sensing and cloudized storage technologies","C. Lai; L. Pan; C. Hsu; Y. Su; Y. Jeng; C. Liu; Y. Huang","Department of Engineering Science, National Cheng Kung University, Tainan, Taiwan; Department of Engineering Science, National Cheng Kung University, Tainan, Taiwan; Department of Engineering Science, National Cheng Kung University, Tainan, Taiwan; Department of Engineering Science, National Cheng Kung University, Tainan, Taiwan; Cloud System Software Institute, Institute for Information Industry, Taipei, Taiwan; Graduate Institute of Science Education and Environmental Education, National Kaohsiung Normal University, Kaohsiung, Taiwan; Department of Engineering Science, National Cheng Kung University, Tainan, Taiwan","2013 Seventh International Conference on Sensing Technology (ICST)","30 Jan 2014","2013","","","356","360","Reading is an important task to enrich students' knowledge and to enhance students' ability and skills of learning and thinking. Moreover, reading is the well-known brain exercise which helps the brain to improve concentration, promotes empathy, and helps the brain to effectively construct links between neurons. If a person can often keep reading habits, reading is the best exercise to prevent loss of cognitive function in old age. With the advanced development of the Internet and the popularity of electron carriers, electronic books (e-books) have been as computer-aided tools to help students learn in the classroom teaching activities. Sensing and clouding storage technologies are used as tools to assist teachers in teaching students to understand the learning status and learning achievement. In general, reading mainly is divided into two phases, learning to read, and reading to learn. In order to understand the learning status of students, teachers observe the learning behavior of students and analyze their learning ability and skills to adjust the teaching strategies and teaching progresses for adaptive learning in classrooms. In order to help teachers effectively observe students' learning, this study proposed a cloudized e-book reading rate tracking system (CERRTS) with an e-book learning environment and the proposed system includes the sensing technology of touch screen and the cloudized technology of storage. In order to verify the function of the proposed system, the study used a camera to record the learning status of students and to compare the reading rate of the system records and the reading rate of the camera recording. The results show that there is not significantly different between the system and the video. Moreover, the proposed system provided a friendly computer-assisted tool that helps instructors understand the learning status of students.","2156-8073","978-1-4673-5222-2","10.1109/ICSensT.2013.6727674","","https://ieeexplore.ieee.org/stamp/stamp.jsp?arnumber=6727674","Readning process;Reading rate;E-books;Sensor technology","Electronic publishing;Educational institutions;Sensors;Psychology;Cameras;Fingers","cloud computing;computer aided instruction;electronic publishing;image sensors;object tracking;teaching","reading tracking function;e-book reading system;sensing technologies;cloudized storage technologies;student knowledge;student ability;brain exercise;neurons;reading habits;cognitive function;electron carriers;electronic books;computer-aided tools;classroom teaching activities;learning behavior;cloudized e-book reading rate tracking system;CERRTS;reading rate;camera recording;video;computer-assisted tool;touch screen","","1","","19","","30 Jan 2014","","","IEEE","IEEE Conferences"
"A human factors analysis of proactive support in human-robot teaming","Yu Zhang; V. Narayanan; T. Chakraborti; S. Kambhampati","Department of Computer Science and Engineering, Arizona State University, Tempe, 85281, USA; Department of Computer Science and Engineering, Arizona State University, Tempe, 85281, USA; Department of Computer Science and Engineering, Arizona State University, Tempe, 85281, USA; Department of Computer Science and Engineering, Arizona State University, Tempe, 85281, USA","2015 IEEE/RSJ International Conference on Intelligent Robots and Systems (IROS)","17 Dec 2015","2015","","","3586","3593","It has long been assumed that for effective human-robot teaming, it is desirable for assistive robots to infer the goals and intents of the humans, and take proactive actions to help them achieve their goals. However, there has not been any systematic evaluation of the accuracy of this claim. On the face of it, there are several ways a proactive robot assistant can in fact reduce the effectiveness of teaming. For example, it can increase the cognitive load of the human teammate by performing actions that are unanticipated by the human. In such cases, even though the teaming performance could be improved, it is unclear whether humans are willing to adapt to robot actions or are able to adapt in a timely manner. Furthermore, misinterpretations and delays in goal and intent recognition due to partial observations and limited communication can also reduce the performance. In this paper, our aim is to perform an analysis of human factors on the effectiveness of such proactive support in human-robot teaming. We perform our evaluation in a simulated Urban Search and Rescue (USAR) task, in which the efficacy of teaming is not only dependent on individual performance but also on teammates' interactions with each other. In this task, the human teammate is remotely controlling a robot while working with an intelligent robot teammate `Mary'. Our main result shows that the subjects generally preferred Mary with the ability to provide proactive support (compared to Mary without this ability). Our results also show that human cognitive load was increased with a proactive assistant (albeit not significantly) even though the subjects appeared to interact with it less.","","978-1-4799-9994-1","10.1109/IROS.2015.7353878","","https://ieeexplore.ieee.org/stamp/stamp.jsp?arnumber=7353878","","Intelligent robots;Planning;Human factors;Cameras;Robot vision systems;Systematics","emergency management;human-robot interaction;rescue robots","intelligent robot teammate Mary;human cognitive load;USAR task;simulated urban search and rescue;intent recognition;robot actions;human teammate;proactive robot assistant;assistive robots;human-robot teaming;proactive support;human factors analysis","","9","","25","","17 Dec 2015","","","IEEE","IEEE Conferences"
"The Reclose Scheme Matrix - A building block approach to more flexible reclose schemes","K. Smith","ABB Inc., USA","2014 67th Annual Conference for Protective Relay Engineers","24 Apr 2014","2014","","","607","617","This tutorial based paper provides a unique perspective for adapting today's distribution reclose schemes to modern IED (Intelligent Electronic Device) relays which continue to offer more innovative and flexible solutions. Due to the increased overhead of the IED's configuration requirements that generally accompany these solutions, it is important to structure the settings and logic in such a way that custom solutions can easily be developed. The “Reclose Scheme Matrix” provides this structure. The matrix, a binary representation of the reclose system, is composed of building blocks that are used to design the reclose program. The rows of the matrix are defined by initiate and block signals, and the columns, by the shot pointer. By using building blocks, instead of fixed shots, a greater degree of flexibility can be achieved, allowing for multiple and adaptive sequences. For single pole reclosing, the initiate lines of the matrix can be represented on a per phase basis. The tutorial begins with a basic review of the fundamentals including why reclosing is needed, terms and definitions, and an example of how a typical fuse saving scheme is used to create the matrix. A discussion will then follow on specialized applications utilizing open interval time selectivity and drive to lockout features to fully demonstrate the flexibility and functionality of the reclose scheme matrix. The tutorial concludes with a section on testing and commissioning that emphasizes the benefits of an automatic reclose sequence visualization tool. The tool allows the user to view the settings from the reclose scheme matrix in table format and run test simulations by selecting various initiate input signals.","","978-1-4799-4739-3","10.1109/CPRE.2014.6799032","","https://ieeexplore.ieee.org/stamp/stamp.jsp?arnumber=6799032","Adaptive reclosing;building blocks;discrimination time;fast trip;fuse saving scheme;reclose scheme matrix;reclose sequence;reclaim time;shot jump;shot pointer","Testing;Heating;Clocks","distribution networks;education;electric fuses;power engineering computing;power system faults;power system relaying;relay protection","reclose scheme matrix;building block approach;flexible reclose schemes;tutorial based paper;distribution reclose schemes;intelligent electronic device;IED relays;binary representation;reclose program;initiate signals;block signals;shot pointer;single pole reclosing;fuse saving scheme;open interval time selectivity;lockout features;automatic reclose sequence visualization tool","","","","12","","24 Apr 2014","","","IEEE","IEEE Conferences"
"Speeding up SOR solvers for constraint-based GUIs with a warm-start strategy","N. Jamil; J. Muller; C. Lutteroth; G. Weber","Department of Computer Science University of Auckland Private Bag 92019, Auckland, New Zealand; Department of Computer Science University of Auckland Private Bag 92019, Auckland, New Zealand; Department of Computer Science University of Auckland Private Bag 92019, Auckland, New Zealand; Department of Computer Science University of Auckland Private Bag 92019, Auckland, New Zealand","Eighth International Conference on Digital Information Management (ICDIM 2013)","2 Jan 2014","2013","","","268","273","Many computer programs have graphical user interfaces (GUIs), which need good layout to make efficient use of the available screen real estate. Most GUIs do not have a fixed layout, but are resizable and able to adapt themselves. Constraints are a powerful tool for specifying adaptable GUI layouts: they are used to specify a layout in a general form, and a constraint solver is used to find a satisfying concrete layout, e.g. for a specific GUI size. The constraint solver has to calculate a new layout every time a GUI is resized or changed, so it needs to be efficient to ensure a good user experience. One approach for constraint solvers is based on the Gauss-Seidel algorithm and successive over-relaxation (SOR). Our observation is that a solution after resizing or changing is similar in structure to a previous solution. Thus, our hypothesis is that we can increase the computational performance of an SOR-based constraint solver if we reuse the solution of a previous layout to warm-start the solving of a new layout. In this paper we report on experiments to test this hypothesis experimentally for three common use cases: big-step resizing, small-step resizing and constraint change. In our experiments, we measured the solving time for randomly generated GUI layout specifications of various sizes. For all three cases we found that the performance is improved if an existing solution is used as a starting solution for a new layout.","","978-1-4799-0615-4","10.1109/ICDIM.2013.6693970","","https://ieeexplore.ieee.org/stamp/stamp.jsp?arnumber=6693970","UI layout;warm start;successive over-relaxation","Graphical user interfaces;Layout;Iterative methods;Runtime;Numerical models;Equations;Linear matrix inequalities","Gaussian processes;graphical user interfaces;human computer interaction","SOR solvers;constraint-based GUI;warm-start strategy;computer programs;graphical user interfaces;constraint solver;user experience;Gauss-Seidel algorithm;successive over-relaxation;big-step resizing;small-step resizing;constraint change;GUI layout specifications","","1","","24","","2 Jan 2014","","","IEEE","IEEE Conferences"
"Maintaining awareness of the focus of attention of a conversation: A robot-centric reinforcement learning approach","M. Vázquez; A. Steinfeld; S. E. Hudson","Robotics Institute, Carnegie Mellon University, Pittsburgh, PA, United States of America; Robotics Institute, Carnegie Mellon University, Pittsburgh, PA, United States of America; Human-Computer Interaction Institute, Carnegie Mellon University, Pittsburgh, PA, United States of America","2016 25th IEEE International Symposium on Robot and Human Interactive Communication (RO-MAN)","17 Nov 2016","2016","","","36","43","We explore online reinforcement learning techniques to find good policies to control the orientation of a mobile robot during social group conversations. In this scenario, we assume that the correct behavior for the robot should convey attentiveness to the focus of attention of the conversation. Thus, the robot should turn towards the speaker. Our results from tests in a simulated environment show that a new state representation that we designed for this problem can be used to find good policies for the robot. These policies can generalize across interactions with different numbers of people and can handle various levels of sensing noise.","1944-9437","978-1-5090-3929-6","10.1109/ROMAN.2016.7745088","","https://ieeexplore.ieee.org/stamp/stamp.jsp?arnumber=7745088","","Robot sensing systems;Adaptation models;Learning (artificial intelligence);Motion control;Angular velocity","control engineering computing;human-robot interaction;learning (artificial intelligence);mobile robots;position control","robot-centric reinforcement learning;online reinforcement learning;orientation control;mobile robot;social group conversations;robot behavior;robot attentiveness;attention focus;noise sensing","","3","","24","","17 Nov 2016","","","IEEE","IEEE Conferences"
