"[Title page]","",,"2016 International Conference on Information Technology Systems and Innovation (ICITSI)","20 Feb 2017","2016","","","1","1","The following topics are dealt with: SDLC SPASI v. 4.0. business process; information extraction; statistics indicator tables; rule generalizations; ontology; conventional learning system; ICT-based learning; job training system; time-series data; RAID; software-based accelerator; virtualization environment; enterprise architecture government organization; TOGAF ADM; SONA; e- library; modified quantitative models for performance measurement system method; business process improvement; district government innovation service case study; government organization; m-government implementation evaluation; trusted Big Data; official statistics study case; data profiling; data quality improvement; secure internet access; copyright protection; color images; transform domain; luminance component; information network architecture; local government; software as a service; expert system; meningitis disease; certainty factor method; digital asset management system; broadcasting organizations; e-portofolio definition; system security requirement identification; electronic payment system; Internet-based long distance education; operational model data governance; requirement engineering; open government information network development; process capability assessment; information security management; information security governance; national cyber physical systems; e-learning readiness; remote control system; serial communications mobile; microcontroller; knowledge sharing; indonesia higher educational institutions; cultural heritage metadata; geo linked open data; NUSANTARA: knowledge management system; adaptive personalized learning system; interactive learning media; RPP ICT; government human capital management; knowledge management tools utilization; knowledge management readiness; analytic hierarchy process; government institutions; usability testing; scrum methodology; assistant information system; automatic arowana raiser; pSPEA2; strength Pareto evolutionary algorithm 2; early diagnosis expert system deficiency; digital forensic; user acceptance; human resource information system; automated plasmodium detection; malaria diagnosis; thin blood smear image; 3D virtual game; MOODLE; SLOODLE; open simulator case study; color-based segmentation; feature detection; ball post; goal post; mobile soccer robot game field; smart farming; real time q-log-based feature normalization; distant speech recognition; Monte Carlo localization; robot operating system; finite element method; 3D DC resistivity modeling; multi GPU; breast cancer lesions; adaptive thresholding; morphological operation; gamification framework; online training; collaborative working system; classification breast cancer ultrasound images; posterior features; three-wheeled omnidirectional robot controller; public services satisfaction; sentiment analysis; color blind test quantification; RGB primary color cluster; ERP modules requirement; micro, small and medium enterprise fashion industry; small culinary enterprises; business system requirement; small craft companies ; power analysis attack; DES and IT value model.","","978-1-5090-2449-0","10.1109/ICITSI.2016.7858181","","https://ieeexplore.ieee.org/stamp/stamp.jsp?arnumber=7858181","","","analytic hierarchy process;asset management;Big Data;biomedical ultrasonics;broadcasting;business data processing;cancer;cloud computing;computer aided instruction;copy protection;cyber-physical systems;digital forensics;diseases;distance learning;educational institutions;electronic money;enterprise resource planning;evolutionary computation;expert systems;feature extraction;finite element analysis;formal specification;further education;government data processing;groupware;history;human resource management;image classification;image colour analysis;image segmentation;information retrieval;knowledge management;meta data;mobile computing;mobile robots;Monte Carlo methods;ontologies (artificial intelligence);power system security;public administration;sentiment analysis;small-to-medium enterprises;speech recognition;sport;time series;transforms;trusted computing","SDLC SPASI v. 4.0. business process;information extraction;statistics indicator tables;rule generalizations;ontology;conventional learning system;ICT-based learning;job training system;time-series data;RAID;software-based accelerator;virtualization environment;enterprise architecture government organization;TOGAF ADM;SONA;e-library;QMPMS method;modified quantitative models for performance measurement system method;;business process improvement;district government innovation service case study;government organization;m-government implementation evaluation;trusted Big Data;official statistics study case;data profiling;data quality improvement;secure internet access;copyright protection;color images;transform domain;luminance component;information network architecture;local government;software as a service;expert system;meningitis disease;certainty factor method;digital asset management system;broadcasting organizations;e-portofolio definition;system security requirement identification;electronic payment system;Internet-based long distance education;operational model data governance;requirement engineering;open government information network development;process capability assessment;information security management;information security governance;national cyber physical systems;e-learning readiness;remote control system;serial communications mobile;microcontroller;knowledge sharing;indonesia higher educational institutions;cultural heritage metadata;geo linked open data;NUSANTARA;knowledge management system;adaptive personalized learning system;interactive learning media;RPP ICT;government human capital management;knowledge management tools utilization;knowledge management readiness;analytic hierarchy process;government institutions;usability testing;scrum methodology;assistant information system;automatic arowana raiser;pSPEA2;strength Pareto evolutionary algorithm 2;early diagnosis expert system deficiency;digital forensic;user acceptance;human resource information system;automated plasmodium detection;malaria diagnosis;thin blood smear image;3D virtual game;MOODLE;SLOODLE;open simulator case study;color-based segmentation;feature detection;mobile soccer robot game field;smart farming;real time q-log-based feature normalization;distant speech recognition;Monte Carlo localization;robot operating system;finite element method;3D DC resistivity modeling;multi GPU;breast cancer lesions;adaptive thresholding;morphological operation;collaborative working system;classification breast cancer ultrasound images;posterior features;three-wheeled omnidirectional robot controller;public services satisfaction;sentiment analysis;color blind test quantification;RGB primary color cluster;ERP modules requirement;small and medium enterprise fashion industry;small culinary enterprises;business system requirement;small craft companies;power analysis attack;DES;IT value model","","","","","","20 Feb 2017","","","IEEE","IEEE Conferences"
"[Front cover]","",,"2011 IEEE International Conference on Control System, Computing and Engineering","26 Apr 2012","2011","","","c1","c1","The following topics are dealt with: output membership function; fuzzy logic controller; self adaptive neuro-fuzzy control; FES-assisted paraplegics indoor rowing exercise; indoor empirical path loss prediction model; 2.4 GHz 802.11N network; moving vehicle detection; RGB removal shadow segmentation; modeling virtual driving environment; regressive linear prediction; speech signals; wheel acceleration/deceleration; integrated stability control systems; nonlinear PID control; multiple input-single output model; MPPT; electronically tunable voltage-mode MIMO universal filter; high input impedance voltage-mode universal filter; OTA; parallel distributed fuzzy LQR controller; double-pendulum-type overhead cranes; ANFIS based modeling; overtaking maneuver trajectory; ASTER satellite data; spline interpolation technique; sea bed logging method; evolutionary normal-boundary intersection method; heterogeneous wireless sensor network; high precision laser tracker system; contactless position measurement; semantic Web ontologies; social network sites; Malay text-to-speech system; allophone synthesis; dynamic programming approach; pipelined optical bus systems; mainstream software sharing platform; oil & gas exploration and development; remotely operated vehicle control system; surrogate modeling; model based sensor fault tolerant control system; micromachined thermal conductivity sensor; dual stack IPv4/IPv6 testbed; malware detection; digital evidence container; security convergence; global stability; continuous time delayed linear system; LMI based approach; robust adaptive controller; observer design; discrimination electrical power; multistage centrifugal compressors; remote controlled HD videoconference system; knowledge management; wave generator system; STATCOM; blood cell image segmentation; wireless controller area ;ARM microcontroller; ECG signals based mental stress assessment; wavelet transform; genetic-optimized neuro-fuzzy inference system; meshless local Petrov-Galerkin method; power plant automation; SCADA systems:; energy potential detection; autarkic smart object design; liquid level control; focal epileptic seizure forecasting; artificial neural networks; patch antennas arrayanti-swing control; double-pendulum-type overhead crane; distributed fuzzy LQR controller; genetic fuzzy rule set selection;force control; SMA actuated gripper; self tuning fuzzy PID controller; multivariable system; recurrent diagonal neural network; customized mobile learning management system; multi-flow rate mode selection; pneumatic dispensing valve system; clonal selection based artificial immune system algorithm; adaptive nonlinear PID controller; nonholonomic mobile robot; data compression technique; global solar radiation;1.8GHz electromagnetic field exposure; electro-hydraulic actuator; Methyl Tert-butyl Ether production; reactive distillation; robust control design; spacecraft attitude systems; level drum process control training system; time-delayed feedback control; chaotic T-S fuzzy systems; photovoltaic panels Perturbation; MPPT Method; island-mode doubly-fed induction generator; reactive power control; active power control; contactless optical sensor system; automatic column-based data object clustering; multilingual databases; mycobacterium tuberculosis detection; intelligent software agents; auditory wavelet packet filters; multiple intersections traffic signal timing optimization; overlapping vehicle tracking; adaptive particle filter; endoscopic image compression; double density discrete wavelet transform; Malaysian English accents identification; AR modeling techniques; online news management; double weight codes amplitude coding optical CDMA system network; output feedback sliding mode control; chaotic trajectory tracking; electro-hydraulic actuator system; discrete sliding mode control; retentive backtracking bit ; anti-collision algorithm; RFID systems; humanoid robot NAO; face detection technique; robotic assistive therapy; fractional order PI controller; modular general purpose controller board; biologically inspired robot; bundle branch blocks; multilayered perceptron network; helical antenna prototype; wireless power transmission; optimal control; nonlinear inverted pendulum dynamical system; 1.8 GHz radio frequency signal radiation effects; WiFi electromagnetic radiation; MRI brain classification; principal component analysis; electromagnetic generator; speed sensorless field oriented control; parallel- connected dual PMSM; solar radiation data analysis; Daubechies wavelets; dual-power PV-grid energy system; thermal energy storage system; single ortho-rectified high resolution satellite imagery; TopoMap revision; free swinging shank; hemiplegics; scanning resolution and laser scanner.","","978-1-4577-1642-3","10.1109/ICCSCE.2011.6190480","","https://ieeexplore.ieee.org/stamp/stamp.jsp?arnumber=6190480","","","adaptive control;artificial immune systems;asynchronous generators;attitude control;augmented reality;biomedical MRI;code division multiple access;compressors;computer aided instruction;continuous time systems;cranes;data analysis;data compression;delays;discrete wavelet transforms;distributed control;dynamic programming;electrocardiography;electrohydraulic control equipment;face recognition;fault tolerance;force control;fuzzy control;helical antennas;humanoid robots;image coding;image segmentation;interpolation;invasive software;knowledge management;level control;linear matrix inequalities;linear systems;maximum power point trackers;medical image processing;MIMO systems;mobile computing;mobile robots;multilayer perceptrons;multivariable systems;natural language processing;nonlinear control systems;observers;ontologies (artificial intelligence);optical scanners;optical sensors;optical tracking;optimal control;particle filtering (numerical methods);pendulums;permanent magnet motors;photovoltaic power systems;PI control;power plants;principal component analysis;radiofrequency identification;reactive power control;recurrent neural nets;robust control;SCADA systems;semantic Web;social networking (online);software agents;space vehicles;speech synthesis;splines (mathematics);stability;static VAr compensators;thermal energy storage;three-term control;traffic engineering computing;velocity control;wireless LAN;wireless sensor networks","output membership function;fuzzy logic controller;self adaptive neuro-fuzzy control;FES-assisted paraplegics indoor rowing exercise;indoor empirical path loss prediction model;2.4 GHz 802.11N network;moving vehicle detection;RGB removal shadow segmentation;modeling virtual driving environment;regressive linear prediction;speech signals;wheel acceleration/deceleration;integrated stability control systems;nonlinear PID control;multiple input-single output model;MPPT;electronically tunable voltage-mode MIMO universal filter;high input impedance voltage-mode universal filter;OTA;parallel distributed fuzzy LQR controller;double-pendulum-type overhead cranes;ANFIS based modeling;ASTER satellite data;spline interpolation technique;sea bed logging method;evolutionary normal-boundary intersection method;heterogeneous wireless sensor network;high precision laser tracker;contactless position measurement;semantic Web ontologies;social network sites;Malay text-to-speech system;allophone synthesis;dynamic programming approach;pipelined optical bus systems;mainstream software sharing platform;gas exploration;remotely operated vehicle control system;surrogate modeling;model based sensor fault tolerant control system;micromachined thermal conductivity sensor;dual stack IPv4/IPv6 testbed;malware detection;digital evidence container;security convergence;global stability;continuous time delayed linear system;LMI based approach;robust adaptive controller;observer design;discrimination electrical power;multistage centrifugal compressors;knowledge management;wave generator system;STATCOM;blood cell image segmentation;wireless controller area;ARM microcontroller;ECG signals based mental stress assessment;genetic-optimized neuro-fuzzy inference system;meshless local Petrov-Galerkin method;power plant automation;SCADA systems;energy potential detection;autarkic smart object design;liquid level control;focal epileptic seizure forecasting;artificial neural networks;patch antennas arrayanti-swing control;double-pendulum-type overhead crane;distributed fuzzy LQR controller;genetic fuzzy rule set selection;SMA actuated gripper;force control;self tuning fuzzy PID controller;multivariable system;recurrent diagonal neural network;customized mobile learning management system;multiflow rate mode selection;pneumatic dispensing valve system;clonal selection based artificial immune system algorithm;adaptive nonlinear PID controller;nonholonomic mobile robot;data compression technique;global solar radiation;1.8GHz electromagnetic field exposure;electro-hydraulic actuator;Methyl Tert-butyl Ether production;reactive distillation;robust control design;spacecraft attitude systems;level drum process control training system;time-delayed feedback control;chaotic T-S fuzzy systems;photovoltaic panels perturbation;MPPT Method;island-mode doubly-fed induction generator;reactive power control;active power control;contactless optical sensor system;automatic column-based data object clustering;multilingual databases;mycobacterium tuberculosis detection;intelligent software agents;auditory wavelet packet filters;multiple intersections traffic signal timing optimization;overlapping vehicle tracking;adaptive particle filter;endoscopic image compression;double density discrete wavelet transform;Malaysian English accents identification;AR modeling techniques;online news management;double weight codes amplitude coding;optical CDMA system network;output feedback sliding mode control;chaotic trajectory tracking;electro-hydraulic actuator system;discrete sliding mode control;RFID systems;humanoid robot NAO;face detection technique;robotic assistive therapy;fractional order PI controller;modular general purpose controller;biologically inspired robot;bundle branch blocks;multilayered perceptron network;helical antenna prototype;wireless power transmission;optimal control;nonlinear inverted pendulum dynamical system;1.8 GHz radio frequency signal radiation effects;WiFi electromagnetic radiation;MRI brain classification;principal component analysis;electromagnetic generator;speed sensorless field oriented control;parallel- connected dual PMSM;solar radiation data analysis;Daubechies wavelets;dual-power PV-grid energy system;thermal energy storage system;single ortho-rectified high resolution satellite imagery;TopoMap revision;free swinging shank;hemiplegics;scanning resolution;laser scanner","","","","","","26 Apr 2012","","","IEEE","IEEE Conferences"
"Proceedings. IEEE SOUTHEASTCON '92 (Cat. No.92CH3094-0)","",,"Proceedings IEEE Southeastcon '92","6 Aug 2002","1992","","","I0_1","","Conference proceedings front matter may contain various advertisements, welcome messages, committee or program information, and other miscellaneous conference information. This may in some cases also include the cover art, table of contents, copyright statements, title-page or half title-pages, blank pages, venue maps or other general information relating to the conference that was part of the original conference proceedings.","","0-7803-0494-2","10.1109/SECON.1992.202263","","https://ieeexplore.ieee.org/stamp/stamp.jsp?arnumber=202263","","","antennas;artificial intelligence;computer architecture;computer networks;control theory;education;electromagnetism;encoding;graph theory;image processing;medical image processing;neural nets;power systems;radar systems;radio systems;signal processing;software engineering;VLSI","robust control;biomedical systems;circuit simulation;radar systems;computer networks;image processing;graph algorithms;education;adaptive control;system identification;applied electromagnetics;biomedical signals;VLSl fabrication;circuit modeling;multisensor systems;signal processing;artificial intelligence;biomedical imaging;coding;signal representation;antennas;software engineering;fault testing;power systems;sensors;remote sensing;digital communications;space power;robotics;neural networks;laboratories;digital systems;lasers;optics;circuit design;distributed systems;RF communication systems;time-series analysis;control system applications;bioinstrumentation design;control theory;parallel computer architecture","","","","","","6 Aug 2002","","","IEEE","IEEE Conferences"
"[Title page i - Volume 1]","",,"2012 International Conference on Computer Science and Electronics Engineering","23 Apr 2012","2012","1","","i","i","The following topics are dealt with: environmental cost internalization effect analysis; pricing decision theory; international carbon emission trading; device description technology; proportional-derivative controller; chaotic financial system; rolling bearing fault diagnosis; multichannel MAC protocol; 802.11-based wireless mesh networks; Uyghur broadcast news continues speech sensitive-word spotting system; viscoelastic ray tracing simulation; underground cavity stability; spacecraft attitude control; inertia matrix generalized mixed vector variational-like inequalities; stub tooth involute gears; expression recognition; BP neural network; file access security; CFD numerical simulation; exhaust gas flow pattern; hot galvanizing bath; grading steel ball; wear discrete element method; orbit determination; space-based optical observations; Adaboost blob tracking; parallel switching power supply module system; multisource heterogeneous data integration; DSP-based SVPWM vector control system; asynchronous motor scanned document image segmentation; Voronoi diagram; aircraft object recognition model; adaptive threshold Canny edge detection algorithm; data synchronization; open service-aware mobile network API; OAuth based authentication; Open Telco API; online fresh supermarket logistics delivery information system; image encryption algorithm; fast 1-DDCT algorithm; parallel computing; safety education system; virtual reality technology; water quality; aeronautical component repair business optimization; high-speed BiCMOS fully differential operational amplifier; cloud computing; enterprise information system; software development cost; Java multithread technology; wireless sensor network; NC remote video monitoring; military communication network; e-government affair system; particle swarm optimized wavelet neural network; face recognition; grass stem biomechanics; RFID system; Internet of Things; gyroscope test instrument rotating floor DSP control system; and AC synchronous generators.","","978-0-7695-4647-6","10.1109/ICCSEE.2012.81","","https://ieeexplore.ieee.org/stamp/stamp.jsp?arnumber=6187941","","","access protocols;aircraft maintenance;application program interfaces;asynchronous generators;attitude control;authorisation;backpropagation;biomechanics;cloud computing;computational fluid dynamics;computational geometry;data integration;decision theory;environmental economics;face recognition;fault diagnosis;file organisation;finite element analysis;galvanising;gears;government data processing;image coding;information systems;military communication;neural nets;parallel processing;particle swarm optimisation;pricing;radiofrequency identification;ray tracing;rolling bearings;signal processing;space vehicles;speech recognition;test equipment;three-term control;video surveillance;virtual reality;water quality;wear;wireless mesh networks;wireless sensor networks","environmental cost internalization effect analysis;pricing decision theory;international carbon emission trading;device description technology;proportional-derivative controller;chaotic financial system;rolling bearing fault diagnosis;multichannel MAC protocol;802.11-based wireless mesh networks;Uyghur broadcast news continues speech sensitive-word spotting system;viscoelastic ray tracing simulation;underground cavity stability;spacecraft attitude control;inertia matrix;generalized mixed vector variational-like inequalities;stub tooth involute gears;expression recognition;BP neural network;file access security;CFD numerical simulation;exhaust gas flow pattern;hot galvanizing bath;grading steel ball wear;discrete element method;orbit determination;space-based optical observations;Adaboost blob tracking;parallel switching power supply module system;multisource heterogeneous data integration;DSP-based SVPWM vector control system;asynchronous motor;scanned document image segmentation;Voronoi diagram;aircraft object recognition model;adaptive threshold Canny edge detection algorithm;data synchronization;open service-aware mobile network API;OAuth based authentication;Open Telco API;online fresh supermarket logistics delivery information system;image encryption algorithm;fast 1-DDCT algorithm;parallel computing;safety education system;virtual reality technology;water quality;aeronautical component repair business optimization;high-speed BiCMOS fully differential operational amplifier;cloud computing;enterprise information system;software development cost;Java multithread technology;wireless sensor network;NC remote video monitoring;military communication network;e-government affair system;particle swarm optimized wavelet neural network;face recognition;grass stem biomechanics;RFID system;Internet of Things;gyroscope test instrument rotating floor DSP control system;AC synchronous generators","","","","","","23 Apr 2012","","","IEEE","IEEE Conferences"
