"Impact of Encapsulation Tissue Growth on Selective Recording in Nerve Cuff Electrodes: A Simulation Study","S. Sammut; R. G. L. Koh; J. Zariffa","University Health Network,KITE – Toronto Rehabilitation Institute,Toronto,ON,Canada,M5G 2A2; University Health Network,KITE – Toronto Rehabilitation Institute,Toronto,ON,Canada,M5G 2A2; University Health Network,KITE – Toronto Rehabilitation Institute,Toronto,ON,Canada,M5G 2A2","2020 42nd Annual International Conference of the IEEE Engineering in Medicine & Biology Society (EMBC)","27 Aug 2020","2020","","","3444","3447","Peripheral nerve interfaces (PNIs) allow us to extract motor, sensory and autonomic information from the nervous system and use it as control signals in neuroprosthetic and neuromodulation systems. Recent efforts have aimed to improve the recording selectivity of PNIs, including by using spatiotemporal patterns from multi-contact nerve cuff electrodes as input to a convolutional neural network (CNN). Before such a methodology can be translated to humans, its performance in chronic implantation scenarios must be evaluated. We investigated the performance of a CNN-based selective recording approach in the presence of encapsulation tissue, a common immune response to the implantation of a neural interface. This factor was simulated using anatomically accurate computational models of a rat sciatic nerve and nerve cuff electrode. Performance over time was examined in three conditions: training the CNN at baseline only, supervised retraining with explicitly labeled data at periodic intervals, and a semi-supervised self-learning approach. The periodic recalibration approach demonstrated the best results, with an average F1-score of 0.96 ± 0.04, 0.89 ± 0.08, and 0.80 ± 0.08 for SNRs of -5 dB, -10 dB, and -15 dB, respectively, across all time points. Thus, the periodic recalibration approach may be an effective solution to compensate for changes in signal recordings seen over time as a result of encapsulation tissue. The self-learning approach, in which a network is retrained periodically using predicted labels, generally showed degradation in classification performance over time, even as the frequency of training was increased, attributed to an eventual accumulation of mislabeled training data.","2694-0604","978-1-7281-1990-8","10.1109/EMBC44109.2020.9176736","","https://ieeexplore.ieee.org/stamp/stamp.jsp?arnumber=9176736","","Encapsulation;Electrodes;Training;Calibration;Signal to noise ratio;Finite element analysis;Neural pathways","biological tissues;biomedical electrodes;convolutional neural nets;medical computing;neurophysiology;prosthetics;supervised learning","encapsulation tissue growth;peripheral nerve interfaces;autonomic information;nervous system;control signals;neuroprosthetic systems;recording selectivity;spatiotemporal patterns;multicontact nerve cuff electrodes;convolutional neural network;chronic implantation scenarios;CNN-based selective recording approach;common immune response;neural interface;anatomically accurate computational models;rat sciatic nerve;supervised retraining;explicitly labeled data;periodic intervals;semisupervised self-learning approach;periodic recalibration approach;signal recordings;classification performance;sensory information;motor information;neuromodulation systems;F1-score;mislabeled training data;SNR","Animals;Electrodes;Humans;Neural Networks, Computer;Rats;Sciatic Nerve;Signal-To-Noise Ratio","","","20","","27 Aug 2020","","","IEEE","IEEE Conferences"
"Development of an evaluation function for eye-hand coordination robotic therapy","N. Pernalete; F. Tang; S. M. Chang; F. Y. Cheng; P. Vetter; M. Stegemann; J. Grantner","California State Polytechnic University, Pomona, USA; California State Polytechnic University, Pomona, USA; California State Polytechnic University, Pomona, USA; California State Polytechnic University, Pomona, USA; California State Polytechnic University, Pomona, USA; California State Polytechnic University, Pomona, USA; Western Michigan University, Kalamazoo, USA","2011 IEEE International Conference on Rehabilitation Robotics","11 Aug 2011","2011","","","1","6","This paper is the continuation of a work presented at ICORR 07, in which we discussed the possibility of improving eye-hand coordination in children diagnosed with this problem, using a robotic mapping from a haptic user interface to a virtual environment. Our goal is to develop, implement and refine a system that will assess and improve the eye-hand coordination and grip strength in children diagnosed with poor graphomotor skills. A detailed analysis of patters (e.g., labyrinths, letters and angles) was conducted in order to select three very distinguishable levels of difficulty that could be included in the system, and which would yield the greatest benefit in terms of assessment of coordination and strength issues as well as in training. Support algorithms (position, force, velocity, inertia and viscosity) were also developed and incorporated into the tasks in order to introduce general computer assistance to the mapping of the user's movements to the computer screen without overriding the user's commands to the robotic device. In order to evaluate performance (given by %accuracy and time) of the executed tasks, a sophisticated evaluation function was designed based on image analysis and edge detection algorithms. This paper presents the development of the haptic tasks, the various assistance algorithms, the description of the evaluation function and the results of a study implemented at the Motor Development Clinic at Cal Poly Pomona. The results (Accuracy and Time) of this function are currently being used as inputs to an Intelligent Decision Support System (described in), which in turn, suggests the next task to be executed by the subject based on his/her performance.","1945-7901","978-1-4244-9862-8","10.1109/ICORR.2011.5975423","","https://ieeexplore.ieee.org/stamp/stamp.jsp?arnumber=5975423","","Force;Haptic interfaces;Image edge detection;Accuracy;Robot kinematics;Pixel","biomechanics;decision support systems;edge detection;haptic interfaces;medical computing;medical disorders;medical image processing;medical robotics;neurophysiology;paediatrics;patient rehabilitation","eye-hand coordination robotic therapy;children related diagnosis;robotic mapping;haptic user interface;virtual environment;grip strength;poor graphomotor skills;labyrinths;support algorithms;computer assistance;user movements;image analysis;edge detection algorithm;haptic tasks;Motor Development Clinic;Cal Poly Pomona;intelligent decision support system","Algorithms;Child;Eye;Hand;Humans;Movement;Robotics;Robotics","3","","15","","11 Aug 2011","","","IEEE","IEEE Conferences"
"Design of games for measurement of cognitive impairment","B. Wallace; R. Goubran; F. Knoefel; M. Petriu; A. McAvoy","Systems and Computer Engineering, Carleton University Ottawa, Canada; Systems and Computer Engineering, Carleton University Ottawa, Canada; Systems and Computer Engineering, Carleton University Ottawa, Canada; Systems and Computer Engineering, Carleton University Ottawa, Canada; Systems and Computer Engineering, Carleton University Ottawa, Canada","IEEE-EMBS International Conference on Biomedical and Health Informatics (BHI)","26 Jul 2014","2014","","","117","120","This paper presents the design and validation of two computer games for the monitoring and measurement of cognitive change. Computer games that claim to improve cognitive ability are focused on healthy players while the testing of these games has been limited to healthy adults and has typically not included older adults with Mild Cognitive Impairment (MCI). The two games presented in this paper have specific features to aid and monitor cognitively impaired users including a hint system so that players do not become frustrated with the games. Cognitive performance is measured through a game play log in the Carleton Word Search Game (CWG) and Carleton Sudoku Game (CSG) that has been designed into the games. The paper presents how the measures indicate user performance across the various aspects of game play such as search, logic and general motor skills. The paper presents the results of initial validation tests using cognitive distraction to simulate cognitive impairment.","2168-2208","978-1-4799-2131-7","10.1109/BHI.2014.6864318","","https://ieeexplore.ieee.org/stamp/stamp.jsp?arnumber=6864318","Cognitive measurement;Mild Cognitive Impairment","Games;Mice;Computers;Monitoring;Dementia;Time measurement;Conferences","biomedical measurement;cognition;computer games;medical computing;medical disorders;neurophysiology;patient monitoring","game design;cognitive impairment measurement;computer games;cognitive change monitoring;cognitive change measurement;cognitive ability;healthy players;healthy adults;Mild Cognitive Impairment;MCI;cognitively impaired users;hint system;cognitive performance;game play log;Carleton Word Search Game;CWG;Carleton Sudoku Game;CSG;user performance;search skills;logic skills;general motor skills;cognitive distraction","","8","","15","","26 Jul 2014","","","IEEE","IEEE Conferences"
"Ascertaining the importance of neurons to develop better brain-machine interfaces","J. C. Sanchez; J. M. Carmena; M. A. Lebedev; M. A. L. Nicolelis; J. G. Harris; J. C. Principe","Dept. of Biomed. Eng., Florida Univ., Gainesville, FL, USA; NA; NA; NA; NA; NA","IEEE Transactions on Biomedical Engineering","24 May 2004","2004","51","6","943","953","In the design of brain-machine interface (BMI) algorithms, the activity of hundreds of chronically recorded neurons is used to reconstruct a variety of kinematic variables. A significant problem introduced with the use of neural ensemble inputs for model building is the explosion in the number of free parameters. Large models not only affect model generalization but also put a computational burden on computing an optimal solution especially when the goal is to implement the BMI in low-power, portable hardware. In this paper, three methods are presented to quantitatively rate the importance of neurons in neural to motor mapping, using single neuron correlation analysis, sensitivity analysis through a vector linear model, and a model-independent cellular directional tuning analysis for comparisons purpose. Although, the rankings are not identical, up to sixty percent of the top 10 ranking cells were in common. This set can then be used to determine a reduced-order model whose performance is similar to that of the ensemble. It is further shown that by pruning the initial ensemble neural input with the ranked importance of cells, a reduced sets of cells (between 40 and 80, depending upon the methods) can be found that exceed the BMI performance levels of the full ensemble.","1558-2531","","10.1109/TBME.2004.827061","","https://ieeexplore.ieee.org/stamp/stamp.jsp?arnumber=1300786","","Neurons;Portable computers;Algorithm design and analysis;Kinematics;Buildings;Explosions;Hardware;Sensitivity analysis;Vectors;Reduced order systems","neurophysiology;bioelectric potentials;medical computing;biomechanics;correlation methods;sensitivity analysis;cellular biophysics;handicapped aids","neurons;brain-machine interfaces algorithms;chronically recorded neuron activity;kinematic variables reconstruction;neural-motor mapping;single neuron correlation analysis;sensitivity analysis;vector linear model;model-independent cellular directional tuning analysis;reduced-order model","Action Potentials;Algorithms;Animals;Cerebral Cortex;Computer Simulation;Electroencephalography;Female;Hand;Likelihood Functions;Macaca;Models, Neurological;Models, Statistical;Movement;Nerve Net;Neurons;Reproducibility of Results;Sensitivity and Specificity;Signal Processing, Computer-Assisted;User-Computer Interface","76","2","29","","24 May 2004","","","IEEE","IEEE Journals"
"Layered modular action control for communicative humanoids","K. R. Thorisson","Media Lab., MIT, Cambridge, MA, USA","Proceedings. Computer Animation '97 (Cat. No.97TB100120)","6 Aug 2002","1997","","","134","143","Face-to-face interaction between people is generally effortless and effective. We exchange glances, take turns speaking and make facial and manual gestures to achieve the goals of the dialogue. This paper describes an action composition and selection architecture for synthetic characters capable of full-duplex, real-time face-to-face interaction with a human. This architecture is part of a computational model of psychosocial dialogue skills, called Y_m_i_r_, that bridges between multimodal perception and multimodal action generation. To test the architecture, a prototype humanoid has been implemented, named G_a_n_d_a_ l_f_, who commands a graphical model of the solar system and can engage in task-directed dialogue with people using speech, manual and facial gesture. Gandalf has been tested in interaction with users and has been shown capable of fluid turn-taking and multimodal dialogue. The primary focus in this paper will be on the action selection mechanisms and low-level composition of motor commands. An overview is also given of the Ymir model and Gandalf's graphical representation.","1087-4844","0-8186-7984-0","10.1109/CA.1997.601055","","https://ieeexplore.ieee.org/stamp/stamp.jsp?arnumber=601055","","Computer architecture;Face;Humans;Computational modeling;Psychology;Bridges;Solar power generation;System testing;Prototypes;Graphical models","virtual reality;computer animation;software agents;natural language interfaces","layered modular action control;communicative humanoids;action composition;action selection architecture;synthetic characters;full-duplex real-time face-to-face interaction;psychosocial dialogue skills;multimodal perception;multimodal action generation;task-directed dialogue;Gandalf;fluid turn-taking;multimodal dialogue;action selection mechanisms;low-level composition;Ymir model;animation;autonomous agents;real-time dialogue;artificial intelligence","","9","4","50","","6 Aug 2002","","","IEEE","IEEE Conferences"
"A decision-theoretic approach to consistent tight glycemic control in critical care patients","U. Pielmeier; S. A. Boudreau; S. Andreassen","Center for Model-based Medical Decision Support, Aalborg University, 9220 Aalborg, Denmark; Center for Sensory-Motor Interaction, Aalborg University, 9220 Aalborg, Denmark; Center for Model-based Medical Decision Support, Aalborg University, 9220 Aalborg, Denmark","UKACC International Conference on Control 2010","4 Apr 2013","2010","","","1","6","Insulin alone may be insufficient to regulate blood glucose concentrations in critical illness. Previously we have presented 'Glucosafe', a decision support system that recommends insulin infusion rates and rates of enteral and intravenous feeding, based on penalty functions. This study presents a general method by which the scaling of these penalty functions can be optimized. The method is based on an analysis of scaling factors under simulation of steady-state conditions in different insulin resistance states, and analysis of the obtained optimized values under simulations of hyper- and hypoglycemia. Optimization resulted in recommendations that kept blood glucose concentrations close to normal, the total amount of nutrition and the amount of ingested calories close to 100% of daily requirements, and insulin doses at levels that not unduly put the patient at risk of hypoglycemia.","","978-1-84600-038-6","10.1049/ic.2010.0390","","https://ieeexplore.ieee.org/stamp/stamp.jsp?arnumber=6490848","medical decision support;tight glycemic control;physiological modeling;penalty functions","","decision support systems;medical computing;optimisation;sugar","decision-theoretic approach;tight glycemic control;critical care patients;blood glucose concentrations;critical illness;decision support system;glucosafe;insulin infusion rates;intravenous feeding;steady-state conditions;hypoglycemia;hyperglycemia;optimization;insulin doses","","","","","","4 Apr 2013","","","IET","IET Conferences"
"The Embedding Transform. A Novel Analysis of Non-Stationarity in the EEG","C. A. Loza; J. C. Principe","Department of Mathematics, Universidad San Francisco de Quito, Quito, Ecuador; Computational NeuroEngineering Laboratory (CNEL), University of Florida, Gainesville, FL","2018 40th Annual International Conference of the IEEE Engineering in Medicine and Biology Society (EMBC)","28 Oct 2018","2018","","","3112","3115","We introduce a novel technique to analyze nonstationarity in single-channel Electroencephalogram (EEG) traces: the Embedding Transform. The approach is based on Walter J. Freeman's studies concerning active and rest stages and deviations from Gaussianity. Specifically, we generalize his idea in order to include cases where the neuromodulations are sparse in time. Specifically, the transform maps the temporal sequences to a set of 12-norms where modulated patters are emphasized. In this way, the background, chaotic activity can be modeled as the main lobe of the distribution, while the relevant synchronizations (or desynchronizations) fall on the right (or left) tail of the density of such norms. We test the algorithm on two different datasets: alpha bursts on synthetic data simulated in the BESA software and low-gamma oscillations in the motor cortex from the Brain-Computer Interface (BCI) Competition 4 Dataset 4. The results are promising and place the Embedding Transform as a quick, single-parameter tool to effectively assess which channels (or regions) are actively engaged in particular behaviors and which are in a more silent type of stage.","1558-4615","978-1-5386-3646-6","10.1109/EMBC.2018.8512974","","https://ieeexplore.ieee.org/stamp/stamp.jsp?arnumber=8512974","EEG;embedding;gaussianity;non-Stationarity","Transforms;Electroencephalography;Neuromodulation;Brain modeling;Probability density function;Electric potential;Tools","brain-computer interfaces;electroencephalography;medical signal processing;neurophysiology","chaotic activity;single-parameter tool;single-channel electroencephalogram;brain-computer interface;embedding transform","Algorithms;Brain;Brain-Computer Interfaces;Electroencephalography;Rest","2","","21","","28 Oct 2018","","","IEEE","IEEE Conferences"
"Toward Validating a Simplified Muscle Activation Model in SMARTMOBILE","E. Auer; M. Tandl; D. Strobach; A. Kecskemethy","Univ. of Duisburg, Essen; NA; NA; NA","12th GAMM - IMACS International Symposium on Scientific Computing, Computer Arithmetic and Validated Numerics (SCAN 2006)","12 Dec 2007","2006","","","7","7","In this paper, we apply the validated modeling and simulation environment SMARTMOBILE along with two solvers recently added to its core to the problem of the identification of muscle activation in general motor tasks. The identification of muscle activation is one of the important and still open problems in biomechanics which aims at helping physicians assess an individual therapy for a patient. We address the discrepancy of the results supplied by the proposed simplified muscle activation model to the gait lab data and make an initial analysis of model's parameter sensitivity using validated techniques.","","978-0-7695-2821-2","10.1109/SCAN.2006.44","","https://ieeexplore.ieee.org/stamp/stamp.jsp?arnumber=4402397","","Muscles;Object oriented modeling;Medical treatment;Biomechanics;Kinematics;Mechanical systems;Prototypes;Analytical models;Measurement uncertainty;Employment","biomechanics;digital simulation;medical computing;mobile computing;muscle;patient rehabilitation;patient treatment","muscle activation model;SMARTMOBILE;general motor tasks;biomechanics;physicians assess;patient therapy","","","","17","","12 Dec 2007","","","IEEE","IEEE Conferences"
"Home stroke telerehabilitation system to train recovery of hand function","W. K. Durfee; S. A. Weinstein; J. R. Carey; E. Bhatt; A. Nagpal","Dept. of Mech. Eng., Minnesota Univ., Minneapolis, MN, USA; Dept. of Mech. Eng., Minnesota Univ., Minneapolis, MN, USA; NA; NA; NA","9th International Conference on Rehabilitation Robotics, 2005. ICORR 2005.","29 Aug 2005","2005","","","353","356","Over four million Americans are affected by stroke. Current theories of stroke rehabilitation point towards paradigms of intense, concentrated use of the afflicted limb as a means for motor program reorganization and partial function restoration. A home system for stroke rehabilitation to train recovery of hand function has been designed and deployed in a research study. The system measures finger and wrist flexion and extension motions on both hands. Patients use joint motion to control the cursor on a screen in a concentrated tracking task for several hours each day over the course of 10 days. A telecomponent was added so that a therapist can check in with the patient and monitor progress. Fifteen patients have used the system in their homes. The equipment has been reliable and patients have generally responded that the system is easy to use.","1945-7901","0-7803-9003-2","10.1109/ICORR.2005.1501118","","https://ieeexplore.ieee.org/stamp/stamp.jsp?arnumber=1501118","","Fingers;Wrist;Tracking;Patient monitoring;Muscles;Mechanical engineering;Motion control;Neuroscience;Information technology;Neuroplasticity","telecontrol;patient rehabilitation;patient monitoring;medical computing","home stroke telerehabilitation system;train recovery;hand function;motor program reorganization;partial function restoration;joint motion","","8","","5","","29 Aug 2005","","","IEEE","IEEE Conferences"
"Pontine Nucleus audio stimuli detection & modeling for brain machine interface rehabilitation of conditional learning","H. Shteingart; A. Taub; H. Messer","Tel-Aviv University School of Electrical Engineering, Israel; Tel-Aviv University Department of Psychology, Israel; Tel-Aviv University School of Electrical Engineering, Israel","2009 IEEE/SP 15th Workshop on Statistical Signal Processing","6 Oct 2009","2009","","","21","24","In order to establish a brain-machine interface (BMI) system that rehabilitates damaged cerebellum function of discrete motor learning, the detection of conditional and unconditional stimuli (CS and US) onset times based on electro-physiology recordings analysis is necessary. These signals are relayed through brainstem areas called Pontine Nucleus (PN) and the Inferior Olive (IO) respectively. In this paper we focus on the model based analysis of the PN and compare the expected model performance with the observed one with real samples.We suggest a model of multi-unit (MU) activity as filtered inhomogeneous Poisson pulses of evoked activity contaminated by homogenous spontaneous activity and thermal noise (Filtered Poisson-Poisson-Gaussian model). By assigning the likelihood into the generalize log likelihood test (GLRT), we show that the best expected feature is energy detection. The model parameters were estimated based on the recorded peri-stimuli-time-histogram (PSTH) by chi-square goodness-of-fit minimization. Monte Carlo simulation showed that the thermal noise can be neglected in respect to the spontaneous activity and also predicted the order of the observed empiric detection performance in terms of detection probability and area under the receiver operation characteristic (ROC) curve (AUC).","2373-0803","978-1-4244-2711-6","10.1109/SSP.2009.5278650","","https://ieeexplore.ieee.org/stamp/stamp.jsp?arnumber=5278650","Brain Machine Interface;Neural Decoding;Brainstem;Classical Conditioning;SVM;Electrophysiology;Multi Unit;Poisson Model;GLRT;Detection;ROC;AUC;Simplex;Goodness-of-fit","Brain modeling;Machine learning;Electrodes;Computer vision;Parameter estimation;Neurons;Upper bound;Psychology;Disk recording;Relays","audio signal processing;brain models;brain-computer interfaces;Gaussian processes;learning (artificial intelligence);Markov processes;Monte Carlo methods;neural nets;optimisation","audio stimuli detection;brain-machine interface;conditional learning rehabilitation;discrete motor learning;unconditional stimuli;conditional stimuli;Pontine Nucleus area;Inferior Olive area;multi-unit activity;Filtered Poisson-Poisson-Gaussian model;generalize log likelihood test;energy detection;peri-stimuli-time-histogram;chi-square minimization;goodness-of-fit minimization;Monte Carlo simulation;detection probability;empiric detection performance;receiver operation characteristic curve;thermal noise","","1","","11","","6 Oct 2009","","","IEEE","IEEE Conferences"
