"Fit to Burst: Toward Noninvasive Estimation of Achilles Tendon Load Using Burst Vibrations","N. B. Bolus; H. K. Jeong; B. M. Blaho; M. Safaei; A. J. Young; O. T. Inan","Bioengineering Graduate ProgramGeorgia Institute of Technology; School of Electrical and Computer EngineeringGeorgia Institute of Technology; School of Electrical and Computer EngineeringGeorgia Institute of Technology; School of Electrical and Computer EngineeringGeorgia Institute of Technology; School of Mechanical EngineeringGeorgia Institute of Technology; School of Electrical and Computer Engineering, Georgia Institute of Technology, Atlanta, GA, USA","IEEE Transactions on Biomedical Engineering","21 Jan 2021","2021","68","2","470","481","Objective: Tendons are essential components of the musculoskeletal system and, as with any mechanical structure, can fail under load. Tendon injuries are common and can be debilitating, and research suggests that a better understanding of their loading conditions could help mitigate injury risk and improve rehabilitation. To that end, we present a novel method of noninvasively assessing parameters related to mechanical load in the Achilles tendon using burst vibrations. Methods: These vibrations, produced by a small vibration motor on the skin superficial to the tendon, are sensed by a skin-mounted accelerometer, which measures the tendon's response to burst excitation under varying tensile load. In this study, twelve healthy subjects performed a variety of everyday tasks designed to expose the Achilles tendon to a range of loading conditions. To approximate the vibration motor-tendon system and provide an explanation for observed changes in tendon response, a 2-degree-of-freedom mechanical systems model was developed. Results: Reliable, characteristic changes in the burst response profile as a function of Achilles tendon tension were observed during all loading tasks. Using a machine learning-based approach, we developed a regression model capable of accurately estimating net ankle moment-which captures general trends in tendon tension-across a range of walking speeds and across subjects (R2 = 0.85). Simulated results of the mechanical model accurately recreated behaviors observed in vivo. Finally, preliminary, proof-of-concept results from a fully wearable system demonstrated trends similar to those observed in experiments conducted using benchtop equipment. Conclusion: These findings suggest that an untethered, unobtrusive system can effectively assess tendon loading during activities of daily life. Significance: Access to such a system would have broad implications for injury recovery and prevention, athletic training, and the study of human movement.","1558-2531","","10.1109/TBME.2020.3005353","National Science Foundation; National Institutes of Health Smart and Connected Health; ","https://ieeexplore.ieee.org/stamp/stamp.jsp?arnumber=9127089","Achilles tendon;loading;tension;noninvasive;vibration;machine learning;burst response;haptic;wearable","Tendons;Vibrations;Accelerometers;Loading;Skin;Feature extraction;Injuries","accelerometers;biomedical communication;biomedical measurement;body sensor networks;gait analysis;injuries;learning (artificial intelligence);medical computing;muscle;physiological models;regression analysis;skin","Achilles tendon injuries;musculoskeletal system;mechanical structure;skin superficial;skin-mounted accelerometer;burst excitation;tensile load;burst response profile;tendon tension;wearable system;untethered system;unobtrusive system;Achilles tendon loading;vibration motor-tendon system;machine learning-based approach;regression model;two-degree-of-freedom mechanical system","","","","58","IEEE","26 Jun 2020","","","IEEE","IEEE Journals"
"A versatile hardware platform for brain computer interfaces","P. A. García; M. Haberman; E. M. Spinelli","UNLP, Electrical Engineering Department, LEICI (Laboratorio de Electrónica Industrial, Control e Instrumentación) and GITEC (Grupo de Innovación Tecnológica para la Transferencia) CC 91, La Plata, Argentina; UNLP, Electrical Engineering Department, LEICI and CONICET. La Plata, Argentina; UNLP, Electrical Engineering Department, LEICI and CONICET. La Plata, Argentina","2010 Annual International Conference of the IEEE Engineering in Medicine and Biology","11 Nov 2010","2010","","","4193","4196","This article presents the development of a versatile hardware platform for brain computer interfaces (BCI). The aim of this work is to produce a small, autonomous and configurable BCI platform adaptable to the user's needs. There are different design lines depending on the possible use of the BCI. The general objectives for the platform were portability, low energy consumption and small size. It has three main modules: the electroencephalography (EEG) amplifier and digitizer; the BCI core; and the communication module. Different alternatives for each module and a comparison between them are presented. Two applications have been used to test the proper operation of the hardware. In the first one, the platform was used to acquire the visual alpha rhythm and manage various electrical devices. On the other one, it has been used to acquire the motor beta rhythm and the visual alpha rhythm to manage the movement of an object on a computer screen.","1558-4615","978-1-4244-4123-5","10.1109/IEMBS.2010.5627389","","https://ieeexplore.ieee.org/stamp/stamp.jsp?arnumber=5627389","","Electroencephalography;Hardware;Bluetooth;Energy consumption;Protocols;Energy resolution;Computers","amplifiers;analogue-digital conversion;brain-computer interfaces;electroencephalography;medical signal processing","hardware platform;brain-computer interfaces;small autonomous configurable BCI platform;portabile BCI;low energy consumption BCI;electroencephalography;EEG amplifier;EEG digitizer;BCI core;communication module;visual alpha rhythm;motor beta rhythm","Brain;Computers;Electroencephalography;Humans;User-Computer Interface","1","","16","","11 Nov 2010","","","IEEE","IEEE Conferences"
"Akibot: A Telepresence Robot for Medical Teleconsultation","K. A. R. Carranza; N. J. B. Day; L. M. S. Lin; A. R. Ponce; W. R. O. Reyes; A. C. Abad; R. G. Baldovino","Manufacturing Engineering and Management (MEM) Department, Gokongwei College of Engineering, De La Salle University, 2401 Taft Avenue, Manila, 0922, Philippines; Manufacturing Engineering and Management (MEM) Department, Gokongwei College of Engineering, De La Salle University, 2401 Taft Avenue, Manila, 0922, Philippines; Manufacturing Engineering and Management (MEM) Department, Gokongwei College of Engineering, De La Salle University, 2401 Taft Avenue, Manila, 0922, Philippines; Manufacturing Engineering and Management (MEM) Department, Gokongwei College of Engineering, De La Salle University, 2401 Taft Avenue, Manila, 0922, Philippines; Manufacturing Engineering and Management (MEM) Department, Gokongwei College of Engineering, De La Salle University, 2401 Taft Avenue, Manila, 0922, Philippines; Electronics and Communications Engineering (ECE) Department, Gokongwei College of Engineering, De La Salle University, 2401 Taft Avenue, Manila, 0922, Philippines; Manufacturing Engineering and Management (MEM) Department, Gokongwei College of Engineering, De La Salle University, 2401 Taft Avenue, Manila, 0922, Philippines","2018 IEEE 10th International Conference on Humanoid, Nanotechnology, Information Technology,Communication and Control, Environment and Management (HNICEM)","14 Mar 2019","2018","","","1","4","One problem in the healthcare industry in the Philippines is the maldistribution of doctors. This greatly affects the accessibility of patients to proper healthcare. As a matter of fact, in 2015, 59.2% of deaths in the Philippines are attributed as deaths unattended by a doctor. Although there are current government programs, which aim to solve this problem, the use of telepresence systems can be another viable solution as doctors can still provide quality healthcare services even when located in a remote area. One limitation of medical telepresence robots is the lack of medical features. For this reason, the developed telepresence system includes a telepresence robot called Akibot with integrated medical devices such as otoscope, stethoscope, and ultrasound probe. Akibot is a highly maneuverable remotely controlled telepresence robot designed for general practice medical consultation between doctors and a patient on a remote area. Akibot has an empathic exterior with 4.6 out of 5 rating on its perceived quality of appearance and is equipped with modular medical devices and highly customizable screen, tested on an Android and Windows OS.","","978-1-5386-7767-4","10.1109/HNICEM.2018.8666283","","https://ieeexplore.ieee.org/stamp/stamp.jsp?arnumber=8666283","general practice medical consultation;human-centered robot design;teleconsultation;telepresence robot","Medical services;Telepresence;Robot control;Delays;Medical diagnostic imaging;DC motors","Android (operating system);biomedical equipment;control engineering computing;health care;medical computing;medical robotics;mobile robots;operating systems (computers);telemedicine;telerobotics","Akibot;doctor;remote area;healthcare industry;Philippines;medical telepresence robots;medical consultation;medical devices;government programs;healthcare services;remotely controlled telepresence robot;Android;Windows OS","","","","10","","14 Mar 2019","","","IEEE","IEEE Conferences"
"Automatic Detection of Cursor Movements from the EEG Signals via Deep Learning Approach","H. Polat; M. S. Özerdem","Bingol University,Department of Electricity and Energy,Bingöl,Turkey; Diele University,Electrical and Electronics Engineering,Diyarbakir,Turkey","2020 5th International Conference on Computer Science and Engineering (UBMK)","12 Oct 2020","2020","","","327","332","The classification of motor imagery (MI) tasks is one of the key objectives of EEG-based brain-computer interface (BCI) systems. To ensure successful classification performance to BCI systems, researchers endeavor to extract appropriate features. However, these challenges are based on the conventional method. In this study, EEG signals related to MI tasks are classified using the convolutional neural network (CNN), which does not need a separate feature extraction. EEG records, which are generally evaluated as one-dimensional in machine learning problems, were taken into consideration as the image representation by using a novel method. The datasets were taken from a healthy subject. The subject was asked to move a cursor up and down on a computer screen, while his cortical potentials were taken. The EEG signals recorded over the 3.5-second time interval were evaluated for both the whole time and sub time intervals. Thus, the most effective time interval that has distinguishing features for EEG recordings related to different cursor movements was tried to be determined as well. As a result, it has been shown that the proposed model based on deep learning approach can successfully classify EEG signals related to cursor movements.","","978-1-7281-7565-2","10.1109/UBMK50275.2020.9219507","","https://ieeexplore.ieee.org/stamp/stamp.jsp?arnumber=9219507","EEG;Deep Learning;Convolutional Neural Networks;Classification","Deep learning;Convolutional neural networks;Neurons","brain-computer interfaces;convolutional neural nets;electroencephalography;feature extraction;image classification;image representation;learning (artificial intelligence);medical image processing","MI tasks;convolutional neural network;feature extraction;EEG records;machine learning;image representation;healthy subject;EEG signals;deep learning;motor imagery classification;EEG-based brain-computer interface systems;successful classification performance;BCI systems;cursor movement automatic detection;CNN","","1","","25","","12 Oct 2020","","","IEEE","IEEE Conferences"
"Large-Scale Synthesis of Functional Spiking Neural Circuits","T. C. Stewart; C. Eliasmith","Centre for Theor. Neurosci., Univ. of Waterloo, Waterloo, ON, Canada; Centre for Theor. Neurosci., Univ. of Waterloo, Waterloo, ON, Canada","Proceedings of the IEEE","28 Apr 2014","2014","102","5","881","898","In this paper, we review the theoretical and software tools used to construct Spaun, the first (and so far only) brain model capable of performing cognitive tasks. This tool set allowed us to configure 2.5 million simple nonlinear components (neurons) with 60 billion connections between them (synapses) such that the resulting model can perform eight different perceptual, motor, and cognitive tasks. To reverse-engineer the brain in this way, a method is needed that shows how large numbers of simple components, each of which receives thousands of inputs from other components, can be organized to perform the desired computations. We achieve this through the neural engineering framework (NEF), a mathematical theory that provides methods for systematically generating biologically plausible spiking networks to implement nonlinear and linear dynamical systems. On top of this, we propose the semantic pointer architecture (SPA), a hypothesis regarding some aspects of the organization, function, and representational resources used in the mammalian brain. We conclude by discussing Spaun, which is an example model that uses the SPA and is implemented using the NEF. Throughout, we discuss the software tool Neural ENGineering Objects (Nengo), which allows for the synthesis and simulation of neural models efficiently on the scale of Spaun, and provides support for constructing models using the NEF and the SPA. The resulting NEF/SPA/Nengo combination is a general tool set for both evaluating hypotheses about how the brain works, and for building systems that compute particular functions using neuron-like components.","1558-2256","","10.1109/JPROC.2014.2306061","","https://ieeexplore.ieee.org/stamp/stamp.jsp?arnumber=6779629","Neural computation;neural engineering framework (NEF);neural modeling;neuromorphic engineering;semantic pointer architecture (SPA);Spaun;spiking neural networks;Neural computation;neural engineering framework (NEF);neural modeling;neuromorphic engineering;semantic pointer architecture (SPA);Spaun;spiking neural networks","Neurons;Neuroscience;Brain modeling;Decoding;Computational modeling;Neural networks;Statistics;Network architecture","brain models;cognition;large-scale systems;medical computing;neural nets;neurophysiology;nonlinear dynamical systems;reviews","large-scale synthesis;functional spiking neural circuits;review;theoretical tool;software tool;brain model;cognitive task;simple nonlinear components;synapses;perceptual task;motor task;reverse-engineer;neural engineering framework;mathematical theory;biologically plausible spiking networks;nonlinear dynamical systems;semantic pointer architecture;organization resources;function resources;representational resources;mammalian brain;Neural ENGineering Objects;neural model synthesis;neural model simulation;Spaun scale;NEF/SPA/Nengo combination;neuron-like components","","44","","69","","27 Mar 2014","","","IEEE","IEEE Journals"
"[Title page i - Volume 1]","",,"2012 International Conference on Computer Science and Electronics Engineering","23 Apr 2012","2012","1","","i","i","The following topics are dealt with: environmental cost internalization effect analysis; pricing decision theory; international carbon emission trading; device description technology; proportional-derivative controller; chaotic financial system; rolling bearing fault diagnosis; multichannel MAC protocol; 802.11-based wireless mesh networks; Uyghur broadcast news continues speech sensitive-word spotting system; viscoelastic ray tracing simulation; underground cavity stability; spacecraft attitude control; inertia matrix generalized mixed vector variational-like inequalities; stub tooth involute gears; expression recognition; BP neural network; file access security; CFD numerical simulation; exhaust gas flow pattern; hot galvanizing bath; grading steel ball; wear discrete element method; orbit determination; space-based optical observations; Adaboost blob tracking; parallel switching power supply module system; multisource heterogeneous data integration; DSP-based SVPWM vector control system; asynchronous motor scanned document image segmentation; Voronoi diagram; aircraft object recognition model; adaptive threshold Canny edge detection algorithm; data synchronization; open service-aware mobile network API; OAuth based authentication; Open Telco API; online fresh supermarket logistics delivery information system; image encryption algorithm; fast 1-DDCT algorithm; parallel computing; safety education system; virtual reality technology; water quality; aeronautical component repair business optimization; high-speed BiCMOS fully differential operational amplifier; cloud computing; enterprise information system; software development cost; Java multithread technology; wireless sensor network; NC remote video monitoring; military communication network; e-government affair system; particle swarm optimized wavelet neural network; face recognition; grass stem biomechanics; RFID system; Internet of Things; gyroscope test instrument rotating floor DSP control system; and AC synchronous generators.","","978-0-7695-4647-6","10.1109/ICCSEE.2012.81","","https://ieeexplore.ieee.org/stamp/stamp.jsp?arnumber=6187941","","","access protocols;aircraft maintenance;application program interfaces;asynchronous generators;attitude control;authorisation;backpropagation;biomechanics;cloud computing;computational fluid dynamics;computational geometry;data integration;decision theory;environmental economics;face recognition;fault diagnosis;file organisation;finite element analysis;galvanising;gears;government data processing;image coding;information systems;military communication;neural nets;parallel processing;particle swarm optimisation;pricing;radiofrequency identification;ray tracing;rolling bearings;signal processing;space vehicles;speech recognition;test equipment;three-term control;video surveillance;virtual reality;water quality;wear;wireless mesh networks;wireless sensor networks","environmental cost internalization effect analysis;pricing decision theory;international carbon emission trading;device description technology;proportional-derivative controller;chaotic financial system;rolling bearing fault diagnosis;multichannel MAC protocol;802.11-based wireless mesh networks;Uyghur broadcast news continues speech sensitive-word spotting system;viscoelastic ray tracing simulation;underground cavity stability;spacecraft attitude control;inertia matrix;generalized mixed vector variational-like inequalities;stub tooth involute gears;expression recognition;BP neural network;file access security;CFD numerical simulation;exhaust gas flow pattern;hot galvanizing bath;grading steel ball wear;discrete element method;orbit determination;space-based optical observations;Adaboost blob tracking;parallel switching power supply module system;multisource heterogeneous data integration;DSP-based SVPWM vector control system;asynchronous motor;scanned document image segmentation;Voronoi diagram;aircraft object recognition model;adaptive threshold Canny edge detection algorithm;data synchronization;open service-aware mobile network API;OAuth based authentication;Open Telco API;online fresh supermarket logistics delivery information system;image encryption algorithm;fast 1-DDCT algorithm;parallel computing;safety education system;virtual reality technology;water quality;aeronautical component repair business optimization;high-speed BiCMOS fully differential operational amplifier;cloud computing;enterprise information system;software development cost;Java multithread technology;wireless sensor network;NC remote video monitoring;military communication network;e-government affair system;particle swarm optimized wavelet neural network;face recognition;grass stem biomechanics;RFID system;Internet of Things;gyroscope test instrument rotating floor DSP control system;AC synchronous generators","","","","","","23 Apr 2012","","","IEEE","IEEE Conferences"
