"3D Sound Rendering in a Virtual Environment to Evaluate Pedestrian Street Crossing Decisions at a Roundabout","H. Wu; D. H. Ashmead; H. Adams; B. Bodenheimer","Vanderbilt University, USA; Vanderbilt University, USA; Vanderbilt University, USA; Vanderbilt University, USA","2018 IEEE 4th VR Workshop on Sonic Interactions for Virtual Environments (SIVE)","16 Dec 2018","2018","","","1","6","Crossing streets is a potentially hazardous activity for pedestrians, and it is made more hazardous when the complexity of the intersection increases beyond a simple linear bisection, as it does in the case of a roundabout. We are interested in how pedestrians make decisions about when to cross at such intersections. Simulating these intersections in immersive virtual reality provides a safe and effective way to do this. In this context, we present a traffic simulation designed to assess how pedestrians make dynamic gap affordance judgments related to crossing the street when supplied with spatialized sound cues. Our system uses positional information to generate generic head-related transfer functions (HRTFs) for spatializing audio sources. In this paper we evaluate the utility of using spatialized sound for these gap crossing judgments. In addition, we evaluate our simulation against varying levels of visual degradation to better understand how those with visual deficits might rely on their auditory senses. Our results indicate that spatialized sound enhances the experience of the virtual traffic simulation; its effects on gap crossing behavior are more subtle.","","978-1-5386-5713-3","10.1109/SIVE.2018.8577195","","https://ieeexplore.ieee.org/stamp/stamp.jsp?arnumber=8577195","Virtual reality;spatialized sound;gap affordance;traffic simulation;I.3.7 [Computer Graphics]: Three-Dimensional Graphics and Realism—Virtal Reality;J.4 [Computer Applications]: Social and Behavioral Sciences—Psychology","Virtual environments;Solid modeling;Three-dimensional displays;Visualization;Biological system modeling;Acoustics;Automobiles","acoustic signal processing;audio signal processing;digital simulation;pedestrians;rendering (computer graphics);solid modelling;traffic engineering computing;transfer functions;virtual reality","virtual reality;head-related transfer functions;pedestrian street crossing decisions;HRTF;audio sources;gap crossing behavior;virtual traffic simulation;roundabout;virtual environment;3d sound rendering","","","","50","","16 Dec 2018","","","IEEE","IEEE Conferences"
"A framework for volume segmentation and visualization using Augmented Reality","T. Tawara; K. Ono","RIKEN, Japan; RIKEN, Japan","2010 IEEE Symposium on 3D User Interfaces (3DUI)","29 Apr 2010","2010","","","121","122","We propose a two-handed direct manipulation system to achieve complex volume segmentation of CT/MRI data in Augmented Reality with a remote controller attached to a motion tracking cube. At the same time segmented data is displayed by direct volume rendering using a programmable GPU. Our system achieves visualization of real time modification of volume data with complex shading including transparency control by changing transfer functions, displaying any cross section, and rendering multi materials using a local illumination model. Our goal is to build a system that facilitates direct manipulation of volumetric CT/MRI data for segmentation in Augmented Reality. Volume segmentation is a challenging problem and segmented data has an important role for visualization and analysis.","","978-1-4244-6847-8","10.1109/3DUI.2010.5444707","","https://ieeexplore.ieee.org/stamp/stamp.jsp?arnumber=5444707","","Augmented reality;Data visualization;Data mining;Magnetic resonance imaging;Tracking;Humans;Motion control;Control systems;Shape control;Needles","augmented reality;biomedical MRI;computerised tomography;data visualisation;image segmentation;medical image processing","volume segmentation;volume visualization;augmented reality;direct manipulation system;CT/MRI data;motion tracking cube;real time modification","","2","","4","","29 Apr 2010","","","IEEE","IEEE Conferences"
"Immersive virtual environments for tacit knowledge transfer focusing on gestures: A workflow","H. Esmaeili; H. Thwaites; P. C. Woods","Centre for Research-Creation in Digital Media, School of Arts, Sunway University, Malaysia; Centre for Research-Creation in Digital Media, School of Arts, Sunway University, Malaysia; Faculty of Creative Multimedia, Multimedia University, Malaysia","2017 23rd International Conference on Virtual System & Multimedia (VSMM)","26 Apr 2018","2017","","","1","6","This study presents a workflow for creating immersive virtual environments for tacit knowledge transfer. The main focus is on gestures, which are related to skill, performance, or physical emotion (not facial) e.g. sports, martial arts, playing instruments, acting, etc. The initial idea behind this design is to provide a virtual practice environment mainly for actors in order to learn new gestures or moves. However, this virtual environment can also be used by many other target audiences based on their needs. Sometimes, ambiguity is part of knowledge transfer and becomes more salient or critical when it comes to tacit knowledge, especially at early stages of transfer. Performance while maintaining believable gesture is a must have requirement for actors. Visual references (mainly video in absence of trainer) are commonly used by actors in order to learn specific moves or gestures. However, videos are limited to 2D screen view (even if stereoscopic or 360°) and do not provide chance of studying a freezing moment from all angles, simultaneously. Although this can be partly mimicked using multi-camera rig, it is still limited to the number of shots taken and only provides a linear frame sequence (mostly used as VFX). Immersive virtual environments not only eliminate this limitation but also provide one to one scale experience. In this study, the process of creating such environment is discussed in detail. This includes planning, concept design, selecting tools, establishing the environment, properly selecting or creating the virtual character(s), capturing the motion or using existing ones from different Mocap libraries, actor's interaction with VR equipment, user experience, etc. In addition to studying reference moves and gestures (frame by frame and from any angle), the user is able to observe his/her performance in VR. This can be achieved using motion capture cameras installed at the practice location. The captured content is later assigned to the user's virtual representative i.e. a 3d character created based on his/her physical body features for side by side analysis with the reference. This provides countless interaction possibilities that cannot be achieved in the real world. Few examples are: multiplying the reference character and freeze two or more different moments (frames) and create a walkthrough, creating an immersive timeline based on the actor's progress (also requires multiplying), assigning reference moves to the user's avatar to be compared with his/her movements by himself/herself or anyone else (different from side by side comparison with the reference character), and many others. What has been discussed above is fully illustrated and described in this paper including detailed figures. The contribution of this study can be extended to various fields from acting and sport to stop motion and creative art, as the processes presented in the paper are designed in the most affordable way, using hardware and software currently available to basic users.","2474-1485","978-1-5386-4494-2","10.1109/VSMM.2017.8346255","","https://ieeexplore.ieee.org/stamp/stamp.jsp?arnumber=8346255","immersive virtual environments;immersive virtual reality;tacit knowledge transfer;gesture;virtual reality;mocap;learning in virtual reality;htc vive;oculus rift;unity;steam vr","Teleportation;Knowledge transfer;Observers;Virtual environments;Art;Tools;Three-dimensional displays","gesture recognition;virtual reality","reference character;reference moves;immersive virtual environments;tacit knowledge transfer;virtual practice environment;believable gesture;virtual character;virtual representative","","1","","10","","26 Apr 2018","","","IEEE","IEEE Conferences"
"An Interactive Mixed Reality Framework for Virtual Humans","A. Egges; G. Papagiannakis; N. Magnenat-Thalmann","University of Geneva, Switzerland; University of Geneva, Switzerland; University of Geneva, Switzerland","2006 International Conference on Cyberworlds","19 Dec 2006","2006","","","165","172","In this paper, we present a simple and robust mixed reality (MR) framework that allows for real-time interaction with virtual humans in real and virtual environments under consistent illumination. We look at three crucial parts of this system: interaction, animation and global illumination of virtual humans for an integrated and enhanced presence. The interaction system comprises of a dialogue module, which is interfaced with a speech recognition and synthesis system. Next to speech output, the dialogue system generates face and body motions, which are in turn managed by the virtual human animation layer. Our fast animation engine can handle various types of motions, such as normal key-frame animations, or motions that are generated on-the-fly by adapting previously recorded clips. All these different motions are generated and blended on-line, resulting in a flexible and realistic animation. Our robust rendering method operates in accordance with the previous animation layer, based on an extended for virtual humans precomputed radiance transfer (PRT) illumination model, resulting in a realistic display of such interactive virtual characters in mixed reality environments. Finally, we present a scenario that illustrates the interplay and application of our methods, glued under a unique framework for presence and interaction in MR","","0-7695-2671-3","10.1109/CW.2006.15","","https://ieeexplore.ieee.org/stamp/stamp.jsp?arnumber=4030841","","Virtual reality;Humans;Lighting;Robustness;Facial animation;Virtual environment;Speech recognition;Speech synthesis;Face;Engines","avatars;computer animation;interactive systems","interactive mixed reality framework;real-time interaction;virtual environment;interaction system;speech recognition;speech synthesis;dialogue system;virtual human animation;rendering method;precomputed radiance transfer illumination model;interactive virtual character","","5","","32","","19 Dec 2006","","","IEEE","IEEE Conferences"
"Exploring social presence transfer in real-virtual human interaction","S. Daher; K. Kim; M. Lee; A. Raij; R. Schubert; J. Bailenson; G. Welch",University of Central Florida; University of Central Florida; University of Central Florida; University of Central Florida; University of Central Florida and UNC-Chapel Hill; Stanford University; University of Central Florida,"2016 IEEE Virtual Reality (VR)","7 Jul 2016","2016","","","165","166","We explore whether a peripheral observation of apparent mutual social presence between a real human (RH) and a virtual human (VH) can in turn increase a subject's sense of social presence with the VH. In other words, we explore whether social presence can “transfer” from one RH-VH interaction to another. Specifically, we carried out an experiment where human subjects were asked to play a game with a VH. As they entered the game room, approximately half of the subjects were exposed to a brief but apparently engaging conversation between an RH and the VH. The subjects who were exposed to the brief RH-VH interaction had significantly higher measures of both emotional connection and the attentional allocation dimension of social presence for the VH, compared to those who were not. We describe the motivation, the experiment, and the results.","2375-5334","978-1-5090-0836-0","10.1109/VR.2016.7504705","","https://ieeexplore.ieee.org/stamp/stamp.jsp?arnumber=7504705","H.5.1 [Information Interfaces and Presentation]: Multimedia Information Systems — Artificial, Augmented, and Virtual Realities;J.4 [Computer Applications]: Social and Behavioral Sciences — Psychology","Games;Electronic mail;Psychology;Resource management;Medical services;Virtual environments;Training","computer games;graphical user interfaces;social sciences computing;virtual reality","attentional allocation dimension;emotional connection;apparently engaging conversation;game room;RH-VH interaction;apparent mutual social presence;peripheral observation;real-virtual human interaction;social presence transfer","","2","","7","","7 Jul 2016","","","IEEE","IEEE Conferences"
"A comparison between measured and modelled head-related transfer functions for an enhancement of real-time 3D audio processing for virtual reality environments","A. S. Suarez; J. Tissieres; L. S. Vieira; R. Hunter-McHardy; S. K. Sernavski; S. Serafin",Aalborg University Copenhagen; Aalborg University Copenhagen; Aalborg University Copenhagen; Aalborg University Copenhagen; Aalborg University Copenhagen; Aalborg University Copenhagen,"2017 IEEE 3rd VR Workshop on Sonic Interactions for Virtual Environments (SIVE)","17 Apr 2017","2017","","","1","9","Sound in Virtual Reality (VR) has been explored in a variety of algorithms which try to enhance the illusion of presence, improving sound localization and spatialization in the virtual environment. As new systems are developed, different models are applied. There is still the need to evaluate and understand the main advantages of each of these approaches. In this study, a performance comparison of two methods for real-time 3D binaural sound tested preferences and quality of presence for headphones in a VR experience. Both the mathematical based HRTF and the convolution based measured HRTF from the MIT KEMAR show a general similarity in the participants sense of localization, depth and presence. Nevertheless, the tests also indicate a preference in elevation perception for the convolution-based measured HRTF. Further experiments with new tools, techniques, contexts, and guidelines are therefore required to highlight the importance and differences between these two methods and other implementations.","","978-1-5386-0459-5","10.1109/SIVE.2017.7901609","","https://ieeexplore.ieee.org/stamp/stamp.jsp?arnumber=7901609","","Ear;Three-dimensional displays;Convolution;Computational modeling;Databases;Mathematical model;Azimuth","audio signal processing;real-time systems;virtual reality","real-time 3D audio processing enhancement;virtual reality environments;sound localization;sound spatialization;binaural sound tested preferences;quality of presence;headphones;VR experience;mathematical based HRTF;MIT KEMAR;convolution","","2","2","11","","17 Apr 2017","","","IEEE","IEEE Conferences"
"Poster: A pilot study on stepwise 6-DoF manipulation of virtual 3D objects using smartphone in wearable augmented reality environment","Taejin Ha; Woontack Woo","KAIST UVR Lab., 305-701, S. Korea; KAIST UVR Lab., 305-701, S. Korea","2013 IEEE Symposium on 3D User Interfaces (3DUI)","5 Sep 2013","2013","","","137","138","In general, 6 degrees of freedom (DoF) manipulation of 3D virtual objects requires cumbersome external tracking installations to localize and track the input device in a normal wearable augmented reality (WAR) environment. In this paper, a smartphone-based 6-DoF manipulation method is proposed to avoid the use of complicated installations. First, the proposed 6-DoF manipulation method (3-DoF translation and 3-DoF rotation) exploits various embedded sensor information of the smartphone. Transfer functions are then designed to transfer the phone's 6-DoF control gain to the 3D display space's object manipulation gain. According to the experimental results, the quadratic transfer function was superior to the linear and acceleration functions with less completion time and errors.","","978-1-4673-6098-2","10.1109/3DUI.2013.6550216","","https://ieeexplore.ieee.org/stamp/stamp.jsp?arnumber=6550216","Wearable Augmented Reality Environment;Non-External Tracking Environment;3D User Interaction","Abstracts;Indexes;Wireless sensor networks;Wireless communication;Magnetic resonance imaging;Cameras;Image resolution","augmented reality;smart phones;user interfaces","stepwise 6-DoF manipulation;6 degrees-of-freedom manipulation;smart phone;wearable augmented reality environment;3D virtual object;WAR environment;3-DoF translation;3-DoF rotation;embedded sensor information;quadratic transfer function;linear function;acceleration function","","","","3","","5 Sep 2013","","","IEEE","IEEE Conferences"
"Development of A Virtual Environment to Realize Human-Machine Interaction of Forklift Operation","J. Y. Chew; K. Okayama; T. Okuma; M. Kawamoto; H. Onda; N. Kato","National Institute of Advanced Industrial Science and Technology,Japan; National Institute of Advanced Industrial Science and Technology,Japan; National Institute of Advanced Industrial Science and Technology,Japan; National Institute of Advanced Industrial Science and Technology,Japan; National Institute of Advanced Industrial Science and Technology,Japan; National Institute of Advanced Industrial Science and Technology,Japan","2019 7th International Conference on Robot Intelligence Technology and Applications (RiTA)","16 Dec 2019","2019","","","112","118","This study presents an experimental concept to develop realistic Human-Machine Interaction (HMI) for a Virtual Environment (VE) and a novel evaluation methodology of such system. Such evaluation is motivated by the need to facilitate transfer of model/knowledge from VE to the Real Environment (RE), where it is crucial for the VE to trigger similar user behavior as in the RE. This paper discusses the application of such concept to evaluate interactions of forklift operation in the VE. First, a Virtual Reality (VR) forklift simulator is developed using motion capture and 3D reconstruction methods to mimic HMI of the real forklift operation. Then, the Dynamic Time Warping (DTW) algorithm is used for temporal evaluation of operation behaviors in VE and RE. Results of DTW (i.e. distance and correlation) are used as objective measures to evaluate fidelity of VE during forklift operations on the simulator. Results suggest the proposed forklift simulator triggers operation behavior which is similar (highly correlated) to that of real forklift operation. The contributions of this paper are (a) the novel VR forklift simulator system to realize interactions of real forklift in the VE, and (b) the proposed objective measures for temporal evaluation of the fidelity of VE.","","978-1-7281-3118-4","10.1109/RITAPP.2019.8932837","","https://ieeexplore.ieee.org/stamp/stamp.jsp?arnumber=8932837","","Visualization;Task analysis;Three-dimensional displays;Resists;Image reconstruction;Tracking;Man-machine systems","fork lift trucks;human computer interaction;man-machine systems;virtual reality","operation behaviors;temporal evaluation;virtual environment;human-machine interaction;evaluation methodology;Virtual Reality forklift simulator;forklift simulator;forklift simulator;VR forklift;Real Environment;motion capture;3D reconstruction methods;real forklift operation;Dynamic Time Warping","","","","26","","16 Dec 2019","","","IEEE","IEEE Conferences"
"Interaction with an agent in Blended Reality","Y. Kanai; H. Ohsawa; M. Imai","Keio University, 3-14-1, Hiyoshi, Kohoku-ku, Yokohama, Kanagawa 223-8522, Japan; Keio University, 3-14-1, Hiyoshi, Kohoku-ku, Yokohama, Kanagawa 223-8522, Japan; Keio University, 3-14-1, Hiyoshi, Kohoku-ku, Yokohama, Kanagawa 223-8522, Japan","2013 8th ACM/IEEE International Conference on Human-Robot Interaction (HRI)","21 Mar 2013","2013","","","153","154","This paper proposes a Blended Reality Agent called “BReA” that can exist in both the real and virtual world and has communicative advantages that is more than simply the sum of those of a robotic agent and an on-screen agent. BReA can seamlessly transfer between the real world and virtual world and users can communicate with BReA without interruption during the transference. We conducted a field test and showed that users can recognize when it points from the virtual world to a real world object after it moves from the real world to virtual world. This result supports a hypothesis that communicating with BReA helps users recognize the link between real world and virtual world objects and virtual world information.","2167-2148","978-1-4673-3101-2","10.1109/HRI.2013.6483547","","https://ieeexplore.ieee.org/stamp/stamp.jsp?arnumber=6483547","blended reality;human-agent interaction;field test","Robots;Interrupters;Interactive systems;Augmented reality;Augmented virtuality;Organic light emitting diodes;Cameras","human-robot interaction;multi-agent systems","blended reality agent;BReA;on-screen agent;robotic agent;real world object;virtual world objects","","","","5","","21 Mar 2013","","","IEEE","IEEE Conferences"
"VREX: Virtual reality education expansion could help to improve the class experience (VREX platform and community for VR based education)","L. Ying; Z. Jiong; S. Wei; W. Jingchun; G. Xiaopeng","School of Computer Science and Engineering, Beihang University, Beijing, China; School of Computer Science and Engineering, Beihang University, Beijing, China; School of Computer Science and Engineering, Beihang University, Beijing, China; Dept. for Cyber Online Popularization of Science, Chinese Science and Technology Museum, Beijing, China; School of Computer Science and Engineering, Beihang University, Beijing, China","2017 IEEE Frontiers in Education Conference (FIE)","14 Dec 2017","2017","","","1","5","This paper proposed an innovative education platform-VREX (Virtual Reality based Education eXpansion), with combination of online and offline, to improve the curriculum building and teaching experience. VREX is based on Virtual Reality (VR) and we believe VR can revolutionize the education ecosystem. With some trials, we found VR can be used to promote curriculum effectiveness in an immersive environment so that students can have intuitive sense to understand some abstract knowledge, which is always hard for teachers to describe. We have tried to transfer slides into VR scenes, for the students to learn knowledge in a rather real but totally virtual world. The main contributions were made: (1) VREX build an open and immersion virtual O2O classroom with internet and VR devices so that real classrooms might be used in a different way in the future. (2) VREX provides a distributed mode for students to experience an interactive learning process at anytime, anywhere and any-frequency. (3) VREX can be used to support education in different disciplines, from K-12 to Universities, and we provided some practical cases, like `Marine Life' to show creatures in deep sea, which provides immersive experience to makes students feel they were there. Finally, the feasibility and advantage of VREX are proved by the actual statistical data in the 3rd season 2017.","","978-1-5090-5920-1","10.1109/FIE.2017.8190660","","https://ieeexplore.ieee.org/stamp/stamp.jsp?arnumber=8190660","Virtual Reality;Immersion;Interaction;Virtual classroom;VR Cloud Platform","Cloud computing;Games;Computer architecture;Hardware;Courseware;Training","computer aided instruction;educational courses;interactive systems;Internet;teaching;virtual reality","immersive experience;virtual reality education expansion;VR based education;innovative education platform-VREX;curriculum building;teaching experience;education ecosystem;VR scenes;immersion virtual O2O classroom;class experience improvement;VREX platform;open virtual O2O classroom;interactive learning process","","5","","10","","14 Dec 2017","","","IEEE","IEEE Conferences"
