"BIM-based Mixed Reality Application for Supervision of Construction","P. Raimbaud; R. Lou; F. Merienne; F. Danglade; P. Figueroa; J. T. Hernández","LiSPEN, Arts et Métiers, Institut Image, Chalon/Saône, France; LiSPEN, Arts et Métiers, Institut Image, Chalon/Saône, France; LiSPEN, Arts et Métiers, Institut Image, Chalon/Saône, France; LiSPEN, Arts et Métiers, Institut Image, Chalon/Saône, France; Systems and Computing Engineering, Imagine Group, Universidad de los Andes, Bogota, D.C., Colombia; Systems and Computing Engineering, Imagine Group, Universidad de los Andes, Bogota, D.C., Colombia","2019 IEEE Conference on Virtual Reality and 3D User Interfaces (VR)","15 Aug 2019","2019","","","1903","1907","Building Information Modelling (BIM) is an up-and-coming methodology and technology used in the Architecture, Engineering and Construction (AEC) industry, that allows data centralization and stakeholders' collaboration. But to check the accuracy of the work done on the worksite, it is necessary first to go on site and then to modify the BIM model. This paper presents a mixed reality (MR) application based on BIM data and drone videos, allowing off-site construction supervision. It permits to make annotations about differences between what has been planned in BIM and what has been built, using superimposition of the two sources. Then these ones can be transferred to the BIM model for corrections. Finally, we evaluate our work with building construction experts, providing to them a questionnaire to grade the application and to get feedback. Our major result is that as for them the application does really help to do construction supervisions; however, they suggest that the application should provide more interactions with the 3D model and with the videos.","2642-5254","978-1-7281-1377-7","10.1109/VR.2019.8797784","","https://ieeexplore.ieee.org/stamp/stamp.jsp?arnumber=8797784","BIM;mixed reality;construction;superimposition;drone;videos;I.2.1 [Human-centered computing]: Interaction design—Interaction design process and methods;J.6.4[Computing methodologies]: Computer graphics—Graphics systems and interfaces","Conferences;Virtual reality;Three-dimensional displays;User interfaces;Erbium","building information modelling;building management systems;construction industry;remotely operated vehicles;structural engineering computing;video signal processing;virtual reality","data centralization;building information model;architecture-engineering-construction industry;stakeholder collaboration;mixed reality model;building construction experts;3D model;drone videos","","","","22","","15 Aug 2019","","","IEEE","IEEE Conferences"
"A Publish/Subscribe based correlative matching method for multi-domain virtual environment","L. Liu; W. Wu; H. Chen","School of Computer Science and Information Engineering, Beijing Technology and Business University, 100048, China; State Key Laboratory of Virtual Reality Technology, Beihang University, Beijing 100083, China; School of Computer Science and Information Engineering, Beijing Technology and Business University, 100048, China","2011 IEEE International Symposium on VR Innovation","29 Apr 2011","2011","","","169","174","The multi-domain virtual environment is an important research area of the distributed virtual reality. However, frequent interaction, great quantity of messages and the discrepant need of each individual simulation domain resulted in numerous redundant messages. In this paper, we propose a Publish/Subscribe based correlative matching method for multi-domain virtual environment. This method focus on data filtering of domains' gateways in addition to the DDM scheme. The paper introduces the correlative matching algorithm, the binary representation and the matching method which based on publish/subscribe relationship. Analysis and experiments show that this new solution effectively reduces the redundant data transferring among gateways, thus greatly enhances the performance of the virtual environment, and that the cost of matching method is relative small in multi-domain virtual environment application.","","978-1-4577-0054-5","10.1109/ISVRI.2011.5759625","","https://ieeexplore.ieee.org/stamp/stamp.jsp?arnumber=5759625","Publish/subscribe;matching method;multi-domain","Logic gates;Virtual environment;Bandwidth;Filtering;Local area networks;Wide area networks;Servers","middleware;virtual reality","correlative matching method;multidomain virtual environment;distributed virtual reality;data filtering;correlative matching algorithm","","","","10","","29 Apr 2011","","","IEEE","IEEE Conferences"
"Influences on the Elicitation of Interpersonal Space with Virtual Humans","D. M. Krum; S. Kang; T. Phan","University of Southern California, Institute for Creative Technologies; University of Southern California, Institute for Creative Technologies; University of Southern California, Institute for Creative Technologies","2018 IEEE Conference on Virtual Reality and 3D User Interfaces (VR)","30 Aug 2018","2018","","","223","9","The emergence of low cost virtual and augmented reality systems has encouraged the development of immersive training applications for medical, military, and many other fields. Many of the training scenarios for these various fields may require the presentation of realistic interactions with virtual humans. It is thus vital to determine the critical factors of fidelity required in those interactions to elicit naturalistic behavior on the part of trainees. Negative training may occur if trainees are inadvertently influenced to react in ways that are unexpected and unnatural, hindering proper learning and transfer of skills and knowledge back into real world contexts. In this research, we examined whether haptic priming (presenting an illusion of virtual human touch at the beginning of the virtual experience) and different locomotion techniques (either joystick or physical walking) might affect proxemic behavior in human users. The results of our study suggest that locomotion techniques can alter proxemic behavior in significant ways. Haptic priming did not appear to impact proxemic behavior, but did increase rapport and other subjective social measures. The results suggest that designers and developers of immersive training systems should carefully consider the impact of even simple design and fidelity choices on trainee reactions in social interactions.","","978-1-5386-3365-6","10.1109/VR.2018.8446235","","https://ieeexplore.ieee.org/stamp/stamp.jsp?arnumber=8446235","Virtual humans;virtual reality;immersive training;fidelity;proxemics;haptic priming;locomotion techniques.: Human-centered computing-Human Computer Interaction (HCI)-Interaction Paradigms-Virtual Reality;Human-centered computing-Interaction design-Interaction design process and methods-User interface design","Haptic interfaces;Training;Legged locomotion;Virtual environments;Atmospheric measurements;Particle measurements","augmented reality;haptic interfaces;interactive devices;training","elicitation;interpersonal space;virtual humans;augmented reality systems;immersive training applications;training scenarios;realistic interactions;naturalistic behavior;negative training;proper learning;virtual human touch;virtual experience;human users;impact proxemic behavior;immersive training systems;trainee reactions;social interactions;locomotion techniques","","","","28","","30 Aug 2018","","","IEEE","IEEE Conferences"
"Task-oriented teleoperation through natural 3D user interaction","H. Kim; J. Kim; K. Ryu; S. Cheon; Y. Oh; J. Park","Human-centered Interaction & Robotics Research Center, Korea Institute of Science and Technology, Seoul, 136-791, Republic of Korea; Human-centered Interaction & Robotics Research Center, Korea Institute of Science and Technology, Seoul, 136-791, Republic of Korea; Human-centered Interaction & Robotics Research Center, Korea Institute of Science and Technology, Seoul, 136-791, Republic of Korea; Human-centered Interaction & Robotics Research Center, Korea Institute of Science and Technology, Seoul, 136-791, Republic of Korea; Human-centered Interaction & Robotics Research Center, Korea Institute of Science and Technology, Seoul, 136-791, Republic of Korea; Human-centered Interaction & Robotics Research Center, Korea Institute of Science and Technology, Seoul, 136-791, Republic of Korea","2014 11th International Conference on Ubiquitous Robots and Ambient Intelligence (URAI)","12 Mar 2015","2014","","","335","338","Teleoperation provides a technical means to perform desired tasks in remote environments. Teleoperation using direct control and haptic-mediated interactions requires significant effort for unskilled users to understand how to operate the robot. Task-oriented teleoperation supports human-level understanding to directly transfer the meaning of tasks from the user to the robot. In this paper, we propose a natural 3D interface to transfer task knowledge to a remote robot. We design a 3D manipulation system in a mixed reality environment that combines human hand gestures and a 3D view of the remote robot. We demonstrate that the remote robot successfully executes the ordered task even in dynamic environments.","","978-1-4799-5333-2","10.1109/URAI.2014.7057536","","https://ieeexplore.ieee.org/stamp/stamp.jsp?arnumber=7057536","Teleoperation;natural user interface;3D manipulation;mixed reality","Three-dimensional displays;Robot kinematics;Cameras;User interfaces;Aerospace electronics;Grasping","control engineering computing;haptic interfaces;human-robot interaction;manipulators;telerobotics","task-oriented teleoperation;natural 3D user interaction;direct control;haptic-mediated interactions;natural 3D interface;remote robot;3D manipulation system;human hand gestures","","","","11","","12 Mar 2015","","","IEEE","IEEE Conferences"
"Approach on a new methodology for skills transfer using a parallel planar robot with visuo-vibrotactile feedback","P. Humblot-Niño; O. Sandoval-González; I. Herrera-Aguilar; D. Rangel-Peñuelas; A. Flores-Cuautle; B. González-Sánchez","División de Estudios de Posgrado e Investigación, Instituto Tecnológico de Orizaba, Orizaba, México; División de Estudios de Posgrado e Investigación, Instituto Tecnológico de Orizaba, Orizaba, México; División de Estudios de Posgrado e Investigación, Instituto Tecnológico de Orizaba, Orizaba, México; División de Estudios de Posgrado e Investigación, Instituto Tecnológico de Orizaba, Orizaba, México; CONACYT - División de Estudios de Posgrado e Investigación, Instituto Tecnológico de Orizaba, Orizaba, México; División de Estudios de Posgrado e Investigación, Instituto Tecnológico de Orizaba, Orizaba, México","2017 14th International Conference on Electrical Engineering, Computing Science and Automatic Control (CCE)","16 Nov 2017","2017","","","1","5","An approach of a new methodology for skills transfer from machine to human is proposed in this research. This methodology transmits a haptic feed-back using vibrotactile perception to transfer motor skills using a parallel planar robot and virtual reality environments. During the experimentation, the participants tried to learn a specific motion trajectory given by the system. During the process, the system computes the current position and generates a vibrotactile feed-back proportional to the error computed between the actual and the desired position of the motion trajectory. The results of the user studies showed this system can help with learning new skills.","","978-1-5386-3406-6","10.1109/ICEEE.2017.8108861","","https://ieeexplore.ieee.org/stamp/stamp.jsp?arnumber=8108861","Skill Transfer;Parallel Planar Robot;Methodology","Haptic interfaces;Virtual environments;Robot sensing systems;Training;End effectors;Trajectory","feedback;haptic interfaces;human computer interaction;human-robot interaction;position control;virtual reality","haptic feedback;motion trajectory;visuo-vibrotactile feedback;virtual reality environments;parallel planar robot;motor skills;vibrotactile perception;skills transfer","","","","16","","16 Nov 2017","","","IEEE","IEEE Conferences"
"A framework for a multi-sensory VR effect system with motional display","Byounghyun Yoo; Moohyun Cha; Soonhung Han","Dept. of Mech. Eng., Korea Adv. Inst. of Sci. & Technol., Daejeon, South Korea; Dept. of Mech. Eng., Korea Adv. Inst. of Sci. & Technol., Daejeon, South Korea; Dept. of Mech. Eng., Korea Adv. Inst. of Sci. & Technol., Daejeon, South Korea","2005 International Conference on Cyberworlds (CW'05)","6 Feb 2006","2005","","","8 pp.","244","Virtual reality simulators have been developed as tools for the transfer of knowledge and education. Concurrently, the demand for exhibition systems of science education and cultural experiences has also increased. Existing VR (virtual reality) simulators, which are based on the calculation of dynamics equations, cannot easily be adapted to changes in simulation content. In order to transfer knowledge and maintain interest through educational applications, an experiential system that has multi-sensory effects as well as motion effects is needed. The authors proposed a method for motion generation that is tailored to riding systems and multi-sensory VR effects. In this study, both sense of motion, which is generated from movement of the viewpoint of the visual image, and motion effects, which are prepared in advance, are blended to realize motion simulation by the proposed method. Motion effects can easily be added by interaction between the user and the riding system. Various sensory cues are also implemented to the riding system","","0-7695-2378-1","10.1109/CW.2005.5","","https://ieeexplore.ieee.org/stamp/stamp.jsp?arnumber=1587539","","Virtual reality;Displays;Cultural differences;Vehicle dynamics;Vehicles;Libraries;Equations;Aerodynamics;Aerospace materials;Aerospace simulation","computer aided instruction;virtual reality","virtual reality simulators;knowledge transfer;science education;multisensory effects;visual image;motion simulation;user interaction","","","1","17","","6 Feb 2006","","","IEEE","IEEE Conferences"
"A Virtual Testbed for Human-Robot Interaction","J. Rossmann; E. G. Kaigom; L. Atorf; M. Rast; C. Schlette","Inst. for Man-Machine Interaction, RWTH Aachen Univ., Aachen, Germany; Inst. for Man-Machine Interaction, RWTH Aachen Univ., Aachen, Germany; Inst. for Man-Machine Interaction, RWTH Aachen Univ., Aachen, Germany; Inst. for Man-Machine Interaction, RWTH Aachen Univ., Aachen, Germany; Inst. for Man-Machine Interaction, RWTH Aachen Univ., Aachen, Germany","2013 UKSim 15th International Conference on Computer Modelling and Simulation","10 Jun 2013","2013","","","277","282","Many research efforts in human-robot interaction (HRI) have so far focussed on the mechanical design of intrinsically safe robots, as well as impedance control for tasks in which human and robot will work together. However, comparatively little attention is paid to an approach that ensures safety and permits close HRI while dispensing human with the necessity of physical presence in close proximity to the robot. In this work we acquire real human manipulation gestures using Microsoft's Kinect sensor and project them in realtime into the workspace of a simulated, impedance controlled robot manipulator. This way, we can remotely and therefore safely superimpose human motion over the robot's dynamic motion, wherever the human operator is located. The simulated robot state is then transferred to the real robot as input, so as to physically perform the intended task. The Virtual Testbed approach might not only be useful for HRI pre-analysis, testing and validation goals but particularly advantageous for telepresence, industrial and harzardous tasks as well as training purposes. Simulation results are provided to show the effectiveness of the approach.","","978-0-7695-4994-1","10.1109/UKSim.2013.87","","https://ieeexplore.ieee.org/stamp/stamp.jsp?arnumber=6527428","eRobotics;Virtual Testbed;human-robot interaction;Kinect;simulation","Robot sensing systems;Impedance;Solid modeling;Robot kinematics;Joints","control engineering computing;design engineering;humanoid robots;human-robot interaction;manipulator dynamics;motion control;sensors","human-robot interaction;HRI;mechanical design;intrinsically safe robot;real human manipulation gesture;Microsoft Kinect sensor;impedance controlled robot manipulator;human motion;robot dynamic motion;human operator;robot state simulation;virtual testbed approach;telepresence;industrial task;harzardous task","","9","","15","","10 Jun 2013","","","IEEE","IEEE Conferences"
"A Virtual Assembly Design Environment","S. Jayaram; Yong Wang; U. Jayaram; K. Lyons; P. Hart","Dept. of Mech. & Mater. Eng., Washington State Univ., Pullman, WA, USA; NA; NA; NA; NA","Proceedings IEEE Virtual Reality (Cat. No. 99CB36316)","6 Aug 2002","1999","","","172","179","The Virtual Assembly Design Environment (VADE) is a virtual reality (VR) based engineering application which allows engineers to evaluate, analyze, and plan the assembly of mechanical systems. This system focuses on utilizing an immersive virtual environment tightly coupled with commercial computer aided design (CAD) systems. Salient features of VADE include: data integration (two-way) with a parametric CAD system; realistic interaction of the user with parts in the virtual environment; creation of valued design information in the virtual environment; reverse data transfer of design information back to the CAD system; significant interactivity in the virtual environment; collision detection; and physically-based modeling. This paper describes the functionality and applications of VADE. A discussion of the limitations of virtual assembly and a comparison with automated assembly planning systems are presented. Experiments conducted using real-world engineering models are also described.","1087-8270","0-7695-0093-5","10.1109/VR.1999.756948","","https://ieeexplore.ieee.org/stamp/stamp.jsp?arnumber=756948","","Virtual reality;Design automation;Design engineering;Virtual environment;Process planning;Integrated circuit modeling;Power engineering and energy;NIST;Assembly systems;Manufacturing systems","virtual reality;user interfaces;CAD;mechanical engineering computing;assembly planning","Virtual Assembly Design Environment;VADE;virtual reality;engineering application;mechanical systems;immersive virtual environment;computer aided design;CAD;data integration;user interaction;data transfer;collision detection;physically-based modeling;assembly planning systems;experiments","","29","4","17","","6 Aug 2002","","","IEEE","IEEE Conferences"
"Virtual Reality for training - The impact of smell on presence, cybersickness, fatigue, stress and knowledge transfer","D. Narciso; M. Bessa; M. Melo; J. Vasconcelos-Raposo","UTAD,Engineering Department,Vila Real,Portugal; UTAD,Engineering Department,Vila Real,Portugal; INESC TEC,Porto,Portugal; UTAD,Departament of Education and Psychology,Vila Real,Portugal","2019 International Conference on Graphics and Interaction (ICGI)","14 Jan 2020","2019","","","115","121","The area of professional training using virtual reality technologies has received considerable investment due to the advantages that virtual reality provides over traditional training. In this paper, we present an experiment whose goal was to analyse the impact that an additional stimulus has on the effectiveness of a virtual environment designed to train firefighters. The additional stimulus is a smell, more specifically the smell of burnt wood, which is consistent with the audiovisual content presented, and the effectiveness of the VE is measured through participant's feeling of presence, cybersickness, fatigue, stress and transfer of knowledge. The results indicate that, although the VE was successful in transferring knowledge, the addition of smell did not influence any of the measured variables. In the discussion section, we present the various factors that we believe have influenced this result. As future work, more experiments will be performed, with other stimuli, to understand better which stimuli increase participant's feeling of presence in the VE.","","978-1-7281-6378-9","10.1109/ICGI47575.2019.8955071","","https://ieeexplore.ieee.org/stamp/stamp.jsp?arnumber=8955071","Virtual Reality;Olfactory Sense;Multisensory Stimulation","Training;Olfactory;Fatigue;Stress;Knowledge transfer;Atmospheric measurements","computer based training;continuing professional development;virtual reality","smell;stress;professional training;virtual reality technologies;additional stimulus;virtual environment;cybersickness;fatigue;knowledge transfer;firefighters;audiovisual content","","1","","44","","14 Jan 2020","","","IEEE","IEEE Conferences"
"Sound and tangible interface for shape evaluation and modification","M. Bordegoni; F. Ferrise; S. Shelley; M. A. Alonso; D. Hermes","Dipartimento di Meccanica, Politecnico di Milano, Via La Masa, 1 - 20156 Milano, Italy; Dipartimento di Meccanica, Politecnico di Milano, Via La Masa, 1 - 20156 Milano, Italy; Human Technology Interaction, Eindhoven University of Technology, P.O. Box 513, NL 5600 MB, Eindhoven, The Netherlands; Human Technology Interaction, Eindhoven University of Technology, P.O. Box 513, NL 5600 MB, Eindhoven, The Netherlands; Human Technology Interaction, Eindhoven University of Technology, P.O. Box 513, NL 5600 MB, Eindhoven, The Netherlands","2008 IEEE International Workshop on Haptic Audio visual Environments and Games","21 Nov 2008","2008","","","148","153","One of the recent research topics in the area of design and virtual prototyping is offering designers tools for creating and modifying shapes in a natural and interactive way. Multimodal interaction is part of this research. It allows conveying to the users information through different sensory channels. The use of more modalities than touch and vision augments the sense of presence in the virtual environment and can be useful to present the same information in various ways. In addition, multimodal interaction can sometimes be used to augment the perception of the user by transferring information that is not generally perceived in the real world, but which can be emulated by the virtual environment. The paper presents a prototype of a system that allows designers to evaluate the quality of a shape with the aid of touch, vision and sound. Sound is used to communicate geometrical data, relating to the virtual object, which are practically undetectable through touch and vision. In addition, the paper presents the preliminary work carried out on this prototype and the results of the first tests made in order to demonstrate the feasibility. The problems related to the development of this kind of application and the realization of the prototype itself are highlighted. This paper also focuses on the potentialities and the problems relating to the use of multimodal interaction, in particular the auditory channel.","","978-1-4244-2668-3","10.1109/HAVE.2008.4685315","","https://ieeexplore.ieee.org/stamp/stamp.jsp?arnumber=4685315","haptic;audio & visual sensors and displays;human-computer interaction","Haptic interfaces;Prototypes;Virtual environment;Product design;Shape control;Virtual reality;Application software;Conferences;Humans;Virtual prototyping","computational geometry;data visualisation;haptic interfaces;human computer interaction;virtual reality","sound interface;tangible interface;shape evaluation;shape modification;virtual prototyping;interactive system;multimodal human computer interaction;sensory channel;virtual object geometrical data;auditory channel;haptic system;visualization system","","8","1","18","","21 Nov 2008","","","IEEE","IEEE Conferences"
