"The synthetic character Ritchie: first steps towards a virtual companion for mixed reality","K. Dorfinuller-Ulhaas; E. Andre","Augsburg Univ., Germany; Augsburg Univ., Germany","Fourth IEEE and ACM International Symposium on Mixed and Augmented Reality (ISMAR'05)","5 Dec 2005","2005","","","178","179","Unlike most existing work on traversable interfaces, we focus on the use of synthetic characters to accompany the user in mixed reality (MR) applications. We examine virtual companions as a promising means to design smooth transitions between different worlds and to avoid orientation problems. We propose a taxonomy to describe the spatial relationship between character and user which has an important impact on the style of interaction. To flexibly transfer user and character into different spaces, we have created a platform that supports the design of interfaces derived from the proposed taxonomy as well as transitions between them.","","0-7695-2459-1","10.1109/ISMAR.2005.61","","https://ieeexplore.ieee.org/stamp/stamp.jsp?arnumber=1544682","","Virtual reality;Space technology;Taxonomy;Humans;User interfaces;Cities and towns;Displays;Switches;Geometry;Augmented reality","virtual reality;user interfaces","synthetic character Ritchie;virtual reality;mixed reality application;traversable interfaces;design interfaces","","2","","5","","5 Dec 2005","","","IEEE","IEEE Conferences"
"VR training system with adaptive operational assistance considering straight-line transfer operation","M. Yoneda; F. Arai; T. Fukuda; K. Miyata; T. Naito","Dept. of Micro Syst. Eng., Nagoya Univ., Japan; NA; NA; NA; NA","8th IEEE International Workshop on Robot and Human Interaction. RO-MAN '99 (Cat. No.99TH8483)","6 Aug 2002","1999","","","142","147","This paper deals with an operational assistance system of a rough terrain crane. A proper control rule to operate the payload in the straight-line motion is proposed. The system assists straight-line operation with force display based on the rule. The strength of assistance can be adapted to operator's skill level by changing the gain of force display. We present some experiments on a crane simulator, and show the effectiveness of the proposed operational assistance system.","","0-7803-5841-4","10.1109/ROMAN.1999.900330","","https://ieeexplore.ieee.org/stamp/stamp.jsp?arnumber=900330","","Virtual reality;Adaptive systems;Cranes;Control systems;Automatic control;Displays;Proposals;Payloads;Systems engineering and theory;Motion control","cranes;computer based training;virtual reality;force feedback;simulation;adaptive systems","training;operational assistance system;straight-line motion;force display;operator skill;crane simulator;virtual reality","","1","","6","","6 Aug 2002","","","IEEE","IEEE Conferences"
"Rock or Roll – Locomotion Techniques with a Handheld Spherical Device in Virtual Reality","D. Englmeier; F. Fan; A. Butz","LMU Munich,Munich,Germany; LMU Munich,Munich,Germany; LMU Munich,Munich,Germany","2020 IEEE International Symposium on Mixed and Augmented Reality (ISMAR)","14 Dec 2020","2020","","","618","626","We investigate the use of a handheld spherical object as a controller for locomotion in VR. Rotating the object controls avatar movement in two different ways: As a zero order controller, it is continuously rotated to the target position as if rolling a ball on the floor. As a first order controller, it is tilted like a joystick to determine the direction and speed of movement. We describe how our prototype was built from low-cost commercially available hardware and discuss our design decisions. Then we evaluate both locomotion techniques in a user study (N=20) and compare them to established methods using handheld VR controllers. Our prototype matched and in some cases outperformed these methods regarding task time and accuracy. All results were obtained without any usage instructions, indicating easy learnability. Some of our insights may transfer to interaction with other naturally shaped objects in VR experiences.","1554-7868","978-1-7281-8508-8","10.1109/ISMAR50242.2020.00089","","https://ieeexplore.ieee.org/stamp/stamp.jsp?arnumber=9284676","Human-centered computing;Human computer interaction (HCI);Interaction devices;Haptic devices;Human-centered computing;Human computer interaction (HCI);Interaction paradigms;Virtual reality","Avatars;Prototypes;Rocks;Hardware;Task analysis;Floors;Augmented reality","avatars;human computer interaction;interactive devices","design decisions;locomotion techniques;handheld VR controllers;naturally shaped objects;VR experiences;handheld spherical device;virtual reality;handheld spherical object;avatar movement;zero order controller","","","","48","","14 Dec 2020","","","IEEE","IEEE Conferences"
"Augmented Reality applied to the teaching/learning environment","P. Magalhães; A. Castro; C. V. Carvalho","GILT (Graphics, Interaction and Learning Technologies), Instituto Superior de Engenharia do Porto, Portugal; GILT (Graphics, Interaction and Learning Technologies), Instituto Superior de Engenharia do Porto, Portugal; GILT (Graphics, Interaction and Learning Technologies), Instituto Superior de Engenharia do Porto, Portugal","6th Iberian Conference on Information Systems and Technologies (CISTI 2011)","4 Aug 2011","2011","","","1","5","In the last decades we have witnessed a technological advancement at all levels with particular emphasis in hardware and mobile devices. These became increasingly lighter and cheaper, and transferred from the office to the car, to equipment and other utensils. The amount of (digital) information available in the environment has increased exponentially, requiring a technological response in order to improve and facilitate its access and assimilation. The concept of Augmented Reality acts as a bridge between real and digital inviting to new models of user interaction. The AR incorporation is intended primarily to make systems more usable by decreasing the need of cognitive load inherent to their use. This paper presents a case study, proposing a model for a Learning Object using Augmented Reality, studying the integration of augmented reality and multimedia techniques combined with other conventional materials researching how they may contribute to increase motivation and perceived towards knowledge.","2166-0735","978-989-96247-5-7","","","https://ieeexplore.ieee.org/stamp/stamp.jsp?arnumber=5974235","Learning Objects;Human-Computer Interaction;Augmented Reality;Usability;Health","Visualization;Augmented reality;Software;Biological system modeling;Laboratories;Browsers","augmented reality;computer aided instruction;multimedia systems;user interfaces","augmented reality;teaching-learning environment;user interaction;learning object model;multimedia technique","","1","","8","","4 Aug 2011","","","IEEE","IEEE Conferences"
"Cognitive psychology and human factors engineering of virtual reality","A. K. T. Ng","The University of Hong Kong, Hong Kong, China","2017 IEEE Virtual Reality (VR)","6 Apr 2017","2017","","","407","408","This position paper summarizes the author's research interest in Cognitive Psychology and Human-Computer Interaction in the imseCAVE, a CAVE-like system in the University of Hong Kong. Several areas of interest were explored while finding the thesis topic for the Ph.D. research. They include a perception research on distance estimation with proposed error correction mechanism, neurofeedback meditation with EEG in VR and the effect with audio and video, the study of training transfer in VR training, the comparison and research of cybersickness between HMD and the imseCAVE, and comparing VR gaming in TV, HMD, and the imseCAVE by performance, activity level and time perception. With a broad interest, the exact direction is still in the search and requires future exploration.","2375-5334","978-1-5090-6647-6","10.1109/VR.2017.7892349","","https://ieeexplore.ieee.org/stamp/stamp.jsp?arnumber=7892349","Virtual environment;cognitive psychology;HCI","Training;Psychology;Resists;Virtual reality;Human factors;Ergonomics;Human computer interaction","cognition;human factors;virtual reality","cognitive psychology;human factors engineering;virtual reality;CAVE-like system;error correction mechanism;neurofeedback meditation;EEG;VR;imseCAVE;distance estimation","","","","13","","6 Apr 2017","","","IEEE","IEEE Conferences"
"Pinch-n-Paste: Direct texture transfer interaction in augmented reality","A. Umakatsu; T. Mashita; K. Kiyokawa; H. Takernura",Osaka University; Osaka University; Osaka University; Osaka University,"2013 IEEE Virtual Reality (VR)","9 Sep 2013","2013","","","73","74","Our Pinch-n-Paste allows a user to touch or pinch one part of an object, copy and move its texture, and paste it onto another object, directly with his or her hand, in an augmented reality environment. To transfer texture appropriately from one part of an object to another, two texture images are generated by the Least Square Conformal Map (LSCM) technique. Two regions in the texture images corresponding to source and target areas of interest are then obtained using cross-boundary brushes. Target texel values are sampled from corresponding source texels by Moving Least Squares (MLS), and are finally mapped onto the target object. In this poster, we will describe the basic idea, implementation details, and example interaction results and a preliminary user study.","2375-5334","978-1-4673-4796-9","10.1109/VR.2013.6549369","","https://ieeexplore.ieee.org/stamp/stamp.jsp?arnumber=6549369","Augmented Reality;texture transfer;3D physics interaction","Brushes;Three-dimensional displays;Electronic mail;Clothing;Augmented reality;Cameras;Mathematical model","augmented reality;image texture;least squares approximations;user interfaces","texture transfer interaction;pinch-n-paste interaction technique;augmented reality environment;least square conformal map technique;LSCM technique;texture image generation;cross-boundary brush;moving least squares;MLS;object mapping","","","","7","","9 Sep 2013","","","IEEE","IEEE Conferences"
"Multi-user networked framework for virtual reality platform","A. Rai; R. J. Kannan; S. Ramanathan","School of Computing Science & Engineering, VIT University, Chennai, India; School of Computing Science & Engineering, VIT University, Chennai, India; School of Computing Science & Engineering, VIT University, Chennai, India","2017 14th IEEE Annual Consumer Communications & Networking Conference (CCNC)","20 Jul 2017","2017","","","584","585","Networked Virtual Environments (NEV) are sets of disjointed virtual worlds which are topographically set apart from the users yet connected through the communication network to give them the illusion of being in the same virtual location. NVEs are increasingly receiving consideration from business and research point of view. Contrasted with various sorts of possible applications, NVEs require a high responsiveness to ensure continuous streaming of live data for full immersion. It is as yet difficult to develop such applications since it require to create virtual reality framework over distributed databases; as every user needs locally adequate data flow to concurrently construct a scene as with other users and able to accommodate multi-user interactions in the virtual environment. Such information requires simultaneous computation and communication of streaming data. In this study we built up a prototype of a NVE in view of the blend of Minority Game (MG) and Online Induction Algorithm (OIA) with lossless transfer functions.","2331-9860","978-1-5090-6196-9","10.1109/CCNC.2017.7983177","","https://ieeexplore.ieee.org/stamp/stamp.jsp?arnumber=7983177","Networked Virtual Environments;Online Learning;Data Stream control;Adaptive Networking","Rendering (computer graphics);Virtual environments;Databases;Feature extraction;Conferences;Tracking","game theory;inference mechanisms;transfer functions;virtual reality","multiuser networked framework;NVE;networked virtual environments;minority game;MG;online induction algorithm;OIA;lossless transfer functions;virtual reality platform","","","","3","","20 Jul 2017","","","IEEE","IEEE Conferences"
"Comparing HMD-Based and Paper-Based Training","S. Werrlich; A. Daniel; A. Ginger; P. Nguyen; G. Notni","BMW Group, Munich, Germany; BMW Group, Munich, Germany; BMW Group, Munich, Germany; BMW Group, Munich, Germany; Tech. Univ. Ilmenau, Ilmenau, Germany","2018 IEEE International Symposium on Mixed and Augmented Reality (ISMAR)","17 Jan 2019","2018","","","134","142","Collaborative Systems are in daily use by millions of people promising to improve everyone's life. Smartphones, smartwatches and tablets are everyday objects and life without these unimaginable. New assistive systems such as head-mounted displays (HMDs) are becoming increasingly important for various domains, especially for the industrial domain, because they claim to improve the efficiency and quality of procedural tasks. A range of scientific laboratory studies already demonstrated the potential of augmented reality (AR) technologies especially for training tasks. However, most researches are limited in terms of inadequate task complexity, measured variables and lacking comparisons. In this paper, we want to close this gap by introducing a novel multimodal HMD-based training application and compare it to paper-based learning for manual assembly tasks. We perform a user study with 30 participants measuring the training transfer of an engine assembly training task, the user satisfaction and perceived workload during the experiment. Established questionnaires such as the system usability scale (SUS), the user experience questionnaire (UEQ) and the Nasa Task Load Index (NASA-TLX) are used for the assessment. Results indicate significant differences between both learning approaches. Participants perform significantly faster and significantly worse using paper-based instructions. Furthermore, all trainees preferred HMD-based learning for future assembly trainings which was scientifically proven by the UEQ.","1554-7868","978-1-5386-7459-8","10.1109/ISMAR.2018.00046","","https://ieeexplore.ieee.org/stamp/stamp.jsp?arnumber=8613759","Augmented Reality;Evaluation;Head Mounted Displays;Training","Task analysis;Training;Engines;Software;Resists;Atmospheric measurements;Particle measurements","augmented reality;computer based training;groupware;helmet mounted displays;human computer interaction;human factors;user interfaces;virtual reality","paper-based training;Collaborative Systems;smartwatches;head-mounted displays;industrial domain;scientific laboratory studies;augmented reality;training tasks;inadequate task complexity;training transfer;engine assembly training task;user satisfaction;system usability scale;user experience questionnaire;Nasa Task Load Index;paper-based instructions;assistive systems;multimodal HMD-based learning","","5","","28","","17 Jan 2019","","","IEEE","IEEE Conferences"
"Interactive features based augmented reality authoring tool","J. Shim; M. Kong; Y. Yang; J. Seo; T. Han","Yonsei University, Seoul, Republic of Korea; Yonsei University, Seoul, Republic of Korea; Yonsei University, Seoul, Republic of Korea; Yonsei University, Seoul, Republic of Korea; Yonsei University, Seoul, Republic of Korea","2014 IEEE International Conference on Consumer Electronics (ICCE)","20 Mar 2014","2014","","","47","50","This paper intends to propose an authoring tool system that allows users to easily create augmented reality content with the application of marker based and gesture interactions. It is possible to generate a simplified form of marker based augmented reality content with the user interface by using Kinect that enables gesture interaction. We seek to provide methods for the user to actively interact with augmented reality content. The interaction method we put forth in this study is a gesture interaction approach capable of Transfer, Rotate, Enlarge, and Shrink an object by recognizing and tracking the user's bare hand. As for marker based interaction methods, there is one employing two markers and another using marker occlusion. We ascertain the positive results of this study from the user evaluation of an authoring tool system and marker based and gesture interactions.","2158-4001","978-1-4799-1291-9","10.1109/ICCE.2014.6775902","","https://ieeexplore.ieee.org/stamp/stamp.jsp?arnumber=6775902","","Augmented reality;Thumb;Image segmentation;User interfaces;Real-time systems;Computer vision","augmented reality;authoring systems;gesture recognition;interactive devices;object recognition;object tracking","interactive features based augmented reality authoring tool;marker based interaction;gesture interactions;marker based augmented reality content;user interface;Kinect;transfer;rotate;enlarge;shrink;user bare hand recognition;user bare hand tracking;marker occlusion","","4","","12","","20 Mar 2014","","","IEEE","IEEE Conferences"
"Enlightening Patients with Augmented Reality","A. Jakl; A. Lienhart; C. Baumann; A. Jalaeefar; A. Schlager; L. Schöffer; F. Bruckner","University of Applied Sciences,Institute of Creative\Media/Technologies,St. Pölten,Austria; University of Applied Sciences,Institute of Creative\Media/Technologies,St. Pölten,Austria; University of Applied Sciences,Institute of Creative\Media/Technologies,St. Pölten,Austria; University of Applied Sciences,Institute of Creative\Media/Technologies,St. Pölten,Austria; University of Applied Sciences,Institute of Creative\Media/Technologies,St. Pölten,Austria; University of Applied Sciences,Institute of Creative\Media/Technologies,St. Pölten,Austria; University of Applied Sciences,Institute of Creative\Media/Technologies,St. Pölten,Austria","2020 IEEE Conference on Virtual Reality and 3D User Interfaces (VR)","11 May 2020","2020","","","195","203","Enlightening Patients with Augmented Reality (EPAR) enhances patient education with new possibilities offered by Augmented Reality. Medical procedures are becoming increasingly complex and printed information sheets are often hard to understand for patients. EPAR developed an augmented reality prototype that helps patients with strabismus to better understand the processes of examinations and eye surgeries. By means of interactive storytelling, three identified target groups based on user personas were able to adjust the level of information transfer based on their interests. We performed a 2-phase evaluation with a total of 24 test subjects, resulting in a final system usability score of 80.0. For interaction prompts concerning virtual 3D content, visual highlights were considered to be sufficient. Overall, participants thought that an AR system as a complementary tool could lead to a better understanding of medical procedures.","2642-5254","978-1-7281-5608-8","10.1109/VR46266.2020.00038","","https://ieeexplore.ieee.org/stamp/stamp.jsp?arnumber=9089476","Human-centered computing;Mixed / augmented reality Human-centered computing;Interface design prototyping Human-centered computing;Interaction design theory;concepts and paradigms Human-centered computing;Usability testing","Education;Three-dimensional displays;Augmented reality;Surgery;Human computer interaction;Usability;Prototypes","augmented reality;computer aided instruction;eye;medical computing;surgery;virtual reality","EPAR;patient education;medical procedures;enlightening patients with augmented reality;interactive storytelling","","","","57","","11 May 2020","","","IEEE","IEEE Conferences"
"Increasing the effective egocentric field of view with proprioceptive and tactile feedback","Ungyeon Yang; G. Jounghyun Kim","Virtual Reality Div., Electr. & Telecom. Res. Inst., Daejeon, South Korea; NA","IEEE Virtual Reality 2004","12 Jul 2004","2004","","","27","34","Multimodality often exhibits synergistic effects: each modality compliments and compensates for other modalities in transferring coherent, unambiguous, and enriched information for higher interaction efficiency and improved sense of presence. In this paper, we explore one such phenomenon: a positive interaction among the geometric field of view, proprioceptive interaction, and tactile feedback. We hypothesize that, with proprioceptive interaction and tactile feedback, the geometric field of view and thus visibility can be increased such that it is larger than the physical field of view, without causing a significant distortion in the user's distance perception. This, in turn, would further help operation of the overall multimodal interaction scheme as the user is more likely to receive the multimodal feedback simultaneously. We tested our hypothesis with an experiment to measure the user's change in distance perception according to different values of egocentric geometric field of view and feedback conditions. Our experimental results have shown that, when coupled with physical interaction, the GFOV could be increased by up to 170 percent of the physical field of view without introducing significant distortion in distance perception. Second, when tactile feedback was introduced, in addition to visual and proprioceptive cues, the GFOV could be increased by up to 200 percent. The results offer a useful guideline for effectively utilizing of modality compensation and building multimodal interfaces for close range spatial tasks in virtual environments. In addition, it demonstrates one way to overcome the shortcomings of the narrow (physical) fields of views of most contemporary HMDs.","1087-8270","0-7803-8415-6","10.1109/VR.2004.1310052","","https://ieeexplore.ieee.org/stamp/stamp.jsp?arnumber=1310052","","Feedback;Virtual reality;Space technology;Layout;Telecommunications;Computer science;Testing;Distortion measurement;Guidelines;Virtual environment","virtual reality;image motion analysis;helmet mounted displays;distortion;haptic interfaces","tactile feedback;geometric field of view;proprioceptive interaction;multimodal interaction;multimodal feedback;physical interaction;GFOV;proprioceptive cues;modality compensation;multimodal interfaces;spatial tasks;virtual environments;HMDs","","2","","33","","12 Jul 2004","","","IEEE","IEEE Conferences"
"Touch-n-Paste: Direct texture transfer interaction in AR environments","A. Umakatsu; T. Mashita; K. Kiyokawa; H. Takemura","Osaka University, Japan; Osaka University, Japan; Osaka University, Japan; Osaka University, Japan","2012 IEEE International Symposium on Mixed and Augmented Reality (ISMAR)","7 Jan 2013","2012","","","325","326","Our Touch-n-Paste allows a user to touch one part of an object, copy and move its texture, and paste it onto another object, directly with his or her hand, in an augmented reality environment. To transfer texture appropriately from one part of an object to another, two texture images are generated by the Least Square Conformal Map (LSCM) technique. Two regions in the texture images corresponding to source and target areas of interest are then obtained using cross-boundary brushes. Target texel values are sampled from corresponding source texels by Moving Least Squares (MLS), and are finally mapped onto the target object.","","978-1-4673-4662-7","10.1109/ISMAR.2012.6402596","","https://ieeexplore.ieee.org/stamp/stamp.jsp?arnumber=6402596","H.5.1 [Information Interfaces and Presentation]: Multimedia Information Systems—Artificial;augmented;and virtual realities I.3.7 [Computer Graphics]: Three-dimensional Graphics and Realism—Color;shading;shadowing;texture","Clothing;Educational institutions;Electronic mail;Solid modeling;Image color analysis;Brushes;Computer graphics","augmented reality;image texture;least squares approximations;tactile sensors","touch-n-paste;direct texture transfer interaction;AR environments;augmented reality environment;image texture;least square conformal map technique;LSCM technique;cross-boundary brushes;target areas of interest;target texel values;source texels;moving least squares;MLS","","1","","6","","7 Jan 2013","","","IEEE","IEEE Conferences"
