"Instruction Manual for Product Assembly Process Based on Augmented Visualization","B. Li; Q. Dong; J. Dong; J. Wang; W. Li; S. Li","Beijing Institute of Mechanical Equipment, Beijing, China; Beijing Institute of Mechanical Equipment, Beijing, China; Beijing Institute of Mechanical Equipment, Beijing, China; Department of Industrial and Manufacturing System Engineering, Huazhong University of Science and Technology, Wuhan, China; Department of Industrial and Manufacturing System Engineering, Huazhong University of Science and Technology, Wuhan, China; Department of Industrial and Manufacturing System Engineering, Huazhong University of Science and Technology, Wuhan, China","2018 Chinese Automation Congress (CAC)","24 Jan 2019","2018","","","3248","3253","Augmented reality application in product assembly can notably improve the operation efficiency of shop floor workers in training or onsite work. The assembly manual system based on augmented reality technology is more complex than paper manual and virtual three-dimensional manual. This research work introduces a general two stages procedure for application of augmented assembly manual system. The relationship of assembly activities is described and the IDEF0 function diagram for augmented assembly application is presented. A detailed system framework for augmented assembly manual application is proposed and two stand alone experimental systems with file transfer mechanism are developed to instruct and assistant labours in assembly work at shop floor workstations.","","978-1-7281-1312-8","10.1109/CAC.2018.8623583","","https://ieeexplore.ieee.org/stamp/stamp.jsp?arnumber=8623583","Augmented reality;Visualization manual;Assembly process;Workstation","Manuals;Active appearance model;Solid modeling;Visualization;Augmented reality;Workstations;Three-dimensional displays","assembling;augmented reality;production engineering computing;user manuals","stand alone experimental systems;assembly work;augmented visualization;augmented reality application;shop floor workers;augmented reality technology;three-dimensional manual;general two stages procedure;augmented assembly manual system;IDEF0 function diagram;detailed system framework;product assembly process instruction manual","","","","25","","24 Jan 2019","","","IEEE","IEEE Conferences"
"Transfer Learning-Based Microfluidic Design System for Concentration Generation∗","W. Ji; T. -Y. Ho; H. Yao","Tsinghua University,Department of Computer Science and Technology; National Tsing Hua University,Department of Computer Science; Tsinghua University,Department of Computer Science and Technology","2020 57th ACM/IEEE Design Automation Conference (DAC)","9 Oct 2020","2020","","","1","6","Due to the complexity of human physiology and variability among individuals, e.g., genes, environment, lifestyle exposures, etc., personalized medicine has attracted great interest in the past few years. For synthesizing personalized medicine, it is critical to prepare customized samples with specific concentrations by microfluidic biochips because of the advantages in saving costly reagents and rare samples. The current state-of-the-art of concentration generation for microfluidic biochips is to construct a database by random design methods. However, due to the complex multidimentional parameters such as molecule diameters, inlets, outlets, etc, the whole process is error prone and time consuming. To speedup database construction and reduce the errors in concentration generation, this paper proposes the first transfer learning-based method based on an artificial neural network model (ANN). Given an initial ANN model, transfer learning method can fine-tune weights of ANN to obtain all ANN models needed in the database, which can significantly reduce the amount of required training data. Computational simulation results show that the time for database construction is reduced from several months to 2 days, and the query error is reduced by 83% compared with the existing method.","0738-100X","978-1-7281-1085-1","10.1109/DAC18072.2020.9218722","","https://ieeexplore.ieee.org/stamp/stamp.jsp?arnumber=9218722","Microfluidic biochips;Concentration generation;Transfer learning","","learning (artificial intelligence);medical computing;microfluidics;neural nets;physiology;random processes","database construction;concentration generation;artificial neural network model;ANN models;transfer learning-based microfluidic design system;specific concentrations;microfluidic biochips;random design methods;complex multidimentional parameters;personalized medicine synthesis","","","","21","","9 Oct 2020","","","IEEE","IEEE Conferences"
"Learning Illumination from a Limited Field-of-View Image","Y. -k. Sun; D. Li; S. Liu; T. -C. Cao; Y. -S. Hu","Huazhong University of Science and Technology,School of Computer Science and Technology; Huazhong University of Science and Technology,School of Computer Science and Technology; Huazhong University of Science and Technology,School of Computer Science and Technology; Huazhong University of Science and Technology,School of Computer Science and Technology; Huazhong University of Science and Technology,School of Computer Science and Technology","2020 IEEE International Conference on Multimedia & Expo Workshops (ICMEW)","9 Jun 2020","2020","","","1","6","Illumination estimation is a crucial part of augmented reality since it can make the virtual object look more realistic. However, single image-based lighting estimation is challenging due to the limited information. Here we combine deep learning with the spherical harmonic (SH) lighting which is widely used in precomputed radiance transfer. Specifically, a convolutional neural network that predicts SH coefficients from an image is designed, trained and tested. Moreover, we construct a new dataset for training SH coefficients based on the existing panorama dataset. The method in this work can finally predict realistic lighting from a single, limited field-of-view image, and it presents better results in some cases compared with previous research.","","978-1-7281-1485-9","10.1109/ICMEW46912.2020.9105957","","https://ieeexplore.ieee.org/stamp/stamp.jsp?arnumber=9105957","Scene understanding;illumination estimation;deep learning","Lighting;Training;Cameras;Estimation;Agriculture;Mathematical model;Two dimensional displays","augmented reality;image colour analysis;image reconstruction;image representation;image sensors;learning (artificial intelligence);lighting;neural nets;rendering (computer graphics)","limited field-of-view image;illumination estimation;augmented reality;virtual object;deep learning;spherical harmonic lighting;precomputed radiance transfer;convolutional neural network;training SH coefficients;existing panorama dataset;realistic lighting;single image-based lighting estimation","","","","23","","9 Jun 2020","","","IEEE","IEEE Conferences"
"Construction safety education model based on second life","Q. Le; Chan-Sik Park","Department of Architectural Engineering, Chung-Ang University, Seoul, South Korea; Department of Architectural Engineering, Chung-Ang University, Seoul, South Korea","Proceedings of IEEE International Conference on Teaching, Assessment, and Learning for Engineering (TALE) 2012","24 Nov 2012","2012","","","H2C-1","H2C-5","Construction industry is a very complicated and complex environment that causes high accident rate. The development of advanced virtual world has become an important issue for safety education in order to reduce dangerous occurrence in the construction site. However, most researchers on virtual world still have limitations such as the offline virtual world simulation, the low level of interaction between users in virtual world, and so on. With the regard to this issue, this paper proposes the adoption online 3D world Second Life (SL) platform which allows students to perform role-playing, dialogic learning, and social interaction for efficient and effective construction safety and health education. In this approach, construction safety education model based on Second Life (CSESL) is developed, which consists of the following three modules: 1) Safety information and knowledge preparation to understand the critical causes of accident in construction site; 2) Collaborative simulation for safety case study to transfer unsafe case or dangerous occurrence information to 3D modeling; 3) Reflection on safety lesson for education and training to enhance practical safety knowledge by participating in 3D inspection game. The CSESL advantages and disadvantages are identified by testing the model using a real case scenario. This study presents the potentials and benefits of SL which could enhance construction safety and health education.","","978-1-4673-2418-2","10.1109/TALE.2012.6360336","","https://ieeexplore.ieee.org/stamp/stamp.jsp?arnumber=6360336","construction safety and health;virtual environment;Second Life;education","Safety;Solid modeling;Collaboration;Accidents;Second Life;Training","accidents;computer aided instruction;computer games;construction industry;digital simulation;engineering education;occupational health;occupational safety;solid modelling;virtual reality","construction safety education model;Second Life;construction industry;virtual world;role-playing;dialogic learning;social interaction;construction health education;safety information;knowledge preparation;construction accident;collaborative simulation;3D modeling;safety lesson;3D inspection game","","4","","14","","24 Nov 2012","","","IEEE","IEEE Conferences"
"Mobility Management With Transferable Reinforcement Learning Trajectory Prediction","Z. Zhao; M. Karimzadeh; L. Pacheco; H. Santos; D. Rosário; T. Braun; E. Cerqueira","School of Electronic and Information Engineering, Beihang University, Beijing, China; Institute of Computer Science, University of Bern, Bern, Switzerland; Institute of Computer Science, University of Bern, Bern, Switzerland; Institute of Computer Science, University of Bern, Bern, Switzerland; Institute of Technology, Federal University of Pará, Belem, Brazil; Institute of Computer Science, University of Bern, Bern, Switzerland; Institute of Technology, Federal University of Pará, Belem, Brazil","IEEE Transactions on Network and Service Management","9 Dec 2020","2020","17","4","2102","2116","Future mobile networks will enable the massive deployment of mobile multimedia applications anytime and anywhere. In this context, mobility management schemes, such as handover and proactive multimedia service migration, will be essential to improve network performance. In this article, we propose a proactive mobility management approach based on group user trajectory prediction. Specifically, we introduce a mobile user trajectory prediction algorithm by combining the Long-Short Term Memory networks (LSTM) with Reinforcement Learning (RL) to automate the model training procedure. We further develop a group user trajectory predictor to reduce prediction calculation overheads of users with similar movement patterns. To validate the impact of the proposed mobility management approach, we present a virtual reality (VR) service migration scheme built on the top of the proactive handover mechanism that benefits from trajectory predictions. Experiment results validate our predictor's outstanding accuracy and its impacts on enhancing handover and service migration performance to provide quality of service assurance.","1932-4537","","10.1109/TNSM.2020.3034482","Beihang Zhuobai program; Orange research project Context Awareness Engine; CAPES—Finance Code 001; ","https://ieeexplore.ieee.org/stamp/stamp.jsp?arnumber=9244233","Mobility management;trajectory prediction;reinforcement learning;transfer learning;service migration","Trajectory;Mobile handsets;Streaming media;Handover;Computer architecture;Prediction algorithms","learning (artificial intelligence);mobility management (mobile radio);multimedia communication;telecommunication computing;virtual reality","mobile multimedia applications;proactive multimedia service migration;network performance;proactive mobility management approach;group user trajectory prediction;mobile user trajectory prediction algorithm;long-short term memory networks;model training procedure;group user trajectory predictor;virtual reality service migration scheme;proactive handover mechanism;service migration performance;future mobile networks;transferable reinforcement learning trajectory prediction","","","","48","IEEE","29 Oct 2020","","","IEEE","IEEE Journals"
"Furthering Service 4.0: Harnessing Intelligent Immersive Environments and Systems","A. Pena-Rios; H. Hagras; G. Owusu; M. Gardner","Intelligent Environments Research Group, University of Essex, Colchester, United Kingdom; Intelligent Environments Research Group, University of Essex, Colchester, United Kingdom; Business Modelling and Operational Transformation Practice, British Telecom, Ipswich, United Kingdom; Intelligent Environments Research Group, University of Essex, Colchester, United Kingdom","IEEE Systems, Man, and Cybernetics Magazine","17 Jan 2018","2018","4","1","20","31","With the increasing complexity of service operations in different industries and more advanced uses of specialized equipment and procedures, the great current challenge for companies is to increase employees' expertise and their ability to maintain and improve service quality. In this regard, Service 4.0 aims to support and promote innovation in service operations using emergent technology. Current technological innovations present a significant opportunity to provide on-site, real-time support for field service professionals in many areas. It should be no surprise, then, that intelligent immersive environments have the potential to enhance service operations by improving customer service and increasing overall efficiency. Intelligent immersive systems combine immersive technologies with computational intelligence mechanisms to produce adaptive, context-aware environments for advanced decisionmaking support. Such technologies, e.g., mixed reality (MR) and augmented reality (AR), can potentially enhance working environments, optimizing resources by reducing time and location restrictions, leading to much faster knowledge transfer and a deeper understanding of different processes. These methods can also promote faster response times to provide field service technicians with on-the-job assistance in unfamiliar situations.","2333-942X","","10.1109/MSMC.2017.2769199","","https://ieeexplore.ieee.org/stamp/stamp.jsp?arnumber=8260586","","Maintenance engineering;Training;Virtual reality;Tracking;Complexity theory;Industries;Service-oriented systems engineering","augmented reality;customer services;innovation management;knowledge management;personnel;ubiquitous computing","real-time support;service operations;customer service;intelligent immersive systems;computational intelligence mechanisms;context-aware environments;advanced decisionmaking support;field service technicians;service quality;technological innovations;intelligent immersive environments;employee expertise","","4","","70","","17 Jan 2018","","","IEEE","IEEE Magazines"
"Clinical and neurophysiologic responses to recovery-oriented virtual rehabilitation of hand function in a person with subacute stroke: A case study","G. Fluet; J. Patel; A. Merians; Q. Qiu; M. Yarossi; S. Adamovich; E. Tunik; S. Massood","Department of Rehabilitation & Movement Sciences, Rutgers The State University of New Jersey, 65 Bergen St., Newark, NJ, USA; Department of Rehabilitation & Movement Sciences, Rutgers The State University of New Jersey, 65 Bergen St., Newark, NJ, USA; Department of Rehabilitation & Movement Sciences, Rutgers The State University of New Jersey, 65 Bergen St., Newark, NJ, USA; Department of Rehabilitation & Movement Sciences, Rutgers The State University of New Jersey, 65 Bergen St., Newark, NJ, USA; Department of Rehabilitation & Movement Sciences, Rutgers The State University of New Jersey, 65 Bergen St., Newark, NJ, USA; Department of Rehabilitation & Movement Sciences, Rutgers The State University of New Jersey, 65 Bergen St., Newark, NJ, USA; Department of Rehabilitation & Movement Sciences, Rutgers The State University of New Jersey, 65 Bergen St., Newark, NJ, USA; Acute Rehabilitation Unit, Saint Joseph's Wayne Hospital, 224 Hamburg Turnpike, Wayne NJ, USA","2015 International Conference on Virtual Rehabilitation (ICVR)","17 Dec 2015","2015","","","191","198","The need to quickly discharge patients following stroke from acute rehabilitation facilities to the home has resulted in an intense focus on restoring safe and independent, if not normal, motor function. Rehabilitation of hand function in patients with upper limb impairment is often de-prioritized to allow for an emphasis on practicing activities necessary for a safe discharge to the home, such as walking and bed mobility. This case study describes a patient with slow recovering hand motor function (hand sub-section of Fugl-Meyer examination score = 2 on post-stroke day 37) following a stroke. The patient received an intensive eight-session intervention that focused on the recovery of finger extension, finger individuation and pinch-grasp force modulation as well as the recovery of proximal upper extremity movement. Over the eight sessions, the patient demonstrated a dramatic increase in hand function and a corresponding expansion of the cortical motor map area representing several key muscles of the paretic hand. Recovery of hand function and motor map expansion continued after discharge through the three-month retention testing. Gains in motor control transferred to clinically meaningful hand function measured at the activity level.","2331-9569","978-1-4799-8984-3","10.1109/ICVR.2015.7358570","","https://ieeexplore.ieee.org/stamp/stamp.jsp?arnumber=7358570","virtual reality;robot;stroke;rehabilitation","Thumb;Training;Force;Solid modeling;Atmospheric measurements","diseases;gait analysis;medical disorders;neurophysiology;patient rehabilitation;virtual reality","neurophysiologic responses;recovery-oriented virtual rehabilitation;subacute stroke;upper limb impairment;walking;bed mobility;hand motor function recovery;finger extension recovery;pinch-grasp force modulation;proximal upper extremity movement recovery;cortical motor map area;muscles;paretic hand;three-month retention testing;time 37 day;time 3 month","","1","","40","","17 Dec 2015","","","IEEE","IEEE Conferences"
"Human Action Recognition Based on a Two-stream Convolutional Network Classifier","V. de Oliveira Silva; F. de Barros Vidal; A. R. Soares Romariz","Department of Electrical Engineering, University of Brasília, Brasília, Brazil; Department of Computer Science, University of Brasília, Brasília, Brazil; Department of Electrical Engineering, University of Brasília, Brasília, Brazil","2017 16th IEEE International Conference on Machine Learning and Applications (ICMLA)","18 Jan 2018","2017","","","774","778","Currently, video generation devices are simpler to manipulate, more portable and with lower prices. This allowed easy storage and transmission of large amounts of media, such as videos, which has facilitated the analysis of information, independent of human assistance for evaluation and exhaustive search of videos. Virtual reality, robotics, tele-medicine, humanmachine interface and tele-surveillance are applications for these techniques. This paper describes a method for human action recognition in videos using two convolutional neural networks (CNNs). The first one Spatial Stream (trained with frames of the video) and the second one Temporal Stream, trained with stacks of Dense Optical Flow (DOF). Both streams were trained separately and from both of them we generated a classification histogram based on the most frequent class assignment. For final classification, those histograms were combined to produce a single output. The technique was tested in two public action video datasets: Weizmann and UCF Sports. We achieve 84.44% of accuracy on Weizmann dataset for Spatial stream and 78.46% on UCF Sports dataset. For the Weizmann dataset we obtained 91.11% with networks combination.","","978-1-5386-1418-1","10.1109/ICMLA.2017.00-64","","https://ieeexplore.ieee.org/stamp/stamp.jsp?arnumber=8260728","Human action recognition;Convolutional Neural networks;Dense Optical Flow;Transfer Learning","Histograms;Streaming media;Training;Image recognition;Kernel","feature extraction;image classification;image motion analysis;image recognition;image representation;image sequences;learning (artificial intelligence);neural nets;object recognition;video signal processing;virtual reality","videos;virtual reality;tele-medicine;humanmachine interface;tele-surveillance;human action recognition;convolutional neural networks;Spatial Stream;Temporal Stream;Dense Optical Flow;public action video datasets;Weizmann dataset;networks combination;two-stream convolutional network classifier;video generation devices;human assistance;exhaustive search;spatial stream","","2","","29","","18 Jan 2018","","","IEEE","IEEE Conferences"
"An integrated surgical planning and virtual training system using a force feedback haptic device for dental implant surgery","C. Xiaojun; L. Yanping; W. Chengtao; W. Yiqun; W. Xudong; S. Guofang","Institute of Biomedical Manufacturing and Life Quality Engineering, State Key Lab of Mechanical System and Vibration, School of Mechanical Engineering, Shanghai Jiao Tong University; Institute of Biomedical Manufacturing and Life Quality Engineering, State Key Lab of Mechanical System and Vibration, School of Mechanical Engineering, Shanghai Jiao Tong University; Institute of Biomedical Manufacturing and Life Quality Engineering, State Key Lab of Mechanical System and Vibration, School of Mechanical Engineering, Shanghai Jiao Tong University; Shanghai Ninth People's Hospital, Shanghai Jiao Tong University School of Medicine; Shanghai Ninth People's Hospital, Shanghai Jiao Tong University School of Medicine; Shanghai Ninth People's Hospital, Shanghai Jiao Tong University School of Medicine","2010 International Conference on Audio, Language and Image Processing","10 Jan 2011","2010","","","1257","1261","The application of dental implants proposes a successful treatment both partially and fully edentulous patients. However, the placement of implants is not without risk due to anatomically complex operation sites in the cranio-maxillofacial region. Therefore, in the field of oral implantology, there is a trend towards computer-aided implant surgery. In this study, an integrated surgical planning and virtual training system is presented. With the introduction of DLL (Dynamic Link Libraries) and some well-known free, open source software libraries such as VTK, ITK, and QT, a modular software named CAPPOIS (Computer Assisted Preoperative Planning for Oral Implant Surgery) was developed for preoperative planning, including medical image importing, image segmentation and 3D-Reconstruction, 2D/3D geometrical measurements, optimization design of the position and orientation of oral implants, etc. Then, the following virtual surgical training system is developed based on the force feedback haptic device, i.e., Omega.3, and the software toolkit of CHAI3D. With the use of this system, the resulting data of the preoperative planning can be transferred, and surgical simulation of the plan can be vividly realized. In this way, the surgeon can grasp the feel of osteotomy procedure, gain experience and therefore improve his skills during the actual dental implant surgery. This pilot study proves helpful for the inexperienced surgeons; however, more clinical cases will be conducted to demonstrate its feasibility and reliability.","","978-1-4244-5858-5","10.1109/ICALIP.2010.5685115","","https://ieeexplore.ieee.org/stamp/stamp.jsp?arnumber=5685115","","Surgery;Implants;Solid modeling;Planning;Three dimensional displays;Training;Software","dentistry;force feedback;haptic interfaces;medical computing;prosthetics;software libraries","integrated surgical planning;virtual training system;force feedback haptic device;dental implant surgery;cranio-maxillofacial region;oral implantology;computer-aided implant surgery;DLL;dynamic link libraries;open source software libraries;VTK;ITK;QT;CAPPOIS;computer assisted preoperative planning;oral implant surgery;osteotomy procedure","","7","","12","","10 Jan 2011","","","IEEE","IEEE Conferences"
