"Experiments on multimedia support of VLSI design teaching in the MODEM project","A. Chagoya; R. Leveugle","Inst. Nat. Polytech. de Grenoble, France; NA","Proceedings 1999 IEEE International Conference on Microelectronic Systems Education (MSE'99) 'Systems Education in the 21st Century' (Cat. No.99-63794)","6 Aug 2002","1999","","","82","83","This paper presents the results of a two-year effort carried out in the framework of the European MODEM (Multimedia Optimisation and Demonstration for Education in Microelectronics) project, aiming at the creation of multimedia learning material for VLSI design. The specific topic addressed by this experimentation, coherent with timing and man power constraints, is the design of CMOS memory devices. The learning material is organised in subject modules including a tutorial part which presents the design procedures and knowledge the student has to understand and an ""exercise"" part for reviewing purposes. Each subject module also includes more active-learning oriented parts such as ""animation"" and/or ""simulation"" parts and is structured in a set of sections preceded by a general introduction and terminated by general conclusions. The learning material has been subject to some evaluations at different locations and the conclusions are rather encouraging.","","0-7695-0312-8","10.1109/MSE.1999.787049","","https://ieeexplore.ieee.org/stamp/stamp.jsp?arnumber=787049","","Very large scale integration;Modems;Microelectronics;Electrical capacitance tomography;Registers;Timing;Random access memory;Animation;Computer science education;Educational programs","VLSI;CMOS memory circuits;integrated circuit design;multimedia systems;computer aided instruction;electronic engineering education;electronic engineering computing","multimedia support;VLSI design teaching;Multimedia Optimisation and Demonstration for Education in Microelectronics;European MODEM project;multimedia learning material;CMOS memory devices design;subject modules;active-learning oriented parts;animation;simulation;learning material","","","","2","","6 Aug 2002","","","IEEE","IEEE Conferences"
"Developing the Descriptively Verbal Skills of Undergraduate Engineering Student by Playing a LEGO Block Building","C. Charnsamorn; P. Thanakitivirul; S. Khetkeeree","Mahanakorn University of Technology, Thailand; Mahanakorn University of Technology, Thailand; Mahanakorn University of Technology, Thailand","2020 International Symposium on Educational Technology (ISET)","7 Oct 2020","2020","","","118","121","Due to the observation of undergraduate engineering students, we have seen some problems in their information communication. This is not an issue of language, but the point is a lack of descriptive story. The audience (information receiver) cannot build the objects or somethings corresponding to the sender's verbal and sometimes it leads to misleading. In this paper, game-based learning using LEGO block building is applied to improve the descriptively verbal skill. The special model, such as a half bird-half dinosaur creature or something that is not a general object, is used as the prototype model. All members of each team cannot see this model except the team leader which will describe the model information to two sub-leaders one by one. The model information will be divided into two parts for each sub-leader which will carry this information to the members of each subgroup. Finally, the finished 3D figure from all teams will be compared with the prototype model. Results show that most of them quite similar to the prototype. However, allowing the opportunity to talk with the team leader again can increase the similarity of the model. This activity can be done in 2-3 hours with 5-10 persons per team.","","978-1-7281-7189-0","10.1109/ISET49818.2020.00034","","https://ieeexplore.ieee.org/stamp/stamp.jsp?arnumber=9215524","game-based learning;LEGO, team management simulation, collaborative learning","Production;Games;Companies;Toy manufacturing industry;Prototypes;Plastics;Engineering students","computer aided instruction;engineering education;human computer interaction;serious games (computing)","sub-leader;model information;prototype model;team leader;descriptively verbal skill;undergraduate engineering student;LEGO block building;information communication;descriptive story;audience;information receiver;special model;half bird-half dinosaur creature;time 2.0 hour to 3.0 hour","","","","4","","7 Oct 2020","","","IEEE","IEEE Conferences"
"Co-evolving controller and sensing abilities in a simulated Mars Rover explorer","M. Peniak; D. Marocco; A. Cangelosi","School of Computing, Communications and Electronics, University of Plymouth, Drake Circus, PL4 8AA, United Kingdom; School of Computing, Communications and Electronics, University of Plymouth, Drake Circus, PL4 8AA, United Kingdom; School of Computing, Communications and Electronics, University of Plymouth, Drake Circus, PL4 8AA, United Kingdom","2009 IEEE Congress on Evolutionary Computation","29 May 2009","2009","","","2772","2779","The paper presents an evolutionary robotics model of the Rover Mars robot. This work has the objective to investigate the possibility of using an alternative sensor system, based on infrared sensors, for future rovers capable of performing autonomous tasks in challenging planetary terrain environments. The simulation model of the robot and of Mars terrain is based on a physics engine. The robot control system consists of an artificial neural network trained using evolutionary computation techniques. An adaptive threshold on the infrared sensors has been evolved together with the neural control system to allow the robot to adapt itself to many different environmental conditions. The properties of the behavior obtained after the evolutionary process has been tested by measuring the generalization performance of the rover under various terrain conditions and especially under rough terrain conditions. In addition, the dynamics of the co-evolution between the controller and the threshold has been analyzed. Those analyses show that different pathways have been explored by the evolutionary process in order to adapt the sensing abilities and the control system.","1941-0026","978-1-4244-2958-5","10.1109/CEC.2009.4983290","","https://ieeexplore.ieee.org/stamp/stamp.jsp?arnumber=4983290","","Mars;Robot sensing systems;Infrared sensors;Control systems;Sensor systems;Computational modeling;Physics;Engines;Robot control;Artificial neural networks","aerospace robotics;evolutionary computation;infrared detectors;learning systems;Mars;mobile robots;neurocontrollers;planetary rovers;robot dynamics","co-evolving controller dynamics;simulated Mars Rover explorer robot;evolutionary robotics model;infrared sensor system;planetary terrain environment;physics engine;robot control system;artificial neural network training;evolutionary computation technique;adaptive threshold;neural control system","","2","","22","","29 May 2009","","","IEEE","IEEE Conferences"
"Neural-network-based optimal control for discrete-time nonlinear systems using general value iteration","L. Hongliang; L. Derong; W. Ding","State Key Laboratory of Management and Control for Complex Systems, Institute of Automation, Chinese Academy of Sciences, Beijing 100190, P.R. China; State Key Laboratory of Management and Control for Complex Systems, Institute of Automation, Chinese Academy of Sciences, Beijing 100190, P.R. China; State Key Laboratory of Management and Control for Complex Systems, Institute of Automation, Chinese Academy of Sciences, Beijing 100190, P.R. China","Proceedings of the 31st Chinese Control Conference","24 Dec 2012","2012","","","2932","2937","In this paper, we propose a novel adaptive dynamic programming (ADP) scheme based on general value iteration to obtain near optimal control for discrete-time nonlinear systems with continuous state and control space. First, the selection of initial value function is different from the traditional value iteration, and a new method is introduced to demonstrate the convergence property and convergence speed of the value function. Then, the control law obtained at each iteration can stabilize the system under some conditions. At last, three neural networks with Levenberg-Marquardt training algorithm are used to approximate the unknown nonlinear system, the value function and the optimal control law. One simulation example is presented to demonstrate the effectiveness of the present scheme.","2161-2927","978-988-15638-1-1","","","https://ieeexplore.ieee.org/stamp/stamp.jsp?arnumber=6390424","Adaptive dynamic programming;approximate dynamic programming;optimal control;value iteration;neural networks;reinforcement learning","Convergence;Optimal control;Approximation algorithms;Nonlinear systems;Equations;Approximation methods;Artificial neural networks","adaptive control;approximation theory;convergence of numerical methods;discrete time systems;dynamic programming;initial value problems;iterative methods;neurocontrollers;nonlinear control systems;optimal control;stability","neural-network-based optimal control;discrete-time nonlinear systems;general value iteration;adaptive dynamic programming scheme;ADP scheme;near optimal control;continuous state space;continuous control space;initial value function selection;convergence property;convergence speed;Levenberg-Marquardt training algorithm","","","","14","","24 Dec 2012","","","IEEE","IEEE Conferences"
"Disturbance Observer-Based Adaptive Current Control With Self-Learning Ability to Improve the Grid-Injected Current for  $LCL$ -Filtered Grid-Connected Inverter","J. Liu; W. Wu; H. S. -H. Chung; F. Blaabjerg","Department of Electronic Engineering, Shanghai Maritime University, Shanghai, China; Department of Electronic Engineering, Shanghai Maritime University, Shanghai, China; Department of Electronic Engineering, City University of Hong Kong, Hong Kong; Department of Energy Technology, Aalborg University, Aalborg, Denmark","IEEE Access","9 Aug 2019","2019","7","","105376","105390","During the design of the conventional current controller for a grid-connected inverter with LCL filter, the parameter mismatches and disturbances are generally neglected, which may seriously affect the control performance, even result in instability. In order to improve the ability of disturbance rejection and ensure a desired control performance, this paper proposes an Adaptive PID (APID) controller with the self-learning ability based on the Disturbance Observer (DOB). First, the full state-feedback and state observer are utilized to achieve active damping and eliminate the effect of computational delay. Then, aiming to estimate and compensate the lumped disturbance, a DOB is designed. Beneficial from DOB, the steady-state performance is almost not affected by model uncertainties and unmodeled dynamics, however, the transient performance is still deteriorated inevitably due to the limitation of DOB. Thus, an online adaptive method using APID is finally proposed to further improve grid-injected current dynamics. The control parameters can be automatically adjusted in real time by adaptive learning rule, which significantly improves the system robustness and the control performance. Simulation and experiments are provided to demonstrate the effectiveness of the proposed strategy.","2169-3536","","10.1109/ACCESS.2019.2931734","National Natural Science Foundation of China; National Natural Science Foundation of China; Shanghai Municipal Education Committee; Science and Technology Commission of Shanghai Municipality; ","https://ieeexplore.ieee.org/stamp/stamp.jsp?arnumber=8779641","Adaptive PID controller;disturbance observer;full state-feedback;LCL filter;state observer","Inverters;Uncertainty;Observers;Control systems;Transient analysis;Damping;Delays","adaptive control;control system synthesis;damping;electric current control;invertors;observers;power generation control;power grids;robust control;state feedback;three-term control","LCL-filtered grid-connected inverter;parameter mismatches;disturbance rejection;state observer;lumped disturbance;DOB;steady-state performance;transient performance;online adaptive method;control parameters;adaptive learning rule;current controller;control performance;adaptive PID controller;state feedback;grid-injected current dynamics;disturbance observer-based adaptive current control;self-learning ability;active damping;system robustness","","6","","34","CCBY","29 Jul 2019","","","IEEE","IEEE Journals"
"Massive Unsourced Random Access for Massive MIMO Correlated Channels","X. Xie; Y. Wu; J. Gao; W. Zhang","Shanghai Jiao Tong University,Department of Electronic Engineering,Minhang,China,200240; Shanghai Jiao Tong University,Department of Electronic Engineering,Minhang,China,200240; Shanghai Jiao Tong University,Department of Electronic Engineering,Minhang,China,200240; Shanghai Jiao Tong University,Department of Electronic Engineering,Minhang,China,200240","GLOBECOM 2020 - 2020 IEEE Global Communications Conference","15 Feb 2021","2020","","","1","6","This paper investigates the massive random access for a huge amount of user devices served by a base station (BS) equipped with a massive number of antennas. We consider a grant-free unsourced random access (U-RA) scheme where all users possess the same codebook and the BS aims at declaring a list of transmitted codewords and recovering the messages sent by active users. Most of the existing works concentrate on applying U-RA in the oversimplified independent and identically distributed (i.i.d.) channels. In this paper, we consider a fairly general joint-correlated MIMO channel model with line-of-sight components for the realistic outdoor wireless propagation environments. We conduct the activity detection for the emitted codewords by performing an improved coordinate descent approach with Bayesian learning automaton to solve a covariance-based maximum likelihood estimation problem. The proposed algorithm exhibits a faster convergence rate than traditional descent approaches. We further employ a coupled coding scheme to resolve the issue that the dimensions of the common codebook expand exponentially with user payload size in the practical massive machine-type communications scenario. Our simulations reveal that to achieve an error probability of 0.05 for reliable communications in correlated channels, one must pay a 0.9 to 1.3 dB penalty comparing to the minimum signal to noise ratio needed in i.i.d. channels on condition that a sufficient number of receiving antennas is equipped at the BS.","2576-6813","978-1-7281-8298-8","10.1109/GLOBECOM42002.2020.9347959","National Key R&D Program of China; National Science Foundation (NSFC); Shanghai Key Laboratory of Digital Media Processing and Transmission; Shanghai Key Laboratory of Digital Media Processing and Transmission; ","https://ieeexplore.ieee.org/stamp/stamp.jsp?arnumber=9347959","activity detection;correlated channel;internet of things;massive MIMO;unsourced random access","Error probability;Receiving antennas;Massive MIMO;Encoding;Channel models;Signal to noise ratio;Convergence","antenna arrays;correlation methods;error statistics;learning (artificial intelligence);learning automata;maximum likelihood estimation;MIMO communication;radiowave propagation;receiving antennas;telecommunication computing;wireless channels","massive unsourced random access;massive MIMO correlated channels;massive random access;base station;grant-free unsourced random access;transmitted codewords;line-of-sight components;realistic outdoor wireless propagation environments;activity detection;emitted codewords;improved coordinate descent approach;Bayesian learning automaton;covariance-based maximum likelihood estimation problem;coupled coding scheme;common codebook;user payload size;massive machine-type communications;descent approach;fairly general joint-correlated MIMO channel;massive antenna number;independent identically distributed channels;error probability;correlated channels;receiving antennas","","","","21","","15 Feb 2021","","","IEEE","IEEE Conferences"
"Locomotion Imitation of Humanoid Using Goal-directed Self-adjusting Adaptor","W. Yang; N. Y. Chong; C. Kim; B. J. You","School of Information Science, Japan Advanced Institute of Science and Technology, Ishikawa, Japan. woo-yang@jaist.ac.jp; School of Information Science, Japan Advanced Institute of Science and Technology, Ishikawa, Japan. nakyoung@jaist.ac.jp; Intelligent Robotics Research Center, Korea Institute of Science and Technology, Seoul, Korea. ckim@kist.re.kr; Intelligent Robotics Research Center, Korea Institute of Science and Technology, Seoul, Korea. ybj@kist.re.kr","2006 IEEE/RSJ International Conference on Intelligent Robots and Systems","15 Jan 2007","2006","","","5650","5656","We propose a novel framework for imitation learning that helps a humanoid robot achieve its goal of learning. There are apparent discrepancies in shapes and sizes among humans and humanoid robots. It would be advantageous if robots could learn their behavior from different individuals. Toward this end, this paper discusses appropriate behavior generation method through imitation learning considering that demonstrator and imitator robots have different kinematics and dynamics. As part of a wider interest in behavior generation in general, this work mainly investigates how an imitator robot adapts a reference locomotion gait captured from a demonstrator robot. Specifically, a goal-directed adaptation process that we call self-adjusting adaptor is proposed to achieve stable locomotion of the imitator. The proposed adaptor has an important role that the perceived locomotion patterns are modified to keep the direction of lower leg contacting the ground identical between the demonstrator and the imitator, sustaining the dynamic stability by controlling the position of the center of mass. The validity of the proposed scheme is evaluated through simulations employing various imitator models on OpenHRP and then verified on a real robot","2153-0866","1-4244-0258-1","10.1109/IROS.2006.282365","","https://ieeexplore.ieee.org/stamp/stamp.jsp?arnumber=4059333","Humanoid robot;Biped locomotion;Imitation learning;Self-adjusting adaptor;ZMP","Humanoid robots;Robot kinematics;Intelligent robots;Biological system modeling;Hidden Markov models;Shape;Humans;Stability;Information science;Leg","adaptive control;humanoid robots;learning (artificial intelligence);legged locomotion;position control;robot dynamics;robot kinematics;self-adjusting systems;stability","humanoid locomotion imitation;goal-directed self-adjusting adaptor;imitation learning;humanoid robot;behavior generation method;robot kinematics;robot dynamics;reference locomotion gait;goal-directed adaptation process;dynamic stability;position control;OpenHRP","","4","","22","","15 Jan 2007","","","IEEE","IEEE Conferences"
"An Adaptive Self-Tuned Wavelet Controller for IPM Motor Drives","M. A. S. K. Khan; M. A. Rahman","Power Research Laboratory, Faculty of Engineering and Applied Science, Memorial University of Newfoundland St. John’s, NL, Canada; Power Research Laboratory, Faculty of Engineering and Applied Science, Memorial University of Newfoundland St. John’s, NL, Canada","2008 IEEE Power and Energy Society General Meeting - Conversion and Delivery of Electrical Energy in the 21st Century","12 Aug 2008","2008","","","1","4","This paper presents an intelligent control system for interior permanent magnet motor drives using a wavelet neural network. The wavelet neural network combines the capability of artificial neural networks for learning from processes and the capability of wavelet decomposition for identification and control of dynamic systems. A four-layer wavelet neural network is adopted to implement the proposed controller for IPM motor drives. The inputs of the wavelet neural network are the tracking speed error and the change of speed error. The output of the wavelet neural network is the command torque current. The proposed wavelet neural network controller is trained on-line with adaptive learning rates to control the rotor position of the IPM motor drive system. The adaptive learning rates are derived using discrete Lyapunov stability theorem so that the convergence of the tracking error is guaranteed in the closed- loop system. The performance of this newly devised wavelet controller is evaluated by simulation and experimental results. The complete vector control scheme incorporating the proposed wavelet neural network controller is successfully implemented in real-time using the ds1102 digital signal processor board for the laboratory 1-hp IPM motor. In order to prove the superiority of the proposed controller over the conventional controllers a comparison between the proposed and the conventional proportional-integral (PI) and proportional-integral-derivative (PID) controllers based systems is made at various dynamic operating conditions.","1932-5517","978-1-4244-1905-0","10.1109/PES.2008.4596066","","https://ieeexplore.ieee.org/stamp/stamp.jsp?arnumber=4596066","Digital signal processor;interior permanent magnet motor;real-time implementation;vector control;wavelet controller;wavelet neural network;wavelet transform","Artificial neural networks;Motor drives;Control systems;Permanent magnet motors;Rotors;Synchronous motors;Wavelet transforms","adaptive control;motor drives;neural nets;permanent magnet motors;PI control;three-term control;wavelet transforms","adaptive self-tuned wavelet controller;IPM motor drives;permanent magnet motor drives;wavelet neural network;discrete Lyapunov stability;digital signal processor;vector control;wavelet transform;proportional-integral-derivative controllers;proportional-integral controllers","","6","","18","","12 Aug 2008","","","IEEE","IEEE Conferences"
"Supervised Prediction for Radio Network Planning Tool Using Measurements","Z. Nouir; B. Sayrac; B. Fourestie; W. Tabbara; F. Brouaye","France Telecom Research & Development Division, 38 rue du Général Leclerc, Issy Les Moulineaux France; France Telecom Research & Development Division, 38 rue du Général Leclerc, Issy Les Moulineaux France; France Telecom Research & Development Division, 38 rue du Général Leclerc, Issy Les Moulineaux France; Département de Recherche en Electromagnétisme, L2S - SUPELEC Gif sur Yvette, France; Département de Recherche en Electromagnétisme, L2S - SUPELEC Gif sur Yvette, France","2006 IEEE 17th International Symposium on Personal, Indoor and Mobile Radio Communications","11 Dec 2006","2006","","","1","5","This paper presents an efficient scheme to enhance the simulation results of a radio network planning tool by means of measurements. A multilayer perceptron (MLP) is trained to learn the mapping between the measurements and the simulations. The major contribution is the utilisation of independent component analysis (ICA) that transforms the inputs of the MLP into statistically independent variables and makes the complexity of MLP tractable. Other contributions consist of the use of the k-means clustering algorithm on the incoming data and the enrichment of the training data to enhance the generalization capability of the MLP. The proposed method is applied to a 3G mobile network to enhance the predictions of uplink (UL) and downlink (DL) base station loads. After a training performed on a given network configuration, mechanical antenna tilts are modified and we show that the results obtained by the supervised predictions are much closer to measurements than simulation results for cases that have not been encountered before","2166-9589","1-4244-0329-4","10.1109/PIMRC.2006.254248","","https://ieeexplore.ieee.org/stamp/stamp.jsp?arnumber=4022442","","Radio network;Independent component analysis;Multilayer perceptrons;Clustering algorithms;Training data;Downlink;Base stations;Performance evaluation;Antenna measurements;Mechanical variables measurement","3G mobile communication;independent component analysis;multilayer perceptrons;radio links;telecommunication computing;telecommunication network planning","supervised prediction;radio network planning tool;multilayer perceptron;MLP;independent component analysis;ICA;k-means clustering algorithm;downlink base station loads;uplink base station loads;mechanical antenna tilts;3G mobile network","","5","","10","","11 Dec 2006","","","IEEE","IEEE Conferences"
