"Teaching mobile application development through lectures, interactive tutorials, and Pair Programming","M. Seyam; D. S. McCrickard; S. Niu; A. Esakia; W. Kim","Department of Computer Science, Virginia Tech, Blacksburg, USA; Department of Computer Science, Virginia Tech, Blacksburg, USA; Department of Computer Science, Virginia Tech, Blacksburg, USA; Department of Computer Science, Virginia Tech, Blacksburg, USA; Division of Computer & Information, Dongguk University, Seoul, Korea","2016 IEEE Frontiers in Education Conference (FIE)","1 Dec 2016","2016","","","1","9","Research suggests that different teaching styles and multiple exposures of different styles to material can aid in the learning process. While there are guidelines for identifying the best teaching style for material, new and evolving areas can present unique challenges. The emerging area of mobile software development, which combines aspects of software, hardware, and interpersonal interaction, captures many such challenges; e.g., understanding how to develop for multiple screen sizes, designing for GPS time lag, dealing with unreliable sensor data. Teaching these challenging materials seemed well suited for multiple approaches that leveraged different learning styles. This paper examines three teaching approaches employed in ten teaching modules across two semesters of a mobile software development course. The approaches included lectures, interactive tutorials, and Pair Programming. Lectures were used to introduce topics and explore underlying theories of development. The lectures included time for questions from and for the students, but otherwise did not have an active learning component. Two active learning approaches used in the class were interactive tutorials and Pair Programming. Interactive tutorials presented applied development approaches, then explored their use in an individual-based hands-on demos. Pair Programming is an agile software development practice, used in both industry and education, which enforces a role-based approach to learning new programming concepts. Homeworks were used to assess learning, and surveys reflected student satisfaction. Results show areas of promise and of concern with regard to the learning styles. It seems that repetition of topics is important for mastery of the topics. Foundational theories seem well suited for lectures, while programming concepts work better in active learning situations. Additional learning took place through office hours, online question forums, and individual and group online exploration. The findings suggest specific approaches to teaching challenging and unique mobile software development topics as well as a general approach to identifying ways to distribute learning objectives across lectures, interactive tutorials, and Pair Programming sessions.","","978-1-5090-1790-4","10.1109/FIE.2016.7757533","","https://ieeexplore.ieee.org/stamp/stamp.jsp?arnumber=7757533","Mobile Application Development;Computer Science Education;Pair Programming","Mobile communication;Programming profession;Tutorials;Software;Springs","computer aided instruction;computer science education;educational courses;mobile computing;software engineering;teaching","teaching mobile application development;lectures;interactive tutorials;teaching styles;learning process;hardware;interpersonal interaction;GPS time lag;unreliable sensor data;learning styles;teaching modules;mobile software development course;active learning component;individual-based hands-on demos;agile software development practice;homeworks;student satisfaction;programming concepts;active learning situations;online question forums;group online exploration;mobile software development topics;distribute learning objectives;pair programming sessions","","2","","26","","1 Dec 2016","","","IEEE","IEEE Conferences"
"An intelligent system-centric control approach to power system stabilization using linear adaptive and optimal DHP controller","G. Swann; S. Kamalasadan","University of West Florida, Pensacola, FL 32514, USA; University of North Carolina, Charlotte, NC 28223, USA","2011 IEEE Power and Energy Society General Meeting","10 Oct 2011","2011","","","1","8","In this paper, we propose an intelligent approach to power system stabilization using a system-centric controller. This architecture uses a control algorithm based on a supervisory loop concept implemented with a system centric controller combining both a Dual Heuristic Programming (DHP) and Model Reference Adaptive Controller (MRAC) controller. The controller performance is tested on a Single Machine Infinite Bus (SMIB) power network and also on a five generator, eight bus, two area power network. Simulation studies indicate that the proposed controller is capable of improving the stabilization of the generator over the use of MRAC alone while continuously improving its performance through the use of online learning.","1944-9925","978-1-4577-1002-5","10.1109/PES.2011.6039154","","https://ieeexplore.ieee.org/stamp/stamp.jsp?arnumber=6039154","Intelligent Adaptive Control;Power System Stabilization;Intelligent controllers;Intelligent supervisory loop;System-centric controller","Artificial neural networks;Mathematical model;Power system stability;Control systems;Generators;Adaptation models;Computer architecture","adaptive control;intelligent control;learning systems;linear systems;optimal control;power system control;power system stability","intelligent system-centric control approach;power system stabilization;linear adaptive controller;optimal dual heuristic programming controller;supervisory loop concept;model reference adaptive controller;single machine infinite bus power network;online learning","","","","24","","10 Oct 2011","","","IEEE","IEEE Conferences"
"A Model Predictive based emergency control scheme using TCSC to improve power system transient stability","X. Du; D. Ernst; P. Crossley","University of Manchester, Manchester, United Kingdom; University of Liege, Liege, Belgium; University of Manchester, Manchester, United Kingdom","2012 IEEE Power and Energy Society General Meeting","10 Nov 2012","2012","","","1","7","A Model Predictive based emergency control scheme using TCSC to improve power system transient stability will be described in this paper. Supervised learning (SL) is utilized to predict power system dynamics by assuming each control action has been taken. Furthermore, a feature selection technique, that chooses the most relevant features, is used to improve the performance of the SL prediction. The model predictive control (MPC) technique is performed every discrete time interval, so the optimal control action is always selected. The proposed control scheme has been verified in a two machine four-bus system, and simulation results show it can effectively maintain system synchronism in the aftermath of a large disturbance.","1944-9925","978-1-4673-2729-9","10.1109/PESGM.2012.6344682","","https://ieeexplore.ieee.org/stamp/stamp.jsp?arnumber=6344682","","Rotors;Power system stability;Thyristors;Power system dynamics;Stability criteria;Power capacitors","discrete time systems;learning systems;optimal control;power system control;power system transient stability;predictive control","model predictive based emergency control scheme;TCSC;power system transient stability improvement;supervised learning;power system dynamic prediction;feature selection technique;SL prediction;MPC technique;discrete time interval;optimal control action;two machine four-bus system;system synchronism","","1","","17","","10 Nov 2012","","","IEEE","IEEE Conferences"
"Quick Design of Fuzzy Controllers With Good Interpretability in Mobile Robotics","M. Mucientes; J. Casillas","Santiago de Compostela Univ., Santiago de Compostela; NA","IEEE Transactions on Fuzzy Systems","13 Aug 2007","2007","15","4","636","651","This paper presents a methodology for the design of fuzzy controllers with good interpretability in mobile robotics. It is composed of a technique to automatically generate a training data set plus an efficient algorithm to learn fuzzy controllers. The proposed approach obtains a highly interpretable knowledge base in a very reduced time, and the designer only has to define the number of membership functions and the universe of discourse of each variable, together with a scoring function. In addition, the learned fuzzy controllers are general because the training set is composed of a number of automatically generated examples that cover the universe of discourse of each variable uniformly and with a predefined precision. The methodology has been applied to the design of a wall-following and moving object following behavior. Several tests in simulated environments using the Nomad 200 robot software and a comparison with another learning method show the performance and advantages of the proposed approach.","1941-0034","","10.1109/TFUZZ.2006.889889","","https://ieeexplore.ieee.org/stamp/stamp.jsp?arnumber=4286974","Ant colony optimization;behavior design;fuzzy control;learning;mobile robot navigation","Fuzzy control;Mobile robots;Robotics and automation;Automatic control;Fuzzy sets;Automatic generation control;Design methodology;Training data;Software testing;Software performance","control system CAD;fuzzy control;learning systems;mobile robots","fuzzy controller design;mobile robotics;scoring function;fuzzy controller learning;Nomad 200 robot software","","57","","45","","13 Aug 2007","","","IEEE","IEEE Journals"
"Online WTG Dynamic Performance and Transient Stability Enhancement by Evolutionary LQG","E. B. Muhando; T. Senjyu; N. Urasaki; H. Kinjo; T. Funabashi","Student Member, IEEE, Department of Electrical and Electronics Engineering, University of the Ryukyus, Senbaru 1, Nishihara, Okinawa. 903-0213 Japan. email: k058659@eve.u-ryukyu.ac.jp, b985542@tec.u-ryukyu.ac.jp; Senior Member, IEEE, Department of Electrical and Electronics Engineering, University of the Ryukyus, Senbaru 1, Nishihara, Okinawa. 903-0213 Japan. email: k058659@eve.u-ryukyu.ac.jp, b985542@tec.u-ryukyu.ac.jp; Member, IEEE, Department of Electrical and Electronics Engineering, University of the Ryukyus, Senbaru 1, Nishihara, Okinawa. 903-0213 Japan. email: k058659@eve.u-ryukyu.ac.jp, b985542@tec.u-ryukyu.ac.jp, urasaki@tec.u-ryukyu.ac.jp; Department of Mechanical Systems Engineering, University of the Ryukyus, Senbaru 1, Nishihara, Okinawa. 903-0213 Japan. email: kinjo@tec.u-ryukyu.ac.jp; Senior Member, IEEE, Meidensha Corporation, Riverside Bldg 36-2, Nihon-bashi, Hokozaki-cho, Chuo-ku, Tokyo 103-8515 Japan. email: funabashi-t@hosha.meidensha.co.jp","2007 IEEE Power Engineering Society General Meeting","23 Jul 2007","2007","","","1","8","Operation of variable speed wind turbine generator (WTG) in the above-rated region characterized by high turbulence intensities demands a trade-off between two performance metrics: maximization of energy harvested from the wind and minimization of damage caused by mechanical fatigue. This paper presents a learning adaptive controller for output power leveling and decrementing cyclic loads on the drive train. The proposed controller incorporates a linear quadratic Gaussian (LQG) and a neurocontroller (NC) and regulates rotational speed by specifying the demanded generator torque. Pitch control ensures rated power output. A second-order model and a stochastic wind field model are used in the analysis. The LQG is used as a basis upon which the performance of the proposed paradigm in the trade-off studies is assessed. Simulation results indicate the proposed control scheme effectively harmonizes the relation between rotor speed and the highly turbulent wind speed thereby regulating shaft moments and maintaining rated power.","1932-5517","1-4244-1296-X","10.1109/PES.2007.385499","","https://ieeexplore.ieee.org/stamp/stamp.jsp?arnumber=4275381","LQG;parameter variations;pitch control;transient stability;turbulence","Stability;Wind energy generation;Wind turbines;Character generation;Measurement;Fatigue;Programmable control;Adaptive control;Mechanical variables control;Power generation","adaptive control;angular velocity control;learning systems;linear quadratic Gaussian control;neurocontrollers;power system transient stability;rotors;turbogenerators;turbulence;wind power plants;wind turbines","online WTG dynamic performance;variable speed wind turbine generator;transient stability enhancement;evolutionary LQG;energy harvesting;mechanical fatigue;learning adaptive controller;linear quadratic Gaussian;neurocontroller;rotational speed regulation;generator torque;pitch control;second-order model;stochastic wind field model;rotor speed control;turbulent wind speed;shaft moments","","2","","14","","23 Jul 2007","","","IEEE","IEEE Conferences"
"Academic Adjustment: A pilot to assess the potential of a virtual mentoring scheme","J. Smailes; E. Fontainha","Northumbria University, United Kingdom; ISEG - Technical University of Lisbon, Portugal","6th Iberian Conference on Information Systems and Technologies (CISTI 2011)","4 Aug 2011","2011","","","1","6","Support systems are vital for university entrants and one established means of support is peer mentoring which has the potential to improve student engagement and retention. Mentoring models are generally based on face-to-face contact. However, given the increasing number of higher education institutions using social media, might online models be beneficial in a support context? This paper by means of examining extant literature complemented by a case study considered three virtual models: social networking sites (SNS), virtual learning environments (VLE) and virtual worlds. Findings indicated that the social networking model had the most potential. A pilot study by business programmes at Northumbria University is now being undertaken. Technical issues have been encountered and overcome. However, further analysis is required to fully establish the long term viability and potential extensions to the model.","2166-0735","978-989-96247-5-7","","","https://ieeexplore.ieee.org/stamp/stamp.jsp?arnumber=5974270","social software;collaborative learning;academic integration","Employee welfare;Education;Facebook;Second Life;Materials;Internet","computer aided instruction;social networking (online);virtual reality","academic adjustment;virtual mentoring scheme;support system;peer mentoring;student engagement;mentoring model;face-to-face contact;higher education institution;social media;online model;virtual model;social networking sites;virtual learning environment;virtual world;social networking model;Northumbria University","","","","49","","4 Aug 2011","","","IEEE","IEEE Conferences"
"Development and Stability Analysis of an Imitation Learning-Based Pose Planning Approach for Multi-Section Continuum Robot","I. A. Seleem; H. El-Hussieny; S. F. M. Assal; H. Ishii","Mechatronics and Robotics Engineering Department, School of Innovative Design Engineering, Egypt-Japan University of Science and Technology (E-JUST), New Borg El-Arab, Egypt; Department of Electrical Engineering, Faculty of Engineering (Shoubra), Benha University, Banha, Egypt; Mechatronics and Robotics Engineering Department, School of Innovative Design Engineering, Egypt-Japan University of Science and Technology (E-JUST), New Borg El-Arab, Egypt; Faculty of Science and Engineering, Waseda University, Tokyo, Japan","IEEE Access","4 Jun 2020","2020","8","","99366","99379","Recently, continuum flexible robots have been designed for the use in diverse applications; including the exploration of confined static and dynamic environments. One of the challenging tasks for those robots is planning optimal trajectories due to, not only the redundant Degrees of Freedom (DOF) they own but also their compliant behaviour. In this paper, an Imitation-based Pose Planning (IbPP) approach is proposed to teach a two-section continuum robot the motion primitives that will facilitate achieving and generalizing for spatial point-to-point motion which involves both position and orientation goals encoded in a dual quaternion form. Two novel approaches are proposed in this research to intuitively generate the motion demonstrations that will be used in the proposed IbPP. Namely, a flexible input interface, acting as a twin robot, is designed to allow a human to demonstrate different motions for the robot end-effector. Alternatively, as a second approach, the Microsoft Kinect sensor is used to provide motion demonstrations faster via human arm movements. Based on the kinematic model of the two-section continuum robot, a Model Reference Adaptive Control (MRAC) algorithm is developed to achieve tracking the generated trajectory from the IbPP and to guarantee the robustness against the model uncertainties and external disturbances. Moreover, controller stability analysis is developed based on Lyapunov criteria. Finally, simulations are conducted for the two-section continuum robot to prove the ability of the proposed IbPP with the two proposed inputs to learn and generalize for spatial motions, which in future could be easily accommodated for robots with multiple sections. In addition, the proposed MRAC shows a significant performance towards following the required trajectory and rejecting the external disturbance.","2169-3536","","10.1109/ACCESS.2020.2997636","Mission Department of the Ministry of Higher Education (MOHE) of Egypt for granting him scholarship to carry out his graduate studies with the Egypt-Japan University of Science and Technology; ","https://ieeexplore.ieee.org/stamp/stamp.jsp?arnumber=9099824","Continuum robot;kinematic modeling;motion planning;kinect sensor;kinematic control","Planning;Robot sensing systems;Kinematics;Dynamics;Trajectory;Task analysis","adaptive control;control system synthesis;end effectors;humanoid robots;learning (artificial intelligence);Lyapunov methods;manipulator dynamics;manipulator kinematics;medical robotics;mobile robots;model reference adaptive control systems;motion control;path planning;position control;robust control","two-section continuum robot;motion primitives;spatial point-to-point motion;motion demonstrations;twin robot;robot end-effector;spatial motions;multisection continuum robot;imitation learning-based pose planning approach;Microsoft Kinect sensor;controller stability analysis;Lyapunov criteria;MRAC;IbPP;dynamic environments;confined static environments;continuum flexible robots","","1","","50","CCBY","26 May 2020","","","IEEE","IEEE Journals"
"A flexible vision-based algorithm for a book sorting system","T. Gotoh; T. Toriu; S. Sasaki; M. Yoshida","Fujitsu Labs. Ltd., Kawasaki, Japan; Fujitsu Labs. Ltd., Kawasaki, Japan; Fujitsu Labs. Ltd., Kawasaki, Japan; Fujitsu Labs. Ltd., Kawasaki, Japan","IEEE Transactions on Pattern Analysis and Machine Intelligence","6 Aug 2002","1988","10","3","393","399","A flexible vision-based algorithm for a book sorting system is presented. The algorithm is based on a discrimination model that is adaptively generated for the current object classes by learning. The algorithm consists of an image normalization process, a feature element extraction process, a learning process, and a recognition process. The image normalization process extracts the contour of the object in an image, and geometrically normalizes the image. The feature extraction process converts the normalized image to the pyramidal representation, and the feature element is extracted from each resolution level. The learning process generates a discrimination model, which represents the differences between classes, based on hierarchical clustering. In the recognition process, the input images are hierarchically discriminated under the control of the decision tree. To evaluate the algorithm, a simulation system was implemented on a general-purpose computer and an image processor was developed.<>","1939-3539","","10.1109/34.3903","","https://ieeexplore.ieee.org/stamp/stamp.jsp?arnumber=3903","","Books;Sorting;Feature extraction;Image recognition;Image converters;Image resolution;Decision trees;Clustering algorithms;Computational modeling;Computer simulation","computer vision;computerised pattern recognition;computerised picture processing;learning systems","computerised picture processing;computerised pattern recognition;computer vision;flexible vision-based algorithm;book sorting system;image normalization;feature element extraction;learning process;discrimination model;hierarchical clustering","","7","","12","","6 Aug 2002","","","IEEE","IEEE Journals"
"Adaptive Optimal Control of Highly Dissipative Nonlinear Spatially Distributed Processes With Neuro-Dynamic Programming","B. Luo; H. Wu; H. Li","Science and Technology on Aircraft Control Laboratory, Beihang University, Beijing, China; Science and Technology on Aircraft Control Laboratory, Beihang University, Beijing, China; Department of Systems Engineering and Engineering Management, City University of Hong Kong, Hong Kong","IEEE Transactions on Neural Networks and Learning Systems","20 May 2017","2015","26","4","684","696","Highly dissipative nonlinear partial differential equations (PDEs) are widely employed to describe the system dynamics of industrial spatially distributed processes (SDPs). In this paper, we consider the optimal control problem of the general highly dissipative SDPs, and propose an adaptive optimal control approach based on neuro-dynamic programming (NDP). Initially, Karhunen-Loève decomposition is employed to compute empirical eigenfunctions (EEFs) of the SDP based on the method of snapshots. These EEFs together with singular perturbation technique are then used to obtain a finite-dimensional slow subsystem of ordinary differential equations that accurately describes the dominant dynamics of the PDE system. Subsequently, the optimal control problem is reformulated on the basis of the slow subsystem, which is further converted to solve a Hamilton-Jacobi-Bellman (HJB) equation. HJB equation is a nonlinear PDE that has proven to be impossible to solve analytically. Thus, an adaptive optimal control method is developed via NDP that solves the HJB equation online using neural network (NN) for approximating the value function; and an online NN weight tuning law is proposed without requiring an initial stabilizing control policy. Moreover, by involving the NN estimation error, we prove that the original closed-loop PDE system with the adaptive optimal control policy is semiglobally uniformly ultimately bounded. Finally, the developed method is tested on a nonlinear diffusion-convection-reaction process and applied to a temperature cooling fin of high-speed aerospace vehicle, and the achieved results show its effectiveness.","2162-2388","","10.1109/TNNLS.2014.2320744","National Basic Research Program of China (973 Program); National Natural Science Foundation of China; General Research Fund through the Research Grants Council of Hong Kong SAR; ","https://ieeexplore.ieee.org/stamp/stamp.jsp?arnumber=6818406","Adaptive optimal control;empirical eigenfunction (EEF);highly dissipative partial differential equations (PDEs);neuro-dynamic programming (NDP);spatially distributed processes (SDPs).;Adaptive optimal control;empirical eigenfunction (EEF);highly dissipative partial differential equations (PDEs);neuro-dynamic programming (NDP);spatially distributed processes (SDPs)","Optimal control;Artificial neural networks;Equations;Adaptive systems;Mathematical model;Vectors;Approximation methods","adaptive control;closed loop systems;dynamic programming;eigenvalues and eigenfunctions;Karhunen-Loeve transforms;neurocontrollers;nonlinear control systems;optimal control;partial differential equations;singularly perturbed systems","adaptive optimal control;nonlinear spatially distributed process;SDP;neurodynamic programming;NDP;nonlinear partial differential equation;closed-loop PDE system;Karhunen-Loève decomposition;empirical eigenfunction;EEF;singular perturbation technique;Hamilton-Jacobi-Bellman equation;HJB equation;neural network;NN;nonlinear diffusion-convection-reaction process;temperature cooling fin","Algorithms;Computer Simulation;Feedback;Humans;Neural Networks (Computer);Nonlinear Dynamics;Temperature","101","","68","","19 May 2014","","","IEEE","IEEE Journals"
