"Polynomial-based surrogate modeling of microwave structures in frequency domain exploiting the multinomial theorem","J. L. Chávez-Hurtado; J. E. Rayas-Sánchez","Department of Electronics, Systems, and Informatics, ITESO - The Jesuit University of Guadalajara, Tlaquepaque, Jalisco, 45604 Mexico; Department of Electronics, Systems, and Informatics, ITESO - The Jesuit University of Guadalajara, Tlaquepaque, Jalisco, 45604 Mexico","2016 IEEE MTT-S International Microwave Symposium (IMS)","11 Aug 2016","2016","","","1","3","We propose a methodology for developing EM-based polynomial surrogate models exploiting the multinomial theorem. Our methodology is compared against four EM surrogate modeling techniques: response surface modeling, support vector machines, generalized regression neural networks, and Kriging. Results show that the proposed polynomial surrogate modeling approach has the best performance among these techniques when using a very small amount of learning base points. The proposed methodology is illustrated by developing a surrogate model for a T-slot PIFA antenna simulated on a commercially available 3D FEM simulator.","","978-1-5090-0698-4","10.1109/MWSYM.2016.7540398","","https://ieeexplore.ieee.org/stamp/stamp.jsp?arnumber=7540398","surrogate modeling;polynomial surrogates;multinomial theorem;EM-based design;PIFA antenna;FEM","Antennas;Microwave theory and techniques;Support vector machines;Computational modeling;Optimization;Mathematical model;Response surface methodology","finite element analysis;frequency-domain analysis;neural nets;planar inverted-F antennas;polynomials;regression analysis;response surface methodology;slot antennas;support vector machines;telecommunication computing","microwave structure polynomial-based surrogate modeling;multinomial theorem;EM-based polynomial surrogate model;response surface modeling;support vector machine;generalized regression neural network;Kriging;learning base point;T-slot PIFA antenna;3D FEM simulator","","2","","12","","11 Aug 2016","","","IEEE","IEEE Conferences"
"Learning Motion Parameterizations of Mobile Pick and Place Actions from Observing Humans in Virtual Environments","G. Kazhoyan; A. Hawkin; S. Koralewski; A. Haidu; M. Beetz","University of Bremen,Institute for Artificial Intelligence,Germany; University of Bremen,Institute for Artificial Intelligence,Germany; University of Bremen,Institute for Artificial Intelligence,Germany; University of Bremen,Institute for Artificial Intelligence,Germany; University of Bremen,Institute for Artificial Intelligence,Germany","2020 IEEE/RSJ International Conference on Intelligent Robots and Systems (IROS)","10 Feb 2021","2020","","","9736","9743","In this paper, we present an approach and an implemented pipeline for transferring data acquired from observing humans in virtual environments onto robots acting in the real world, and adapting the data accordingly to achieve successful task execution. We demonstrate our pipeline by inferring seven different symbolic and subsymbolic motion parameters of mobile pick and place actions, which allows the robot to set a simple breakfast table. We propose an approach to learn general motion parameter models and discuss, which parameters can be learned at which abstraction level.","2153-0866","978-1-7281-6212-6","10.1109/IROS45743.2020.9341458","","https://ieeexplore.ieee.org/stamp/stamp.jsp?arnumber=9341458","","Adaptation models;Pipelines;Virtual environments;Task analysis;Intelligent robots","control engineering computing;mobile robots;motion control;virtual reality","task execution;subsymbolic motion parameters;motion parameterizations;virtual environments;mobile pick and place actions;data transfer;breakfast table;abstraction level","","","","16","","10 Feb 2021","","","IEEE","IEEE Conferences"
"Fast neural learning and control of discrete-time nonlinear systems","Liang Jin; P. N. Nikiforuk; M. M. Gupta","Intelligent Syst. Res. Lab., Saskatchewan Univ., Saskatoon, Sask., Canada; Intelligent Syst. Res. Lab., Saskatchewan Univ., Saskatoon, Sask., Canada; Intelligent Syst. Res. Lab., Saskatchewan Univ., Saskatoon, Sask., Canada","IEEE Transactions on Systems, Man, and Cybernetics","6 Aug 2002","1995","25","3","478","488","The problem of learning control for a general class of discrete-time nonlinear systems is addressed in this paper using multilayered neural networks (MNNs) with feedforward connections. A suitable extension of the concept of input-output linearization of discrete-time nonlinear systems is used to develop the control schemes for both output tracking and model reference control purposes. The ability of MNNs to model arbitrary nonlinear functions is incorporated to approximate the unknown nonlinear input-output relationship and its inverse using a new weight learning algorithm. In order to overcome the difficulties associated with simultaneous online identification and control in neural networks based adaptive control systems, the new learning control architectures are developed for both adaptive tracking and adaptive model reference control systems with online identification and control ability. The potentials of the proposed methods are demonstrated by simulation examples.<>","2168-2909","","10.1109/21.364860","","https://ieeexplore.ieee.org/stamp/stamp.jsp?arnumber=364860","","Nonlinear control systems;Control systems;Nonlinear systems;Neural networks;Adaptive control;Multi-layer neural network;Programmable control;Artificial neural networks;Convergence;Feedforward neural networks","nonlinear control systems;adaptive control;model reference adaptive control systems;discrete time systems;feedforward neural nets;intelligent control;identification;real-time systems;tracking","neural learning;learning control;discrete-time nonlinear systems;multilayered feedforward neural networks;input-output linearization;online identification;adaptive control;adaptive tracking;adaptive model reference control systems","","28","2","32","","6 Aug 2002","","","IEEE","IEEE Journals"
"Research on Underwater Acoustic Channel Denoising Algorithm based on Auto-Encoder","Z. Liu; Y. Duan","Taizhou Polytechnic College,Department of Information Technology,Taizhou,China; Taizhou Polytechnic College,Department of Information Technology,Taizhou,China","2019 IEEE 3rd Advanced Information Management, Communicates, Electronic and Automation Control Conference (IMCEC)","6 Feb 2020","2019","","","625","628","Aiming at the complexity of underwater communication environment, a denoising algorithm based on autoencoder (AE-DNA) is proposed. In this algorithm, the autoencoder is used as the decoder, and the network model is established by learning the training data. At the same time, in order to improve the processing ability of the network, the idea of multiple inputs and multiple outputs is introduced to convert the input dataes and the output dataes. In addition, in order to improve the generalization ability of the network, when transmitting high-order signals, signal transformation is used to reduce the complexity of the signal. The simulation results of underwater acoustic channel show that compared with the denoising algorithm based on RBF neural network (RBF-DNA), the proposed algorithm has faster convergence speed, smaller mean square error and better decoding ability.","","978-1-7281-0513-0","10.1109/IMCEC46724.2019.8984139","","https://ieeexplore.ieee.org/stamp/stamp.jsp?arnumber=8984139","autoencoder;multiple inputs and multiple outputs;signal transformation;underwater communication","","decoding;geophysical signal processing;learning (artificial intelligence);mean square error methods;neural nets;signal denoising;telecommunication computing;underwater acoustic communication;wireless channels","signal transformation;decoding ability;underwater acoustic channel denoising algorithm;underwater communication environment;autoencoder;network model;training data;processing ability;generalization ability;high-order signal transmission;AE-DNA;signal complexity reduction;mean square error","","","","8","","6 Feb 2020","","","IEEE","IEEE Conferences"
"DGPA-ACB: Adaptive RAN Overload Avoidance Control for mMTC in 5G NR","Y. Tu; R. Xu","Beijing Jiaotong University,State Key Laboratory of Rail Traffic Control and Safty,Beijing,P.R. China,100044; Beijing Jiaotong University,State Key Laboratory of Rail Traffic Control and Safty,Beijing,P.R. China,100044","2020 International Conference on Wireless Communications and Signal Processing (WCSP)","28 Dec 2020","2020","","","777","782","In order to tackle radio access network (RAN) overload problem in the random access process of machine-to-machine communication (M2M) in 5G NR scenarios, we propose an access class barring (ACB) adaptive adjustment strategy based on discrete Generalized Pursuit algorithm (DGPA) in learning automaton. First, we consider the use of the early preamble collision detection (E-PCD) technique in the detection of the preambles. After the preambles transmission are completed, the collided preambles can be distinguished from the successful preambles to avoid Msg3 collision problems. Then, according to the collided preambles and idle preambles, the number of accessing devices is estimated by the DGPA to adaptively adjust the ACB factor to reduce the access delay. Simulation results show that the proposed algorithm can achieve similar performance with the optimal ACB algorithm, assuming that the exact number of access devices is known to the gNB.","2472-7628","978-1-7281-7236-1","10.1109/WCSP49889.2020.9299677","","https://ieeexplore.ieee.org/stamp/stamp.jsp?arnumber=9299677","5G NR;mMTC;random access control;access class barring","Learning automata;Performance evaluation;Estimation;Uplink;5G mobile communication;Radio access networks;Wireless communication","5G mobile communication;adaptive control;delays;learning automata;machine-to-machine communication;radio access networks;random processes;telecommunication congestion control","collided preambles;idle preambles;ACB factor;access delay;optimal ACB algorithm;access devices;DGPA-ACB;adaptive RAN overload avoidance control;radio access network overload problem;random access process;machine-to-machine communication;5G NR scenarios;discrete generalized pursuit algorithm;learning automaton;early preamble collision detection technique;preamble transmission;Msg3 collision problems;ACB adaptive adjustment strategy;access class barring adaptive adjustment strategy;mMTC;M2M communication;DGPA;E-PCD technique","","","","12","","28 Dec 2020","","","IEEE","IEEE Conferences"
"SVC-Based Multivariate Control Charts for Automatic Anomaly Detection in Computer Networks","Z. Zhang; X. Zhu; J. Jin","Southeast University, China; FedEx Services, USA; University of Michigan, USA","Third International Conference on Autonomic and Autonomous Systems (ICAS'07)","22 Jan 2008","2007","","","56","56","The design of multivariate control charts for automatic anomaly detection in computer networks is a challenging research issue due to the complexity of the data structure of the network operational data. In general, the design of statistical multivariate control charts is limited to a Gaussian distribution assumption or a pre-known probability distribution model, which is hardly applicable to the computer operation data. The paper is motivated by this timely need to develop SVC (support vector clustering) based multivariate control charts, which do not require the data to have a pre-known probability distribution model. The proposed method is validated through the simulations by comparing with the popularly used statistical T2 multivariate control charts. The effectiveness of the method is also demonstrated through automatic anomaly detection of typical computer intrusions.","","0-7695-2859-7","10.1109/CONIELECOMP.2007.99","","https://ieeexplore.ieee.org/stamp/stamp.jsp?arnumber=4437933","intrusion detection;machine learning;control chart","Control charts;Computer networks;Static VAr compensators;Probability distribution;Mechanical engineering;Computer hacking;Computer industry;Industrial control;Data engineering;Design engineering","computer networks;control charts;data structures;optimisation;pattern clustering;statistical analysis;support vector machines;telecommunication computing;telecommunication security;unsupervised learning","SVC-based multivariate control charts;automatic anomaly detection;computer networks;data structure;support vector clustering;unsupervised kernel based control charts;optimization problem","","2","","10","","22 Jan 2008","","","IEEE","IEEE Conferences"
"Distributed energy cooperation for energy harvesting nodes using reinforcement learning","W. Lin; I. Lai; C. Lee","Research Center for Information Technology Innovation, Academia Sinica, Taipei, Taiwan; Research Center for Information Technology Innovation, Academia Sinica, Taipei, Taiwan; Research Center for Information Technology Innovation, Academia Sinica, Taipei, Taiwan","2015 IEEE 26th Annual International Symposium on Personal, Indoor, and Mobile Radio Communications (PIMRC)","3 Dec 2015","2015","","","1584","1588","Wireless communication with nodes capable of harvesting energy emerges as a new technology challenge. In this paper, we investigate the problem of utilizing energy cooperation among energy-harvesting transmitters to maximize the data rate performance. We consider a general framework which can be applied to either cellular networks with base station energy cooperation through wired power grid or sensor networks with transmitting node energy cooperation through wireless power transfer. We model this energy cooperation problem as an infinite horizon Markov decision process (MDP), which can be optimally solved by the value iteration algorithm. Since the optimal value iteration algorithm has high complexity and requires non-causal information, we propose a distributed algorithm by using reinforcement learning and splitting the MDP into several small MDPs, each associated with a transmitter. Simulation results demonstrate the effectiveness of the proposed distributed energy cooperation algorithm.","","978-1-4673-6782-0","10.1109/PIMRC.2015.7343551","","https://ieeexplore.ieee.org/stamp/stamp.jsp?arnumber=7343551","","Radio transmitters;Batteries;Receivers;Wireless communication;Power grids;Energy exchange","cellular radio;computational complexity;energy harvesting;iterative methods;learning (artificial intelligence);Markov processes;power grids;radio transmitters;telecommunication computing;telecommunication power management","iteration algorithm;MDP;infinite horizon Markov decision process;wireless power transfer;sensor network;wired power grid;base station energy cooperation;cellular network;energy harvesting transmitter;wireless communication;reinforcement learning;distributed energy cooperation","","3","","16","","3 Dec 2015","","","IEEE","IEEE Conferences"
"Improvements in principal feature classification","A. Sarma","Dept. of Autonomous Syst. & Technol., Naval Undersea Warfare Center, Newport, RI","Proceedings of the 2004 14th IEEE Signal Processing Society Workshop Machine Learning for Signal Processing, 2004.","2 May 2005","2004","","","233","242","We describe algorithms for rapid training and accurate generalization of principal feature classification (PFC) [Q. Li and D.W. Tufts, 1997], an elegant decision tree method with performance comparable to neural networks and popular decision tree methods like CART and C4.5. The improved training method is guaranteed to converge and generates a fully grown decision tree. It accomplishes this with a decrease in complexity and is described in detail to facilitate easy implementation. A generalization methodology based on nonparametric tolerance regions is also developed. The method provides accurate generalization of the fully grown tree and is verified using simulated data","1551-2541","0-7803-8608-4","10.1109/MLSP.2004.1422979","","https://ieeexplore.ieee.org/stamp/stamp.jsp?arnumber=1422979","","Decision trees;Scattering;Neural networks;Classification tree analysis;Vectors;Covariance matrix;Eigenvalues and eigenfunctions;Intelligent networks;Electronic mail;Principal component analysis","decision trees;learning systems;pattern classification;principal component analysis","principal feature classification;rapid training;decision tree method;neural networks;popular decision tree methods;CART;C4.5;generalization methodology;nonparametric tolerance regions","","","","15","","2 May 2005","","","IEEE","IEEE Conferences"
"Reward Learning from Narrated Demonstrations","H. Tung; A. W. Harley; L. Huang; K. Fragkiadaki","Carnegie Mellon Univ., Pittsburgh, PA, USA; Carnegie Mellon Univ., Pittsburgh, PA, USA; Carnegie Mellon Univ., Pittsburgh, PA, USA; Carnegie Mellon Univ., Pittsburgh, PA, USA","2018 IEEE/CVF Conference on Computer Vision and Pattern Recognition","16 Dec 2018","2018","","","7004","7013","Humans effortlessly ""program"" one another by communicating goals and desires in natural language. In contrast, humans program robotic behaviours by indicating desired object locations and poses to be achieved [5], by providing RGB images of goal configurations [19], or supplying a demonstration to be imitated [17]. None of these methods generalize across environment variations, and they convey the goal in awkward technical terms. This work proposes joint learning of natural language grounding and instructable behavioural policies reinforced by perceptual detectors of natural language expressions, grounded to the sensory inputs of the robotic agent. Our supervision is narrated visual demonstrations (NVD), which are visual demonstrations paired with verbal narration (as opposed to being silent). We introduce a dataset of NVD where teachers perform activities while describing them in detail. We map the teachers' descriptions to perceptual reward detectors, and use them to train corresponding behavioural policies in simulation. We empirically show that our instructable agents (i) learn visual reward detectors using a small number of examples by exploiting hard negative mined configurations from demonstration dynamics, (ii) develop pick-and-place policies using learned visual reward detectors, (iii) benefit from object-factorized state representations that mimic the syntactic structure of natural language goal expressions, and (iv) can execute behaviours that involve novel objects in novel locations at test time, instructed by natural language.","2575-7075","978-1-5386-6420-9","10.1109/CVPR.2018.00732","","https://ieeexplore.ieee.org/stamp/stamp.jsp?arnumber=8578830","","Visualization;Natural languages;Detectors;Grounding;Task analysis;Speech recognition;Microphones","data mining;feature extraction;human computer interaction;image colour analysis;learning (artificial intelligence);natural language processing;object detection;software agents","narrated visual demonstrations;pick-and-place policies;RGB images;narrated demonstrations;reward learning;hard negative mined configurations;instructable agents;perceptual reward detectors;verbal narration;robotic agent;natural language expressions;instructable behavioural policies;natural language grounding","","1","","54","","16 Dec 2018","","","IEEE","IEEE Conferences"
"A Framework for Online Updates to Safe Sets for Uncertain Dynamics","J. C. Shih; F. Meier; A. Rai","University of California,Department of Electrical Engineering and Computer Sciences,Berkeley; Facebook AI Research; Facebook AI Research","2020 IEEE/RSJ International Conference on Intelligent Robots and Systems (IROS)","10 Feb 2021","2020","","","5994","6001","Safety is crucial for deploying robots in the real world. One way of reasoning about safety of robots is by building safe sets through Hamilton-Jacobi (HJ) reachability. However, safe sets are often computed offline, assuming perfect knowledge of the dynamics, due to high compute time. In the presence of uncertainty, the safe set computed offline becomes inaccurate online, potentially leading to dangerous situations on the robot. We propose a novel framework to learn a safe control policy in simulation, and use it to generate online safe sets under uncertain dynamics. We start with a conservative safe set and update it online as we gather more information about the robot dynamics. We also show an application of our framework to a model-based reinforcement learning problem, proposing a safe model-based RL setup. Our framework enables robots to simultaneously learn about their dynamics, accomplish tasks, and update their safe sets. It also generalizes to complex high-dimensional dynamical systems, like 3-link manipulators and quadrotors, and reliably avoids obstacles, while achieving a task, even in the presence of unmodeled noise.","2153-0866","978-1-7281-6212-6","10.1109/IROS45743.2020.9341606","","https://ieeexplore.ieee.org/stamp/stamp.jsp?arnumber=9341606","","Uncertainty;Reinforcement learning;Safety;Reliability;Task analysis;Manipulator dynamics;Intelligent robots","collision avoidance;learning systems;robot dynamics;set theory","high-dimensional dynamical systems;online updates;uncertain dynamics;safe set;safe control policy;robot dynamics;robot safety;model-based RL setup;Hamilton-Jacobi reachability;control policy learning","","","","28","","10 Feb 2021","","","IEEE","IEEE Conferences"
"Learning electronics using image processing techniques for describing circuits to blind students","B. G. Zapirain; A. M. Zorrilla; I. Ruiz; A. Muro","Deustotech-VIDA Group, Engineering Faculty, University of Deusto, Av. Universidades 24, 48007, Bilbao (SPAIN); Deustotech-VIDA Group, Engineering Faculty, University of Deusto, Av. Universidades 24, 48007, Bilbao (SPAIN); Deustotech-VIDA Group, Engineering Faculty, University of Deusto, Av. Universidades 24, 48007, Bilbao (SPAIN); Deustotech-VIDA Group, Engineering Faculty, University of Deusto, Av. Universidades 24, 48007, Bilbao (SPAIN)","The 10th IEEE International Symposium on Signal Processing and Information Technology","10 Feb 2011","2010","","","156","160","Electronics in Engineering Degrees has pedagogical resources as documentation that are not accessible to blind or visually disabled students because they can just have a text to speech conversion of the paragraphs but not a circuits schematics to speech conversion. This work presents a open source algorithm integrated in a tool compatible with OppenOffice who applies digital image processing and computer vision techniques to any circuits schematics included in the document and provides an intelligent and automatic textual description of both the sequence of electronic components and the position in the general schematics in order to make it accessible to blind people. Lecturers and teachers will be able to create teaching materials with common applications such as Pspice or Oregano, and then they will convert the charts into accessible-content figures in a very easy way. The screen reader will let them navigate around the graph in order to access the information of a concrete element in it. Assessment has been done with real trials and a satisfaction survey.","2162-7843","978-1-4244-9991-5","10.1109/ISSPIT.2010.5711764","","https://ieeexplore.ieee.org/stamp/stamp.jsp?arnumber=5711764","Accessibility;image signal processing;computer vision;education","Wire;Europe;Text recognition;Image recognition;Educational institutions","computer aided instruction;computer vision;electronic engineering education;handicapped aids;public domain software;teaching","image processing;blind students;learning electronics;speech conversion;open source algorithm;openoffice;computer vision;circuits schematics;electronic components;teaching","","","","6","","10 Feb 2011","","","IEEE","IEEE Conferences"
"A tuning method of multi variable PID gains using Jacobian","Byeong-Mook Chung; Yoon-Kyu Lim","Sch. of Mech. Eng., Yeungnam Univ., Gyongsan, South Korea; Sch. of Mech. Eng., Yeungnam Univ., Gyongsan, South Korea","Proceedings of 2003 IEEE Conference on Control Applications, 2003. CCA 2003.","26 Aug 2003","2003","2","","886","891 vol.2","Generally, a PID controller is not suitable to control a multi variable system because it is very difficult to tune their gains. However, this paper shows that it is not hard to tune the PID gains if we can find a Jacobian matrix of the system. Because the Jacobian matrix expresses the ratio of output variations according to input variations, it is possible to adjust the input values in order to reduce the output error. If the cost function is composed of error related terms, the gradient approach can tune the PID gains to minimize the function. In simulation, a hydrofoil catamaran with two inputs and two outputs is considered as a multi variable system. We can easily obtain the multi variable PID controller by the proposed tuning method. When it was compared with a LQR controller with a modelling equation, its performance was very good.","","0-7803-7729-X","10.1109/CCA.2003.1223127","","https://ieeexplore.ieee.org/stamp/stamp.jsp?arnumber=1223127","","Gain;Jacobian matrices;Three-term control;Control systems;Cost function;Equations;Optimal control;MIMO;Error correction;Learning systems","three-term control;multivariable control systems;control system synthesis;learning systems;boats;linear quadratic control;Jacobian matrices;MIMO systems","tuning method;PID controllers;multivariable system;Jacobian matrix;cost function;error related terms;hydrofoil catamaran;LQR controller","","","","12","","26 Aug 2003","","","IEEE","IEEE Conferences"
